{
    "AANNF": {
        "short_name": "AROUNDTOWN SA",
        "long_name": "Aroundtown SA",
        "summary": "Aroundtown SA, together with its subsidiaries, operates as a real estate company in Germany, the Netherlands, the United Kingdom, Belgium, and internationally. It invests in commercial and residential real estate properties, such as office, hotel, logistics, wholesale, retail, and other properties. The company was formerly known as Aroundtown Property Holdings PLC and changed its name to Aroundtown SA in September 2017. Aroundtown SA was founded in 2004 and is based in Luxembourg City, Luxembourg.",
        "currency": "USD",
        "sector": "Real Estate",
        "industry": "Real Estate Services",
        "exchange": "PNK",
        "market": "us_market",
        "country": "Luxembourg",
        "city": "Luxembourg City"
    },
    "ADJ.DE": {
        "short_name": "ADLER GROUP S.A. NPV",
        "long_name": "ADLER Group S.A.",
        "summary": "ADLER Group S.A., together with its subsidiaries, operates as a residential real estate company in Germany. The company operates through Residential Property Management and Privatization segments. It is involved in the rental and management of residential properties, including modernization and maintenance of residential properties, management of tenancy agreements, and marketing of residential units. The company also engages in holding, operating, and selling commercial units; and the modernization, maintenance, and management of non-vacant units. As of December 31, 2018, its property portfolio consisted of 22,067 residential units with a total residential lettable area of 1,454,255 square meters; 1,450 commercial units, such as retail, office, and other commercial units with a total commercial lettable area of 171,199 square meters; and 5,401 parking spaces and spaces for storage, antennas, etc. The company was formerly known as ADO Properties S.A. and changed its name to ADLER Group S.A. in October 2020. The company was founded in 2006 and is based in Senningerberg, Luxembourg. ADLER Group S.A. is a subsidiary of ADO Group ltd.",
        "currency": "EUR",
        "sector": "Real Estate",
        "industry": "Real Estate Services",
        "exchange": "GER",
        "market": "de_market",
        "country": "Luxembourg",
        "city": "Senningerberg"
    },
    "ADJ.F": {
        "short_name": "ADLER GROUP S.A. NPV",
        "long_name": "ADLER Group S.A.",
        "summary": "ADLER Group S.A., together with its subsidiaries, operates as a residential real estate company in Germany. The company operates through Residential Property Management and Privatization segments. It is involved in the rental and management of residential properties, including modernization and maintenance of residential properties, management of tenancy agreements, and marketing of residential units. The company also engages in holding, operating, and selling commercial units; and the modernization, maintenance, and management of non-vacant units. As of December 31, 2018, its property portfolio consisted of 22,067 residential units with a total residential lettable area of 1,454,255 square meters; 1,450 commercial units, such as retail, office, and other commercial units with a total commercial lettable area of 171,199 square meters; and 5,401 parking spaces and spaces for storage, antennas, etc. The company was formerly known as ADO Properties S.A. and changed its name to ADLER Group S.A. in October 2020. The company was founded in 2006 and is based in Senningerberg, Luxembourg. ADLER Group S.A. is a subsidiary of ADO Group ltd.",
        "currency": "EUR",
        "sector": "Real Estate",
        "industry": "Real Estate Services",
        "exchange": "FRA",
        "market": "dr_market",
        "country": "Luxembourg",
        "city": "Senningerberg"
    },
    "AT1.DE": {
        "short_name": "AROUNDTOWN EO-,01",
        "long_name": "Aroundtown SA",
        "summary": "Aroundtown SA, together with its subsidiaries, operates as a real estate company in Germany, the Netherlands, the United Kingdom, Belgium, and internationally. It invests in commercial and residential real estate properties, such as office, hotel, logistics, wholesale, retail, and other properties. The company was formerly known as Aroundtown Property Holdings PLC and changed its name to Aroundtown SA in September 2017. Aroundtown SA was founded in 2004 and is based in Luxembourg City, Luxembourg.",
        "currency": "EUR",
        "sector": "Real Estate",
        "industry": "Real Estate Services",
        "exchange": "GER",
        "market": "de_market",
        "country": "Luxembourg",
        "city": "Luxembourg City"
    },
    "CCAP.DE": {
        "short_name": "CORESTATE CAPITAL HLDG",
        "long_name": "CORESTATE Capital Holding S.A.",
        "summary": "CORESTATE Capital Holding S.A. is a real estate investment firm specializing in investments in small to medium sized residential portfolios and commercial real estate markets. The firm seeks to invest in an \"anti-cyclical\" manner in Europe and expand its club-style deals from purely opportunistic to core-plus and value-add investments. The firm offers investment products in real estate funds, co-investments, and club deals. It prefers to invest in Central Europe, Austria, Switzerland, and Germany. CORESTATE Capital Holding S.A. was founded in 2006 and is based in Luxembourg, Luxembourg with additional offices in Zug, Switzerland; London, United Kingdom; Frankfurt, Germany; and Singapore. CORESTATE Capital Holding S.A. operates as a subsidiary of Flygon Holding LLC.",
        "currency": "EUR",
        "sector": "Real Estate",
        "industry": "Real Estate Services",
        "exchange": "GER",
        "market": "de_market",
        "country": "Luxembourg",
        "city": "Luxembourg"
    },
    "CCAP.F": {
        "short_name": "CORESTATE CAPITAL HLDG",
        "long_name": "CORESTATE Capital Holding S.A.",
        "summary": "CORESTATE Capital Holding S.A. is a real estate investment firm specializing in investments in small to medium sized residential portfolios and commercial real estate markets. The firm seeks to invest in an \"anti-cyclical\" manner in Europe and expand its club-style deals from purely opportunistic to core-plus and value-add investments. The firm offers investment products in real estate funds, co-investments, and club deals. It prefers to invest in Central Europe, Austria, Switzerland, and Germany. CORESTATE Capital Holding S.A. was founded in 2006 and is based in Luxembourg, Luxembourg with additional offices in Zug, Switzerland; London, United Kingdom; Frankfurt, Germany; and Singapore. CORESTATE Capital Holding S.A. operates as a subsidiary of Flygon Holding LLC.",
        "currency": "EUR",
        "sector": "Real Estate",
        "industry": "Real Estate Services",
        "exchange": "FRA",
        "market": "dr_market",
        "country": "Luxembourg",
        "city": "Luxembourg"
    },
    "GYC.DE": {
        "short_name": "GRAND CITY PROPERT.EO-,10",
        "long_name": "Grand City Properties S.A.",
        "summary": "Grand City Properties S.A. engages in the residential real estate business in Germany, the United Kingdom, and internationally. The company invests in, manages, and rents real estate properties in Berlin, North Rhine Westphalia, Dresden, Leipzig, Halle, Nuremberg, F\u00c3\u00bcrth, Munich, Mannheim, Frankfurt, Bremen, London, Mainz, and Hamburg. Grand City Properties S.A. was incorporated in 2011 and is based in Luxembourg.",
        "currency": "EUR",
        "sector": "Real Estate",
        "industry": "Real Estate Services",
        "exchange": "GER",
        "market": "de_market",
        "country": "Luxembourg",
        "city": "Luxembourg"
    },
    "GYC.F": {
        "short_name": "GRAND CITY PROPERT.EO-,10",
        "long_name": "Grand City Properties S.A.",
        "summary": "Grand City Properties S.A. engages in the residential real estate business in Germany, the United Kingdom, and internationally. The company invests in, manages, and rents real estate properties in Berlin, North Rhine Westphalia, Dresden, Leipzig, Halle, Nuremberg, F\u00c3\u00bcrth, Munich, Mannheim, Frankfurt, Bremen, London, Mainz, and Hamburg. Grand City Properties S.A. was incorporated in 2011 and is based in Luxembourg.",
        "currency": "EUR",
        "sector": "Real Estate",
        "industry": "Real Estate Services",
        "exchange": "FRA",
        "market": "dr_market",
        "country": "Luxembourg",
        "city": "Luxembourg"
    },
    "GYC.VI": {
        "short_name": "GRAND CITY PROPERTIES SA",
        "long_name": "Grand City Properties S.A.",
        "summary": "Grand City Properties S.A. engages in the residential real estate business in Germany, the United Kingdom, and internationally. The company invests in, manages, and rents real estate properties in Berlin, North Rhine Westphalia, Dresden, Leipzig, Halle, Nuremberg, F\u00c3\u00bcrth, Munich, Mannheim, Frankfurt, Bremen, London, Mainz, and Hamburg. Grand City Properties S.A. was incorporated in 2011 and is based in Luxembourg.",
        "currency": "EUR",
        "sector": "Real Estate",
        "industry": "Real Estate Services",
        "exchange": "VIE",
        "market": "at_market",
        "country": "Luxembourg",
        "city": "Luxembourg"
    },
    "SHUR.BR": {
        "short_name": "SHURGARD",
        "long_name": "Shurgard Self Storage S.A.",
        "summary": "Shurgard Self Storage S.A. engages in the acquisition, development, and operation of self-storage facilities for business and personal use in Europe. The company also offers various ancillary services at its self-storage facilities consisting of sale of storage products and provision of protection through an independent insurance company for customers' stored goods. As of March 17, 2020, it owned and operated 237 self-storage facilities that covered an approximately 1.2 million net rentable square meters under the Shurgard brand name in the Netherlands, France, Sweden, the United Kingdom, Belgium, Germany, and Denmark. The company serves approximately 160,000 customers. Shurgard Self Storage S.A. was founded in 1995 and is headquartered in Luxembourg, Luxembourg.",
        "currency": "EUR",
        "sector": "Real Estate",
        "industry": "Real Estate Services",
        "exchange": "BRU",
        "market": "be_market",
        "country": "Luxembourg",
        "city": "Luxembourg"
    },
    "STB.F": {
        "short_name": "SHURGARD SELF STORAGE",
        "long_name": "Shurgard Self Storage S.A.",
        "summary": "Shurgard Self Storage S.A. engages in the acquisition, development, and operation of self-storage facilities for business and personal use in Europe. The company also offers various ancillary services at its self-storage facilities consisting of sale of storage products and provision of protection through an independent insurance company for customers' stored goods. As of March 17, 2020, it owned and operated 237 self-storage facilities that covered an approximately 1.2 million net rentable square meters under the Shurgard brand name in the Netherlands, France, Sweden, the United Kingdom, Belgium, Germany, and Denmark. The company serves approximately 160,000 customers. Shurgard Self Storage S.A. was founded in 1995 and is headquartered in Luxembourg, Luxembourg.",
        "currency": "EUR",
        "sector": "Real Estate",
        "industry": "Real Estate Services",
        "exchange": "FRA",
        "market": "dr_market",
        "country": "Luxembourg",
        "city": "Luxembourg"
    },
    "TOWN.VI": {
        "short_name": "AROUNDTOWN SA",
        "long_name": "Aroundtown SA",
        "summary": "Aroundtown SA, together with its subsidiaries, operates as a real estate company in Germany, the Netherlands, the United Kingdom, Belgium, and internationally. It invests in commercial and residential real estate properties, such as office, hotel, logistics, wholesale, retail, and other properties. The company was formerly known as Aroundtown Property Holdings PLC and changed its name to Aroundtown SA in September 2017. Aroundtown SA was founded in 2004 and is based in Luxembourg City, Luxembourg.",
        "currency": "EUR",
        "sector": "Real Estate",
        "industry": "Real Estate Services",
        "exchange": "VIE",
        "market": "at_market",
        "country": "Luxembourg",
        "city": "Luxembourg City"
    }
}