{"I49.SI": {"short_name": "IFS Capital", "long_name": "IFS Capital Limited", "summary": "IFS Capital Limited, together with its subsidiaries, provides commercial, alternative, and structured finance services in Singapore and Southeast Asia. It operates through three segments: Credit Financing, Insurance, and Other Investments. The company offers factoring, accounts receivable financing, trade financing, mortgage financing, working capital, financing for overseas operations, asset-based and direct financing, operating leasing and consumer financing, and hire purchase services; and participates in financing by SPRING under Local Enterprise Finance scheme, as well as in financing by International Enterprise Singapore under Internationalization Finance scheme. It also provides credit insurance facilities to Singapore exporters; and issues performance bonds and guarantees, domestic maid insurance, property and casualty insurance, marine cargo and motor insurance, political risks and contractors' all risks insurance, engineering insurance, and work injury compensation insurance, as well as holds equity securities and bonds under the regulated insurance fund. In addition, the company is involved in the provision of development capital in the form of convertible debt instruments, and direct private equity investments, as well as venture capital investment activities. The company was founded in 1975 and is based in Singapore. IFS Capital Limited is a subsidiary of Phillip Assets Pte. Ltd.", "currency": "SGD", "sector": "Financial Services", "industry": "Credit Services", "exchange": "SES", "market": "sg_market", "country": "Singapore", "city": "Singapore"}, "S41.SI": {"short_name": "Hong Leong Fin", "long_name": "Hong Leong Finance Limited", "summary": "Hong Leong Finance Limited provides various financial services for business enterprises and retail customers in Singapore. It accepts savings and business current accounts, as well as fixed deposits. The company also offers new and used car, home, and private housing loans, as well as mortgage equity and share financing services. In addition, it provides small and medium enterprise (SME) loans, including accounts receivable financing, equipment loans, HDB SME loans, hire purchase, loan insurance schemes, medical asset financing, property development loans, SME care programmes, SME property loans, suppliers' invoice financing/letters of credit, and term loans/credit lines, as well as enterprise finance schemes, such as SME fixed assets, SME working capital, and trade schemes. Further, the company offers corporate finance services, including issuing management and sponsoring services; corporate advisory services in the areas of financial advisory, independent financial advisory, mergers and acquisitions, and restructuring; and Equity Fund Raising services, such as initial public offering, secondary fund raising, and underwriting of shares. It operates through a network of 28 branches and 12 SME centers. The company was founded in 1961 and is based in Singapore.", "currency": "SGD", "sector": "Financial Services", "industry": "Credit Services", "exchange": "SES", "market": "sg_market", "country": "Singapore", "city": "Singapore"}}