{"CAPMAN.HE": {"short_name": "CapMan Plc", "long_name": "CapMan Oyj", "summary": "CapMan Oyj is a private equity firm specializing in growth capital investments, industry consolidation, middle market buyouts, credit and mezzanine financing in unquoted companies. The firm focuses on mature companies in the non-strategic sectors serving Russia's large middle class. It targets companies in the technology, manufacturing, consumer goods and services, financial services, media, energy, transportation, service, retail, information technology, telecommunications, medical technology, healthcare, life sciences, e-commerce, home improvement, business services, infrastructure, real estate and private healthcare sectors. It can invest in both private as well as listed companies. The firm typically invests in companies based in the Nordic countries and Russia and also targets Central and Eastern Europe. In Russia, it focuses on investments in small and mid-sized companies with a particular focus on rural areas. With respect to middle market buyouts, the firm invests between \u00c2\u008015 million ($16.63 million) and \u00c2\u008075 million ($83.15 million) in equity capital in companies with Net sales between \u00c2\u008050 million ($55.43 million) and \u00c2\u0080300 million ($332.59 million) and/or \u00c2\u008010 million ($12.78 million) to \u00c2\u008030 million ($38.35 million) in mezzanine capital in companies with net sales ranging from \u00c2\u008050 million ($63.92 million) to \u00c2\u0080500 million ($639.27 million) and enterprise values between \u00c2\u00805 million ($6.47 million) to \u00c2\u0080500 million ($673.24 million). Its technology investments range from \u00c2\u00803 million ($3.83 million) to \u00c2\u008015 million ($19.17 million) in companies with sales more than \u00c2\u00802 million ($2.55 million). The firm invests between \u00c2\u00802 million ($2.55 million) and \u00c2\u00807 million ($8.94million) in the life sciences sector in companies with sales between \u00c2\u00802 million ($2.55 million) to \u00c2\u008020 million ($25.57 million). In Russia, it seeks to invest between \u00c2\u00805 million ($6.39 million) to \u00c2\u008015 million ($19.17 million) equity per transaction in companies having enterprise value between \u00c2\u00805 million ($6.39 million) to \u00c2\u008050 million ($63.92 million), sales ranging from \u00c2\u00805 million ($6.39 million) to \u00c2\u0080100 million ($127.85 million). Within infrastructure, it seeks to invest between \u00c2\u008020 million ($22.57 million) and \u00c2\u008050 million ($56.41 million). The firm also targets Nordic publicly listed companies with a market capitalization ranging between \u00c2\u0080100 million ($131.93 million) and \u00c2\u0080700 million ($923.48 million), and a particular focus on undervalued companies. The firm seeks to hold significant minority shareholdings in listed small and mid-cap companies and also prefers to take majority stake in companies. For Russian companies, the firm typically takes equity stake between 10 percent and 49 percent. It typically exits its investments in three to six years through trade sales and IPOs. The firm exits growth companies between four to seven years. CapMan Oyj was founded in 1989 and is based in Helsinki, Finland with additional offices in Stockholm, Sweden; Luxembourg; St. Petersburg, Russia; Copenhagen, Denmark; London, United Kingdom; and Guernsey, Channel Islands.", "currency": "EUR", "sector": "Financial Services", "industry": "Asset Management", "exchange": "HEL", "market": "fi_market", "country": "Finland", "city": "Helsinki"}, "EAB.HE": {"short_name": "EAB Group Oyj", "long_name": "EAB Group Oyj", "summary": "EAB Group Oyj is a publicly owned investment manager. The firm provides its services to private customers, companies and institutions. It manages mutual funds and special investment funds. The firm primarily invests in equity and fixed income, with a few investments in real estate. EAB Group Oyj is based in Finland.", "currency": "EUR", "sector": "Financial Services", "industry": "Asset Management", "exchange": "HEL", "market": "fi_market", "country": "Finland", "city": "Helsinki"}, "EQV1V.HE": {"short_name": "eQ Oyj", "long_name": "eQ Oyj", "summary": "eQ Oyj is a publicly owned investment manager. The firm through its subsidiaries provides asset management, corporate finance and investments. The firm specializing in fund of funds investments and secondary transactions. It seeks to make primary investments to funds being raised and to acquire commitments in the secondary market. The firm invests in venture capital and middle market funds, buyout funds, and private equity funds in the technology sector. It seeks to invest in funds based in Baltic States, Northern Europe, North America, South America, Southern Europe, CEE/SEE, Africa, United States, Western Europe, EU, Finland, Benelux, Asia, Germany, Switzerland, United Kingdom, France, Russia/CIS, Nordic Region, the former Soviet republics, and Eastern Europe. In its own funds, it invests predominantly in Northern European and North-American funds that are in the size bracket of \u00c2\u008050 and \u00c2\u0080500 million. In its client mandates, it invests in European buyout funds of any size. Typically the funds we invest in acquire majority positions in target companies. The firm was formerly known as Amanda Capital Oyj. eQ Oyj was founded in 2000 and is based in Helsinki, Finland.", "currency": "EUR", "sector": "Financial Services", "industry": "Asset Management", "exchange": "HEL", "market": "fi_market", "country": "Finland", "city": "Helsinki"}, "PNA1V.HE": {"short_name": "Panostaja Oyj", "long_name": "Panostaja Oyj", "summary": "Panostaja Oyj is a private equity firm specializing in investments in expansions through corporate acquisitions, industry consolidations, and mature and middle market investments in small and medium-sized companies through acquisitions in sectors undergoing growth and restructuring. It focuses on those companies, which seek to execute a generational or majority owner. The firm invests in diverse sectors with a focus on communications, computer related and environmental technology, forest industry, energy, transportation, agriculture and tourism. The firm prefers to invest in Finland. It invests in companies with enterprise values between \u00c2\u00805 million ($5.53 million) and \u00c2\u008025 million ($27.65 million) and net sales between EUR 10 million ($11.06 million) and 30 million ($33.18 million). The firm takes majority stakes or buys the companies in entirety and exits the investments within five to ten years. The firm typically invests through balance sheet. Panostaja Oyj was founed in 1984 and is located in Tampere, Finland with an additional office in Central Finland, Finland.", "currency": "EUR", "sector": "Financial Services", "industry": "Asset Management", "exchange": "HEL", "market": "fi_market", "country": "Finland", "city": "Tampere"}, "SIEVI.HE": {"short_name": "Sievi Capital plc", "long_name": "Sievi Capital Oyj", "summary": "Sievi Capital Oyj is a private equity arm of Jussi Capital Ltd specializing in capital investments in small and medium-sized enterprises, in turnover and net result in the medium term and long term. The firm focuses on industrial companies, either listed or unlisted. It primarily invests in investments in Denmark, Finland, Iceland, Norway, and Sweden. It seeks to acquire a significant holding and seeks a board seat on its investee companies. The firm also makes financial investments in shares, ETF instruments, structured products, corporate bonds, and other fixed-income investments. It seeks to have majority stakes. For financial investments, it holds its investments for less than three years. It seeks to make balance sheet investments. The firm was formerly known as Scanfil plc and changed its name to Sievi Capital Oyj in 2011. Sievi Capital Oyj is based in Helsinki, Finland.", "currency": "EUR", "sector": "Financial Services", "industry": "Asset Management", "exchange": "HEL", "market": "fi_market", "country": "Finland", "city": "Helsinki"}, "TAALA.HE": {"short_name": "Taaleri Oyj", "long_name": "Taaleri Oyj", "summary": "Taaleri Oyj is a publicly owned asset management holding company. The firm provides its services to private individuals, institutional investors and companies. Through its subsidiaries, the firm provides wealth management and trading services to its clients. It launches equity, fixed income, and real estate mutual funds through its subsidiaries. Through its subsidiaries, the firm invests in the public equity, fixed income, and real estate markets across the globe. It was formerly known as Taaleritehdas Oyj. Taaleri Oyj is based in Helsinki, Finland with additional offices in Tampere, Finland; Turku, Finland; Pori, Finland; Oulu, Finland; and Lahti, Finland.", "currency": "EUR", "sector": "Financial Services", "industry": "Asset Management", "exchange": "HEL", "market": "fi_market", "country": "Finland", "city": "Helsinki"}, "WE3.F": {"short_name": "SIEVI CAPITAL OYJ", "long_name": "Sievi Capital Oyj", "summary": "Sievi Capital Oyj is a private equity arm of Jussi Capital Ltd specializing in capital investments in small and medium-sized enterprises, in turnover and net result in the medium term and long term. The firm focuses on industrial companies, either listed or unlisted. It primarily invests in investments in Denmark, Finland, Iceland, Norway, and Sweden. It seeks to acquire a significant holding and seeks a board seat on its investee companies. The firm also makes financial investments in shares, ETF instruments, structured products, corporate bonds, and other fixed-income investments. It seeks to have majority stakes. For financial investments, it holds its investments for less than three years. It seeks to make balance sheet investments. The firm was formerly known as Scanfil plc and changed its name to Sievi Capital Oyj in 2011. Sievi Capital Oyj is based in Helsinki, Finland.", "currency": "EUR", "sector": "Financial Services", "industry": "Asset Management", "exchange": "FRA", "market": "dr_market", "country": "Finland", "city": "Helsinki"}}