{
    "CCET-R.BK": {
        "short_name": "CAL-COMP ELECTRONICS (THAILAND)",
        "long_name": "Cal-Comp Electronics (Thailand) Public Company Limited",
        "summary": "Cal-Comp Electronics (Thailand) Public Company Limited, together with its subsidiaries, engages in the manufacture of electronic products worldwide. The company offers computers and computer peripherals, such as mainboards, external hard disk drives, NAS and PCBA for hard disk drives, USB pen drives, storage server PCBA, and assembly products, as well as ink-jet printers, laser printers, multi-function printers, dot-matrix printers, and large format printers; telecommunication products, including set-top boxes and their component parts, and Bluetooth headsets; and smart appliances that comprise smart TV, mirrors, and POS machines, as well as digital camera PCBA and media players. It also provides consumer electronics, which include facial cleaning brushes, iron brushes, cordless airbrush makeup kits, displays, electronic keyboards, hubs, rovers, and calculators; intelligent warehouse, machinery, and robotics, as well as smart factory products; smart beauty products comprising facial moisturizing sprays, facial cleaning brushes, facial massagers, and electric toothbrushes; and healthcare and wearable devices. In addition, the company offers semiconductor design and packaging services; and robotic applications for edutainment and smart service products. Cal-Comp Electronics (Thailand) Public Company Limited was founded in 1989 and is headquartered in Bangkok, Thailand.",
        "currency": "THB",
        "sector": "Technology",
        "industry": "Computer Hardware",
        "exchange": "SET",
        "market": "th_market",
        "country": "Thailand",
        "city": "Bangkok"
    },
    "CCET.BK": {
        "short_name": "CAL-COMP ELECTRONICS (THAILAND)",
        "long_name": "Cal-Comp Electronics (Thailand) Public Company Limited",
        "summary": "Cal-Comp Electronics (Thailand) Public Company Limited, together with its subsidiaries, engages in the manufacture of electronic products worldwide. The company offers computers and computer peripherals, such as mainboards, external hard disk drives, NAS and PCBA for hard disk drives, USB pen drives, storage server PCBA, and assembly products, as well as ink-jet printers, laser printers, multi-function printers, dot-matrix printers, and large format printers; telecommunication products, including set-top boxes and their component parts, and Bluetooth headsets; and smart appliances that comprise smart TV, mirrors, and POS machines, as well as digital camera PCBA and media players. It also provides consumer electronics, which include facial cleaning brushes, iron brushes, cordless airbrush makeup kits, displays, electronic keyboards, hubs, rovers, and calculators; intelligent warehouse, machinery, and robotics, as well as smart factory products; smart beauty products comprising facial moisturizing sprays, facial cleaning brushes, facial massagers, and electric toothbrushes; and healthcare and wearable devices. In addition, the company offers semiconductor design and packaging services; and robotic applications for edutainment and smart service products. Cal-Comp Electronics (Thailand) Public Company Limited was founded in 1989 and is headquartered in Bangkok, Thailand.",
        "currency": "THB",
        "sector": "Technology",
        "industry": "Computer Hardware",
        "exchange": "SET",
        "market": "th_market",
        "country": "Thailand",
        "city": "Bangkok"
    }
}