{"GYL.OL": {"short_name": "GYLDENDAL ASA", "long_name": "Gyldendal ASA", "summary": "Gyldendal ASA, through its subsidiaries publishes and sells books in Norway. It also operates 142 bookstores; and ark.no, an online bookstore. In addition, it publishes dictionaries, and encyclopedias and other reference books in book and digital forms. The company was founded in 1925 and is based in Oslo, Norway.", "currency": "NOK", "sector": "Communication Services", "industry": "Publishing", "exchange": "OSL", "market": "no_market", "country": "Norway", "city": "Oslo"}, "SBSNF": {"short_name": "SCHIBSTED ASA", "long_name": "Schibsted ASA", "summary": "Schibsted ASA, together with its subsidiaries, operates as a media company. The company operates through Marketplaces, Publishing, and Growth segments. It operates online marketplaces that connect buyers and sellers; offers online classifieds services; and publishes printed and online newspapers, and subscription-based newspapers. The company is also involved in printing and distribution, as well as online consumer finance and price comparison activities. It operates in Norway, Sweden, France, Spain, other European countries, and internationally. The company was founded in 1839 and is headquartered in Oslo, Norway.", "currency": "USD", "sector": "Communication Services", "industry": "Publishing", "exchange": "PNK", "market": "us_market", "country": "Norway", "city": "Oslo"}, "SBSNY": {"short_name": "SCHIBSTED ASA", "long_name": "Schibsted ASA", "summary": "Schibsted ASA, together with its subsidiaries, operates as a media company. The company operates through Marketplaces, Publishing, and Growth segments. It operates online marketplaces that connect buyers and sellers; offers online classifieds services; and publishes printed and online newspapers, and subscription-based newspapers. The company is also involved in printing and distribution, as well as online consumer finance and price comparison activities. It operates in Norway, Sweden, France, Spain, other European countries, and internationally. The company was founded in 1839 and is headquartered in Oslo, Norway.", "currency": "USD", "sector": "Communication Services", "industry": "Publishing", "exchange": "PNK", "market": "us_market", "country": "Norway", "city": "Oslo"}, "SCHA.OL": {"short_name": "SCHIBSTED ASA", "long_name": "Schibsted ASA", "summary": "Schibsted ASA, together with its subsidiaries, operates as a media company. The company operates through Marketplaces, Publishing, and Growth segments. It operates online marketplaces that connect buyers and sellers; offers online classifieds services; and publishes printed and online newspapers, and subscription-based newspapers. The company is also involved in printing and distribution, as well as online consumer finance and price comparison activities. It operates in Norway, Sweden, France, Spain, other European countries, and internationally. The company was founded in 1839 and is headquartered in Oslo, Norway.", "currency": "NOK", "sector": "Communication Services", "industry": "Publishing", "exchange": "OSL", "market": "no_market", "country": "Norway", "city": "Oslo"}, "SCHB.OL": {"short_name": "SCHIBSTED ASA", "long_name": "Schibsted ASA", "summary": "Schibsted ASA, together with its subsidiaries, operates as a media company. The company operates through Marketplaces, Publishing, and Growth segments. It operates online marketplaces that connect buyers and sellers; offers online classifieds services; and publishes printed and online newspapers, and subscription-based newspapers. The company is also involved in printing and distribution, as well as online consumer finance and price comparison activities. It operates in Norway, Sweden, France, Spain, other European countries, and internationally. The company was founded in 1839 and is headquartered in Oslo, Norway.", "currency": "NOK", "sector": "Communication Services", "industry": "Publishing", "exchange": "OSL", "market": "no_market", "country": "Norway", "city": "Oslo"}, "XPG.F": {"short_name": "SCHIBSTED ASA A  NK-,50", "long_name": "Schibsted ASA", "summary": "Schibsted ASA, together with its subsidiaries, operates as a media company. The company operates through Marketplaces, Publishing, and Growth segments. It operates online marketplaces that connect buyers and sellers; offers online classifieds services; and publishes printed and online newspapers, and subscription-based newspapers. The company is also involved in printing and distribution, as well as online consumer finance and price comparison activities. It operates in Norway, Sweden, France, Spain, other European countries, and internationally. The company was founded in 1839 and is headquartered in Oslo, Norway.", "currency": "EUR", "sector": "Communication Services", "industry": "Publishing", "exchange": "FRA", "market": "dr_market", "country": "Norway", "city": "Oslo"}, "XPGB.F": {"short_name": "SCHIBSTED ASA B  NK-,50", "long_name": "Schibsted ASA", "summary": "Schibsted ASA, together with its subsidiaries, operates as a media company. The company operates through Marketplaces, Publishing, and Growth segments. It operates online marketplaces that connect buyers and sellers; offers online classifieds services; and publishes printed and online newspapers, and subscription-based newspapers. The company is also involved in printing and distribution, as well as online consumer finance and price comparison activities. It operates in Norway, Sweden, France, Spain, other European countries, and internationally. The company was founded in 1839 and is headquartered in Oslo, Norway.", "currency": "EUR", "sector": "Communication Services", "industry": "Publishing", "exchange": "FRA", "market": "dr_market", "country": "Norway", "city": "Oslo"}}