{"2007.TW": {"short_name": "YIEH HSING ENTERPRISE CO", "long_name": "Yieh Hsing Enterprise Co., Ltd.", "summary": "Yieh Hsing Enterprise Co., Ltd. produces and sells steel products in Taiwan. It offers stainless, carbon, alloy, and free-cutting steel wire rods. Its products are used in manufacturing of nuts, screws, wires, automobile parts, machine parts, hardware, tools, etc. The company also exports its products to North America, South America, China, India, South Asia, Northeast Asia, Europe, and the Middle East. The company was founded in 1978 and is based in Kaohsiung, Taiwan. Yieh Hsing Enterprise Co., Ltd. operates as a subsidiary of Yieh Phui Enterprise Co., Ltd.", "currency": "TWD", "sector": "Basic Materials", "industry": "Steel", "exchange": "TAI", "market": "tw_market", "country": "Taiwan", "city": "Kaohsiung"}, "2010.TW": {"short_name": "CHUN YUAN STEEL INDUSTRIAL CO", "long_name": "Chun Yuan Steel Industry Co., Ltd.", "summary": "Chun Yuan Steel Industry Co., Ltd. provides metal solutions primarily in Taiwan. It operates through seven divisions: Commercials Steel, Commercials Steel Regional, Electrical Steel, Special Steel, Special Steel Strip, Automated Storage System, and Construction. The company offers hot and cold rolled steel sheets and bar coils; enamel and coated steel sheets and bar coils; aluminum and alloy-aluminum sheets and coils; magnetic steel sheets comprising motor core EI sheets and magnetic steel coils; special steel materials, such as plate/bar/round/square/angled steel; cold rolled carbon bar steel coils; and copper products, including brass and phosphor bronze. It also provides steel base and reinforced plates; machinery products; steel structures; and H-beam steel and cellular H-beam steel products for welded structures. In addition, the company offers storage equipment, including logistics equipment, 3-D automated storage systems, and shelfs for heavy materials; castings, such as container angles; and stamping parts comprising autos and electric appliances parts. Further, it provides civil and construction engineering services for factory buildings, multi-storey buildings, and bridges. The company was founded in 1965 and is headquartered in Taipei City, Taiwan.", "currency": "TWD", "sector": "Basic Materials", "industry": "Steel", "exchange": "TAI", "market": "tw_market", "country": "Taiwan", "city": "Taipei"}, "2014.TW": {"short_name": "CHUNG HUNG STEEL CO", "long_name": "Chung Hung Steel Corporation", "summary": "Chung Hung Steel Corporation manufactures and sells steel products in Taiwan, Asia, the United States, Europe, and internationally. The company offers hot-rolled steel coils, cold-rolled steel coils, hot-dipped galvanized steel coils, JIS steel pipes, ASTM steel pipes, API steel pipes, and PE coated steel pipes. Its products are used in steel pipes, sports equipment, bicycles, umbrellas, oil drums, electroplated pipes, home appliances and automobile parts, furniture, floor plates, piping and plumbing, mechanical structure, piling, construction equipment, pallet, garden tube, and display stand, as well as pipe products for pipeline transportation. The company was formerly known as Yieh Loong Enterprise Co., Ltd. and changed its name to Chung Hung Steel Corporation in July 2004. Chung Hung Steel Corporation was founded in 1983 and is headquartered in Kaohsiung, Taiwan. Chung Hung Steel Corporation is a subsidiary of China Steel Corporation.", "currency": "TWD", "sector": "Basic Materials", "industry": "Steel", "exchange": "TAI", "market": "tw_market", "country": "Taiwan", "city": "Kaohsiung"}, "2015.TW": {"short_name": "FENG HSIN STEEL CO LTD", "long_name": "Feng Hsin Steel Co.,Ltd", "summary": "FENG HSIN STEEL Co., Ltd. operates in the blast furnaces and steel mills sector in Taiwan. It offers angle irons, steel channels, flat structural frames, and shafts; and angle, channel, flat, round, square, and deformed bars, as well as bars in coils and square forms, and rebars. The company was founded in 1969 and is headquartered in Taichung, Taiwan.", "currency": "TWD", "sector": "Basic Materials", "industry": "Steel", "exchange": "TAI", "market": "tw_market", "country": "Taiwan", "city": "Taichung"}, "2017.TW": {"short_name": "QUINTAIN STEEL CO LTD", "long_name": "Quintain Steel Co., LTD.", "summary": "Quintain Steel Co., LTD. produces and sells galvanized wires in Taiwan and internationally. The company offers hot rolled wire rod products; deformed bar in coil products; spheroidized annealed wire and hard drawn wire products; hot dip galvanized wire products; and ball thread/v-thread threaded rods, as well as drywall, tapping, and self drilling screw; and wood and deck screw. Its products are used primarily in the agriculture, construction, and processing industries, as well as in mesh-making and screw industries. The company was founded in 1973 and is based in Tainan City, Taiwan.", "currency": "TWD", "sector": "Basic Materials", "industry": "Steel", "exchange": "TAI", "market": "tw_market", "country": "Taiwan", "city": "Tainan City"}, "2020.TW": {"short_name": "MAYER STEEL PIPE CORP", "long_name": "Mayer Steel Pipe Corporation", "summary": "Mayer Steel Pipe Corporation manufactures steel pipes and tubular products in Taiwan. It offers welded steel pipes for low pressure use; rigid steel conduits; carbon steel tubes for machine structural purposes; electric resistance welded carbon steel tubes for automobile structural purposes; and carbon steel square pipes for general structural purposes. The company also provides stainless steel pipes, such as boiler and heat exchanger tubes; stainless steel tubes for mechanical and structural purposes, and automobile exhaust; light gauge stainless steel pipes for ordinary piping; and general service tubes. In addition, it offers stainless steel plates and sheets; stainless steel surface processing and cutting services; and stainless steel paste protective films. Further, the company produces and markets various cast, polished, electroplated, and forged aluminum alloy automotive wheels in the United States, the European Union, Japan, and Southeast Asia. Its products are also used in air conditioning, fire protection, drainage, water supply, and electricity, as well as gas, structural, and hydraulic pipe applications. Mayer Steel Pipe Corporation was founded in 1959 and is headquartered in Taipei City, Taiwan.", "currency": "TWD", "sector": "Basic Materials", "industry": "Steel", "exchange": "TAI", "market": "tw_market", "country": "Taiwan", "city": "Taipei"}, "2022.TW": {"short_name": "TYCOONS GROUP ENTERPRISE", "long_name": "Tycoons Group Enterprise Co.,Ltd.", "summary": "Tycoons Group Enterprise Co.,Ltd. produces and sells steel products worldwide. It offers billets; steel wire rods; steel bars; spheroidizing annealing wires; and drywall, roofing, wood, self-tapping, chipboard, Euro, collated, and window screws, as well as shear connectors. The company was founded in 1980 and is based in Kaohsiung City, Taiwan.", "currency": "TWD", "sector": "Basic Materials", "industry": "Steel", "exchange": "TAI", "market": "tw_market", "country": "Taiwan", "city": "Kaohsiung"}, "2023.TW": {"short_name": "YIEH PHUI ENTERPRISE CO", "long_name": "Yieh Phui Enterprise Co., Ltd.", "summary": "Yieh Phui Enterprise Co., Ltd., together with its subsidiaries, processes, manufactures, markets, imports and exports, and trades in steel products in Taiwan. It provides pickled steel coils, cold-rolled steel coils, galvanized steel coils, coated steel coils, and steel coil products; buildings, plants, and bridges steel structures; frame cranes; straddle carrier; container crane; steel pipes; aluminum-zinc plated steel coils; mechanical parts; stainless and carbon steel wires; alloy and free-cutting steel wires; steel and straight bars; and RFID products, walkie-talkies, and smart monitoring system for LED street lights, as well as OEM/ODM and piping engineering design services. The company also designs, manufactures, and installs EOT cranes, gantry cranes, and rail mounted gantry container cranes; offers black steel, pre-galvanized steel, EMT steel, square/rectangular steel, structural steel, rigid steel conduit, steel sprinkler, and oval steel pipes, as well as API casing and line pipes; develops, leases, and sells residential and commercial buildings, and department stores; manufactures and markets military specification printed circuit boards, and special high grade alloys; wholesales hardware, telecommunications equipment, and daily necessities; technical consultation for steel products; management services; manufactures metal; and mines for nickel, as well as operates hotels and radio. It exports its products to Mainland China, Southeast Asia, Europe, North America, Central and South America, Japan, the Middle East, Africa, and Australia. The company was formerly known as Kuo Chiao Enterprise Co., Ltd. and changed its name to Yieh Phui Enterprise Co., Ltd. in March 1986. Yieh Phui Enterprise Co., Ltd. was founded in 1978 and is headquartered in Kaohsiung, Taiwan.", "currency": "TWD", "sector": "Basic Materials", "industry": "Steel", "exchange": "TAI", "market": "tw_market", "country": "Taiwan", "city": "Kaohsiung"}, "2024.TW": {"short_name": "CHIH LIEN INDUSTRIAL CO", "long_name": "Chih Lien Industrial Co., Ltd.", "summary": "Chih Lien Industrial Co., Ltd. produces and supplies steel wires and steel bars in Taiwan and internationally. It offers high and low carbon, free cutting, bearing, alloy, spring, and cold heading steel wires; and free cutting, carbon, tool, alloy, spring, and stainless steel bars. The company provides its products for use in industrial machinery, precision parts, bicycles, motorcycles, automobiles, tools, household products, electronics, OA machines, springs, furniture, construction, etc. Chih Lien Industrial Co., Ltd. was founded in 1973 and is headquartered in Taoyuan City, Taiwan.", "currency": "TWD", "sector": "Basic Materials", "industry": "Steel", "exchange": "TAI", "market": "tw_market", "country": "Taiwan", "city": "Taoyuan City"}, "2027.TW": {"short_name": "TA CHEN STAINLESS PIPE CORP", "long_name": "Ta Chen Stainless Pipe Co., Ltd.", "summary": "Ta Chen Stainless Pipe Co., Ltd. produces and sells stainless steel and aluminum products. It operates in Stainless Steel and Aluminum, and Screws and Nuts segments. It offers stainless steel pipes, rolls, pipe fittings, plates, bars, valves, and castings; and imports, exports, and sells screws and nuts, as well as curtains and cloth products. The company offers its products in the United States, China, Taiwan, and internationally. Ta Chen Stainless Pipe Co., Ltd. was founded in 1986 and is headquartered in Tainan City, Taiwan.", "currency": "TWD", "sector": "Basic Materials", "industry": "Steel", "exchange": "TAI", "market": "tw_market", "country": "Taiwan", "city": "Tainan City"}, "2028.TW": {"short_name": "WEI CHIH STEEL INDUSTRIAL CO", "long_name": "Wei Chih Steel Industrial Co.,Ltd.", "summary": "Wei Chih Steel Industrial Co.,Ltd. manufactures and sells steel products in Taiwan. It primarily offers steel bars, deformed bars, steel blanks, round bars, and billets. The company was founded in 1971 is based in Tainan City, Taiwan.", "currency": "TWD", "sector": "Basic Materials", "industry": "Steel", "exchange": "TAI", "market": "tw_market", "country": "Taiwan", "city": "Tainan City"}, "2030.TW": {"short_name": "FROCH ENTERPRISE CO", "long_name": "Froch Enterprise Co., Ltd.", "summary": "Froch Enterprise Co., Ltd. manufactures, sells, and exports stainless steel welded tubes and pipes in Taiwan and internationally. It offers stainless steel pipes, large diameter stainless steel pipes, mechanical tubes, equal leg angle bars, square and rectangular tubes, sanitary tubes, inside polished pipes, coated pipes, sheets, plates, and coils, as well as flat bars; stainless steel tubes for boilers and heat-exchangers; and stainless steel light gauge tubes for general services. The company serves oil and gas, petrochemical, chemical, power utility, pulp and paper, food and beverage, automotive, furniture, construction, electronic, bio-tech, and other industries. Froch Enterprise Co., Ltd. was founded in 1970 and is headquartered in Douliu, Taiwan.", "currency": "TWD", "sector": "Basic Materials", "industry": "Steel", "exchange": "TAI", "market": "tw_market", "country": "Taiwan", "city": "Douliu"}, "2031.TW": {"short_name": "HSIN KUANG STEEL CO", "long_name": "Hsin Kuang Steel Company Limited", "summary": "Hsin Kuang Steel Company Limited engages in the cutting, stamping, and sale of various steel products in Taiwan. Its products include steel coils and plates, round steel bar, stainless and alloy steel, and special steel. The company is also involved in the investment in various businesses, including manufacturing, securities investment, banking, and insurance, etc.; sale of metal products for architecture markets; manufacture and sale of metal products and energy related equipment; leasing and warehousing; and manufacturing and processing of metal structures, architectural components, and steel products. Hsin Kuang Steel Company Limited was founded in 1967 and is based in New Taipei City, Taiwan.", "currency": "TWD", "sector": "Basic Materials", "industry": "Steel", "exchange": "TAI", "market": "tw_market", "country": "Taiwan", "city": "New Taipei City"}, "2032.TW": {"short_name": "SINKANG INDUSTRIES CO", "long_name": "Sinkang Industries Co., Ltd.", "summary": "Sinkang Industries Co., Ltd. manufactures, processes, and sells stainless steel in Taiwan and internationally. The company primarily offers SUS 300 and 400 series stainless steel. Its products are principally used in the construction and decoration, kitchen and dining cutlery, and household electrical appliances, as well as in the petrochemical, food processing, transportation equipment, electrical machinery, office equipment, and other processing industries. Sinkang Industries Co., Ltd. was founded in 1971 and is based in New Taipei City, Taiwan.", "currency": "TWD", "sector": "Basic Materials", "industry": "Steel", "exchange": "TAI", "market": "tw_market", "country": "Taiwan", "city": "New Taipei City"}, "2034.TW": {"short_name": "YC INOX CO LTD", "long_name": "YC Inox Co.,Ltd", "summary": "YC Inox Co., Ltd. manufactures and sells stainless steel products in Taiwan. It offers stainless steel coils, sheets, plates, pipes, tubes, angles, flat bars, and U channel products. The company was formerly known as Yeun Chyang Industrial Co., Ltd. and changed its name to YC Inox Co., Ltd. in July 2012. YC Inox Co., Ltd. was founded in 1973 and is headquartered in Changhua City, Taiwan.", "currency": "TWD", "sector": "Basic Materials", "industry": "Steel", "exchange": "TAI", "market": "tw_market", "country": "Taiwan", "city": "Changhua City"}, "2038.TW": {"short_name": "HAI KWANG ENTERPRISE CORPORATIO", "long_name": "Hai Kwang Enterprise Corporation", "summary": "Hai Kwang Enterprise Corporation manufactures and sells steel and billets in Taiwan and internationally. The company was founded in 1988 and is based in Kaohsiung, Taiwan.", "currency": "TWD", "sector": "Basic Materials", "industry": "Steel", "exchange": "TAI", "market": "tw_market", "country": "Taiwan", "city": "Kaohsiung"}, "2069.TW": {"short_name": "YUEN CHANG STAINLESS STEEL CO L", "long_name": "Yuen Chang Stainless Steel Co., Ltd.", "summary": "Yuen Chang Stainless Steel Co., Ltd. processes, manufactures, and supplies stainless steel products in Taiwan and internationally. The company offers stainless steel coils, sheets, plates, and strips. Its products are used in information technology, medical instruments, computer and peripherals, auto parts, home appliances, etc. The company was founded in 1987 and is headquartered in Kaohsiung, Taiwan.", "currency": "TWD", "sector": "Basic Materials", "industry": "Steel", "exchange": "TAI", "market": "tw_market", "country": "Taiwan", "city": "Kaohsiung"}}