{"C34.F": {"short_name": "CARASENT ASA  NK 1,332", "long_name": "Carasent ASA", "summary": "Carasent ASA provides cloud-based medical record services to the private and public health care industry in Nordic region. The company develops Webdoc, a cloud based EMR-system; and develops a digital platform for interactive health care to communicate through video, tele and health meetings, chat, and other online channels. It also provides training and consulting services. The company was formerly known as Apptix ASA and changed its name to Carasent ASA in May 2019. The company was founded in 1997 and is based in Oslo, Norway.", "currency": "EUR", "sector": "Healthcare", "industry": "Health Information Services", "exchange": "FRA", "market": "dr_market", "country": "Norway", "city": "Oslo"}, "CARA.OL": {"short_name": "CARASENT ASA", "long_name": "Carasent ASA", "summary": "Carasent ASA provides cloud-based medical record services to the private and public health care industry in Nordic region. The company develops Webdoc, a cloud based EMR-system; and develops a digital platform for interactive health care to communicate through video, tele and health meetings, chat, and other online channels. It also provides training and consulting services. The company was formerly known as Apptix ASA and changed its name to Carasent ASA in May 2019. The company was founded in 1997 and is based in Oslo, Norway.", "currency": "NOK", "sector": "Healthcare", "industry": "Health Information Services", "exchange": "OSL", "market": "no_market", "country": "Norway", "city": "Oslo"}, "CSAM.OL": {"short_name": "CSAM HEALTH GROUP", "long_name": "CSAM Health Group AS", "summary": "CSAM Health Group AS provides various ehealth solutions in Norway, Sweden, Denmark, and internationally. The company offers CSAM Arcidis, an integrated system for teleradiology; CSAM HelseMail for transfer of confidential patient data between healthcare organizations; CSAM Infobroker, a vendor-neutral telemedicine system for radiology that enables multiple clinicians to share resources and knowledge; CSAM S7, a platform for self-care and health counselling; CSAM Web Client, a web-based user interface and connectivity solution that allows users to access multiple CSAM applications and functions, including CSAM Cardio and CSAM Media; and CSAM XDS, a central archive for storing and managing various types of clinical patient data. It also provides CSAM CIMA, a mobile application for capturing, using, and sending medical media via mobile technology; CSAM Picsara, an image management solution that enables image capture, storing, and archiving in real time; CSAM Media, a web-based medical imaging solution; CSAM Medimaker for image management and workflow solution; and CSAM TRIS, a radiology information system. In addition, the company offers CSAM Partus, a maternity information system; CSAM Natus, a maternity care system; CSAM iPana Labor Information System, a web-based labour information system; and CSAM iPana Maternity, a cloud-based service platform that enables expectant mothers, hospitals, and maternity clinics to electronically collect, store, and share important medical information. Further, it provides CSAM AMIS, an emergency medical information system; CSAM Interactive Manchester Triage System (IMTS), an electronic tool for assessing and prioritizing patients based on the gold-standard Manchester triage scale; CSAM Paratus, an emergency response system in Sweden; CSAM Cytodose, an oncology management solution in the Nordics; and CSAM ProSang, an advanced laboratory information management system. The company was founded in 1999 and is headquartered in Oslo, Norway.", "currency": "NOK", "sector": "Healthcare", "industry": "Health Information Services", "exchange": "OSL", "market": "no_market", "country": "Norway", "city": "Oslo"}, "INDCT.OL": {"short_name": "INDUCT AS", "long_name": "Induct Software AS", "summary": "Induct Software AS offers cloud-based innovation communities delivered as software as a service. Its platform that enables organizations to create, manage, track, and measure the innovation process from idea creation through to final implementation and impact reporting. The company serves private enterprises, governments, education and science networks, and healthcare industries. Induct Software AS has a strategic partnership with ICREA to expand its market penetration and presence in the United States, Europe, Africa, Indian Subcontinent, and GCC and CIS countries. The company was founded in 2007 and is headquartered in Oslo, Norway.", "currency": "NOK", "sector": "Healthcare", "industry": "Health Information Services", "exchange": "OSL", "market": "no_market", "country": "Norway", "city": "Oslo"}, "P99.MU": {"short_name": "PATIENTSKY GRP NK-,13736", "long_name": "PatientSky Group AS", "summary": "PatientSky Group AS provides cloud data platforms for health professionals and partners. It offers PatientSky 360 platform, a low-code development platform that allows vendors to interact intra-platform and reuse applications across customers, as well as platform-as-a-service partner program that provides a white labeling of the platform's modules and app. The company was founded in 2014 and is based in Oslo, Norway.", "currency": "EUR", "sector": "Healthcare", "industry": "Health Information Services", "exchange": "MUN", "market": "dr_market", "country": "Norway", "city": "Oslo"}, "PSKY.OL": {"short_name": "PATIENTSKY GROUP", "long_name": "PatientSky Group AS", "summary": "PatientSky Group AS provides cloud data platforms for health professionals and partners. It offers PatientSky 360 platform, a low-code development platform that allows vendors to interact intra-platform and reuse applications across customers, as well as platform-as-a-service partner program that provides a white labeling of the platform's modules and app. The company was founded in 2014 and is based in Oslo, Norway.", "currency": "NOK", "sector": "Healthcare", "industry": "Health Information Services", "exchange": "OSL", "market": "no_market", "country": "Norway", "city": "Oslo"}}