{
    "2820.TW": {
        "short_name": "CHINA BILLS FINANCE CORP",
        "long_name": "China Bills Finance Corporation",
        "summary": "China Bills Finance Corporation provides various financial services in Taiwan. The company engages in the certification and underwriting of short-term bills, bank debentures, and foreign currency bills; brokerage and trading of short-term bills, bank debentures, government bonds, and foreign bonds; guaranteeing short-term bills; and provision of financial consulting services to enterprises. It is also involved in the proprietary trading of corporate bonds; equity investments; and fixed income securities trading, as well as provision of inter-bank call loans. The company operates through a network of five branches located in Banqiao, Taoyuan, Taichung, Tainan, and Kaohsiung. China Bills Finance Corporation was incorporated in 1978 and is headquartered in Taipei City, Taiwan.",
        "currency": "TWD",
        "sector": "Financial Services",
        "industry": "Capital Markets",
        "exchange": "TAI",
        "market": "tw_market",
        "country": "Taiwan",
        "city": "Taipei City"
    },
    "2889.TW": {
        "short_name": "IBF FINANCIAL HOLDINGS CO LTD",
        "long_name": "IBF Financial Holdings Co., Ltd.",
        "summary": "IBF Financial Holdings Co., Ltd., through its subsidiaries, provides various financial products and services for individual and corporate clients. The company is involved in the certification and underwriting of short-term bills, financial debentures, and securities; brokerage and proprietary trading of short-term bills, as well as futures and securities brokerage transactions; guarantee and endorsement of short-term bills; and proprietary trading of government bonds, financial debentures, corporate and foreign currency bonds, securities, and equity-related futures. It also provides corporate finance, equity, securities investment, and futures investment advisory services; financial derivatives; investment trust services; convertible bond asset services; margin lending and short sales financing; stock affairs and interbank call loans agent services; wealth management services; capital, management expertise and consultative services to investees; and general investment and financial leasing services. In addition, the company engages in the procurement of leased property, as well as leased property residual value disposal and maintenance activities; offers leasing transactions counseling, and non-financing guarantee services; and invests in equity related commodities. IBF Financial Holdings Co., Ltd. was founded in 2002 and is based in Taipei City, Taiwan.",
        "currency": "TWD",
        "sector": "Financial Services",
        "industry": "Capital Markets",
        "exchange": "TAI",
        "market": "tw_market",
        "country": "Taiwan",
        "city": "Taipei City"
    }
}