{
    "2453.TW": {
        "short_name": "SYSCOM COMPUTER",
        "long_name": "Syscom Computer Engineering Co.",
        "summary": "Syscom Computer Engineering Co. provides information technology services worldwide. It offers services in the areas of system integration, online custom information integration, e-business, high-tech manufacturing, network planning and implementation, outsourcing, hardware sales and maintenance, software development and maintenance, and training. The company's industry-specific solutions include planning, integration, deployment, and maintenance services; networking; electronic transaction real-time risk management systems; banking platforms; securities trading platforms; healthcare information solutions; telecom infrastructure; and value added telecom services. Its industry-specific solutions also comprise real-time transit system management; eGovernment; public sector unified portal platforms; information security; office automation; data warehouse outsourcing; computer centre facilities management; database design; and Internet database application design services. The company offers its solutions for financial institutions, high-tech manufacturers, public sector, securities companies, healthcare and medical industries, telecommunications, and educational institutions. Syscom Computer Engineering Co. was founded in 1975 and is headquartered in Taipei, Taiwan.",
        "currency": "TWD",
        "sector": "Technology",
        "industry": "Information Technology Services",
        "exchange": "TAI",
        "market": "tw_market",
        "country": "Taiwan",
        "city": "Taipei"
    },
    "6112.TW": {
        "short_name": "SYSAGE TECHNOLOGY",
        "long_name": "SYSAGE Technology Co., Ltd.",
        "summary": "SYSAGE Technology Co., Ltd. provides ICT solutions in Taiwan. The company offers integrated planning and system integration services for enterprise network installation, network system security, network management, and data processing analysis and backup system; develops professional application software solutions for customers; and provides related technical consultation, and education and training courses, as well as professional services, such as corporate networks solutions. It also provides network and system software and hardware products from Cisco, Oracle, IBM, etc.; develops solutions for agent products; and plans the network hardware architecture, host system, network security mechanism, database, and related enterprise application software for customers. The company's products include database and application tools, information application optimization and protection, information management, information security, virtualization system and storage platform, borderless network infrastructure, cloud, and cloud data center. It serves distribution partners and enterprise users. The company was founded in 1998 and is based in Taipei, Taiwan.",
        "currency": "TWD",
        "sector": "Technology",
        "industry": "Information Technology Services",
        "exchange": "TAI",
        "market": "tw_market",
        "country": "Taiwan",
        "city": "Taipei"
    }
}