{"4180.SR": {"short_name": "Fitaihi Holding Group", "long_name": "Fitaihi Holding Group", "summary": "Fitaihi Holding Group provides gold, jewelry, and luxury products primarily in Saudi Arabia. The company offers gifts, crystal and silverware products, antiques, chinaware, textiles, leather goods, chocolates, bed-linen, toilet sets, and accessories, as well as men's, women's, and children's wear products. It also produces agricultural products comprising wheat, potato, onion, fruits, fodder, honey, yellow corn, olive, and olive oil products, as well as animal products. In addition, the company engages in the cleaning and operation of factories, companies, buildings, and shops; and offers public, air conditioner, machinery, equipment, vehicle and device maintenance, and commercial services. Further, it is involved in the investment business, as well as operates healthcare facilities. The company retails its products and acts as an agent/distributor of various brand names, including Mont Blanc, Dunhill, Sarcar, Louis Erard, Saint Louis, Scintilla Monaco, Marina B, Talento, Rebecca, Robbe & Berking, Moser, Guy DeGrenne, Aynsley, Noritake, Nachtmann, Fratelli Rosetti, Derek Rose, Fabio Inghirami, Lanvin, Zimmerli, etc. It also exports its products. Fitaihi Holding Group was founded in 1907 and is based in Jeddah, Saudi Arabia.", "currency": "SAR", "sector": "Consumer Cyclical", "industry": "Luxury Goods", "exchange": "SAU", "market": "sr_market", "country": "Saudi Arabia", "city": "Jeddah"}}