{"IASO.AT": {"short_name": "IASO S.A. (CR)", "long_name": "IASO S.A.", "summary": "IASO S.A. operates hospitals, and a recovery and rehabilitation center in Europe. The company offers obstetrics and gynecology services, including gynecological oncology, endoscopic surgery, and pediatric and juvenile gynecology services, as well as delivery and operating rooms. It also provides diagnostics and therapeutics services comprising neonatal audiology; endocrinology, diabetes, and osteoporosis; and medical imaging, fetal medicine-gynecological ultrasounds, recurrent spontaneous abortions, neonatal cardiology, central laboratories, radiation oncology, breast center, cytology, urodynamics, medical oncology, surgical pathology, neonatal pediatrics, thyroid surgery department, and nuclear medicines, as well as plastic, reconstructive, and cosmetic surgery/laser services. In addition, the company offers outpatient department services, such as angiology, autoimmune rheumatic diseases and pregnancy, cardiology, check-up, colposcopy unit, dermatology, E.N.T, headache, hematology, nutritional support and dietetics, pediatric and adolescent gynecology, and male genito-urethral plastic surgery unit services, as well as endocrinology, diabetes, and osteoporosis services. Further, it operates intensive care, neonatal intensive care, and assisted reproduction units. IASO S.A. was founded in 1996 and is based in Athens, Greece. IASO S.A. is a subsidiary of Ocm Luxembourg Healthcare Greece S.\u00c3\u0080 R.L.", "currency": "EUR", "sector": "Healthcare", "industry": "Hospitals", "exchange": "ATH", "market": "gr_market", "country": "Greece", "city": "Athens"}, "IATR.AT": {"short_name": "ATHENS MEDICAL C.S.A. (CR)", "long_name": "Athens Medical Center S.A.", "summary": "Athens Medical Center S.A., together with its subsidiaries, owns and operates nursing units in Greece and Romania. It operates heart center, check up, PET/CT, vascular surgery, hematological, hemodialysis - artificial kidney unit, radiology, radiation therapy, and allergic, cardiac surgery, oncology, orthopedic, obstetrics \u00c2\u0096 gynecology, and robotic surgery departments. It owns and operates 7 nursing units with a total of 1,200 beds in Athens and Thessaloniki, as well as 4 diagnostic centers in Romania. Athens Medical Center S.A. was founded in 1984 and is headquartered in Athens, Greece.", "currency": "EUR", "sector": "Healthcare", "industry": "Health Care Plans", "exchange": "ATH", "market": "gr_market", "country": "Greece", "city": "Athens"}, "LAVI.AT": {"short_name": "LAVIPHARM S.A. (CR)", "long_name": "Lavipharm S.A.", "summary": "Lavipharm S.A. engages in the research, development, manufacturing, import, marketing, sales, wholesaling, and retailing of pharmaceutical, dermocosmetic, and healthcare products in Greece and internationally. The company offers pharmaceutical products for cardiology, chronic pain and oncology, central nervous system, respiratory system, gastrointestinal system, and urology; over the counter (OTC) drugs, such as antiseptics, and analgesics; gynecological products; and anti-lice treatment drugs. It also provides transdermal drug delivery systems (TDDS) related to pain management, hypertension, angina pectoris, Parkinson disease, asthma, female or male hormone replacement therapy, contraception, nausea, incontinence, etc. In addition, the company's product pipeline includes nicotine TDDS for smoking cessation; TDDS for hypertension; range of OTC products for common cold, oral hygiene, excessive excretion of shawl; food supplements; and anti-ageing products. Lavipharm S.A. was founded in 1911 and is based in Paiania, Greece.", "currency": "EUR", "sector": "Healthcare", "industry": "Drug Manufacturers - Major", "exchange": "ATH", "market": "gr_market", "country": "Greece", "city": "Paiania"}}