{"SARKY.IS": {"short_name": "SARKUYSAN", "long_name": "Sarkuysan Elektrolitik Bakir Sanayi ve Ticaret A.S.", "summary": "Sarkuysan Elektrolitik Bakir Sanayi ve Ticaret A.S., together with its subsidiaries, produces and trades in electrolytic copper wire, copper, and copper alloys in Turkey. It offers electrolytic copper cathode products; oxygen free and ETP wire rods; DHP and ETP copper billets; bare, tin plated, and nickel plated copper single wires; bare and tin plated, and nickel plated multi wires, as well as bare and tin plated multi wires on braider bobbins; and bare, tin plated, and nickel plated bunched conductors. The company also provides flat wires and profiles, and PV ribbon wires; copper and copper alloy contact wires, and stranded copper and copper alloy conductors; copper tubes and busbars; and copper nuggets. In addition, it manufactures, imports, and exports steel spool packaging materials and machineries; and offers marketing and distribution services, as well as rents properties. The company's products are used in various industries, including electro technique, electronic, motor, communication, power generation and distribution, solar and renewable energy, home appliances, measurement instruments, defense, automotive, chemical, construction, heating, air-conditioning, and sanitary plumbing. It also exports its products to approximately 70 countries worldwide. The company was founded in 1972 and is headquartered in Darica, Turkey.", "currency": "TRY", "sector": "Basic Materials", "industry": "Copper", "exchange": "IST", "market": "tr_market", "country": "Turkey", "city": "Darica"}}