{
    "KEM.F": {
        "short_name": "KEMIRA OY",
        "long_name": "Kemira Oyj",
        "summary": "Kemira Oyj operates as a chemicals company in Finland, rest of Europe, the Middle East, Africa, the Americas, and the Asia Pacific. It operates in two segments, Pulp & Paper and Industry & Water. The Pulp & Paper segment develops and commercializes pulp, paper, and packaging chemicals, as well as a range of products for paper wet-end, including packaging and board, and tissue products. The Industry & Water segment offers coagulants, polymers, and other water treatment chemicals for raw water, waste water and sludge treatment, friction reduction, tailing treatment, mining processes, and oil recovery applications. Kemira Oyj was founded in 1920 and is headquartered in Helsinki, Finland.",
        "currency": "EUR",
        "sector": "Basic Materials",
        "industry": "Chemicals",
        "exchange": "FRA",
        "market": "dr_market",
        "country": "Finland",
        "city": "Helsinki"
    },
    "KEMIRA.HE": {
        "short_name": "Kemira Oyj",
        "long_name": "Kemira Oyj",
        "summary": "Kemira Oyj operates as a chemicals company in Finland, rest of Europe, the Middle East, Africa, the Americas, and the Asia Pacific. It operates in two segments, Pulp & Paper and Industry & Water. The Pulp & Paper segment develops and commercializes pulp, paper, and packaging chemicals, as well as a range of products for paper wet-end, including packaging and board, and tissue products. The Industry & Water segment offers coagulants, polymers, and other water treatment chemicals for raw water, waste water and sludge treatment, friction reduction, tailing treatment, mining processes, and oil recovery applications. Kemira Oyj was founded in 1920 and is headquartered in Helsinki, Finland.",
        "currency": "EUR",
        "sector": "Basic Materials",
        "industry": "Chemicals",
        "exchange": "HEL",
        "market": "fi_market",
        "country": "Finland",
        "city": "Helsinki"
    }
}