{"TKM1T.TL": {"short_name": "Tallinna Kaubamaja Grupp", "long_name": "Tallinna Kaubamaja Grupp AS", "summary": "Tallinna Kaubamaja Grupp AS, together with its subsidiaries, owns and operates supermarkets and department stores in Estonia. It offers beauty products trading, security services, car trading, and footwear trading; sells fashion items, food products, home items, and beauty and children's products through its department stores; and offers takeaway food, salads, desserts, sandwiches, confectionary and baked products, and catering products under Selveri K\u00c3\u00b6\u00c3\u00b6k and Gurmee Catering brands for retail companies and other food industries, as well as catering and party organization services, and sale of catering products by means of an online store. The company also retails and wholesales beauty products and toiletries under I.L.U. brand in Tallinn, Tartu, and P\u00c3\u00a4rnu; retails shoes under ABC King and Shu brands; retails and distributes KIA, OPEL, Cadillac, SAAB, Corvette, Hummer, and Peugeot vehicles; plans, installs, and maintains security equipment; and develops, administers, and rents/leases a shopping centre, Selver stores, commercial premises, and business buildings. The company was formerly known as Tallinna Kaubamaja AS and changed its name to Tallinna Kaubamaja Grupp AS in April 2015. The company was founded in 1960 and is based in Tallinn, Estonia. Tallinna Kaubamaja Grupp AS is a subsidiary of O\u00c3\u009c NG Investeeringud.", "currency": "EUR", "sector": "Consumer Cyclical", "industry": "Department Stores", "exchange": "TAL", "market": "tl_market", "country": "Estonia", "city": "Tallinn"}, "UE8.F": {"short_name": "TALLINNA KAUBAM.GP EO-,40", "long_name": "Tallinna Kaubamaja Grupp AS", "summary": "Tallinna Kaubamaja Grupp AS, together with its subsidiaries, owns and operates supermarkets and department stores in Estonia. It offers beauty products trading, security services, car trading, and footwear trading; sells fashion items, food products, home items, and beauty and children's products through its department stores; and offers takeaway food, salads, desserts, sandwiches, confectionary and baked products, and catering products under Selveri K\u00c3\u00b6\u00c3\u00b6k and Gurmee Catering brands for retail companies and other food industries, as well as catering and party organization services, and sale of catering products by means of an online store. The company also retails and wholesales beauty products and toiletries under I.L.U. brand in Tallinn, Tartu, and P\u00c3\u00a4rnu; retails shoes under ABC King and Shu brands; retails and distributes KIA, OPEL, Cadillac, SAAB, Corvette, Hummer, and Peugeot vehicles; plans, installs, and maintains security equipment; and develops, administers, and rents/leases a shopping centre, Selver stores, commercial premises, and business buildings. The company was formerly known as Tallinna Kaubamaja AS and changed its name to Tallinna Kaubamaja Grupp AS in April 2015. The company was founded in 1960 and is based in Tallinn, Estonia. Tallinna Kaubamaja Grupp AS is a subsidiary of O\u00c3\u009c NG Investeeringud.", "currency": "EUR", "sector": "Consumer Cyclical", "industry": "Department Stores", "exchange": "FRA", "market": "dr_market", "country": "Estonia", "city": "Tallinn"}}