{
    "AM8.F": {
        "short_name": "AMAG AUSTRIA METALL INH.",
        "long_name": "AMAG Austria Metall AG",
        "summary": "AMAG Austria Metall AG, together with its subsidiaries, produces, processes, and distributes aluminum, and aluminum wrought and cast products in Austria, Western Europe, rest of Europe, North America, Asia, Oceania, and internationally. It operates through Metal, Casting, Rolling, and Service divisions. The Metal division produces and markets primary aluminum, and manages metal production streams. The Casting division produces cast aluminum alloys from aluminum scrap for use by various sectors, including the automotive sector and supply industry, as well as the engineering and electrical engineering sectors. Its product portfolio covers materials tailored to customer requirements in the form of ingots, sows, and liquid aluminum. The Rolling division manufactures rolled aluminum products, such as sheets, strips, and plates for applications in the automotive and aviation, as well as in the sports, engineering, transportation, and other industrial sectors. It also specializes in bright products, customized cathode elements for zinc smelters, brazing materials, tread plate, and high strength alloys, as well as foil stock for the packaging industry. The Service division provides facility management, energy supply, waste disposal, general site, and materials management services. AMAG Austria Metall AG is headquartered in Ranshofen, Austria.",
        "currency": "EUR",
        "sector": "Basic Materials",
        "industry": "Aluminum",
        "exchange": "FRA",
        "market": "dr_market",
        "country": "Austria",
        "city": "Ranshofen"
    },
    "AMAG.VI": {
        "short_name": "AMAG AUSTRIA METALL AG",
        "long_name": "AMAG Austria Metall AG",
        "summary": "AMAG Austria Metall AG, together with its subsidiaries, produces, processes, and distributes aluminum, and aluminum wrought and cast products in Austria, Western Europe, rest of Europe, North America, Asia, Oceania, and internationally. It operates through Metal, Casting, Rolling, and Service divisions. The Metal division produces and markets primary aluminum, and manages metal production streams. The Casting division produces cast aluminum alloys from aluminum scrap for use by various sectors, including the automotive sector and supply industry, as well as the engineering and electrical engineering sectors. Its product portfolio covers materials tailored to customer requirements in the form of ingots, sows, and liquid aluminum. The Rolling division manufactures rolled aluminum products, such as sheets, strips, and plates for applications in the automotive and aviation, as well as in the sports, engineering, transportation, and other industrial sectors. It also specializes in bright products, customized cathode elements for zinc smelters, brazing materials, tread plate, and high strength alloys, as well as foil stock for the packaging industry. The Service division provides facility management, energy supply, waste disposal, general site, and materials management services. AMAG Austria Metall AG is headquartered in Ranshofen, Austria.",
        "currency": "EUR",
        "sector": "Basic Materials",
        "industry": "Aluminum",
        "exchange": "VIE",
        "market": "at_market",
        "country": "Austria",
        "city": "Ranshofen"
    }
}