{
    "WBRBY": {
        "short_name": "WIENERBERGER AG",
        "long_name": "Wienerberger AG",
        "summary": "Wienerberger AG produces and sells bricks, roof tiles, concrete pavers, and pipe systems in Europe. It operates through Wienerberger Building Solutions, Wienerberger Piping Solutions, and North America segments. The company offers clay blocks for exterior walls, load and non-load-bearing interior walls, and partition walls, as well as for infill and separating walls under the Porotherm and POROTON brand names; facing bricks for fa\u00c3\u00a7ades under the Terca brand, and ceramic fa\u00c3\u00a7ade tiles under the Argeton brand for hospitals, schools, factories, and offices; clay roof tiles under the Koramic, Sandtoft, and Tondach brands; vitrified clay pipes and fittings, shafts, and accessories for sewage systems; and concrete and clay pavements for various applications that include pedestrian zones, public spaces in train stations or airports, and private terraces or gardens under the Semmelrock brand name, as well as paving bricks and terrace tiles under the Penter brand. It also provides plastic pipes, pipe systems, and pipe fittings for sewage disposal and rainwater drainage; sanitation and heating technology; and supplying energy, gas, and drinking water under the Pipelife brand. Wienerberger AG was founded in 1819 and is headquartered in Vienna, Austria.",
        "currency": "USD",
        "sector": "Basic Materials",
        "industry": "Building Materials",
        "exchange": "PNK",
        "market": "us_market",
        "country": "Austria",
        "city": "Vienna"
    },
    "WIB.DE": {
        "short_name": "WIENERBERGER",
        "long_name": "Wienerberger AG",
        "summary": "Wienerberger AG produces and sells bricks, roof tiles, concrete pavers, and pipe systems in Europe. It operates through Wienerberger Building Solutions, Wienerberger Piping Solutions, and North America segments. The company offers clay blocks for exterior walls, load and non-load-bearing interior walls, and partition walls, as well as for infill and separating walls under the Porotherm and POROTON brand names; facing bricks for fa\u00c3\u00a7ades under the Terca brand, and ceramic fa\u00c3\u00a7ade tiles under the Argeton brand for hospitals, schools, factories, and offices; clay roof tiles under the Koramic, Sandtoft, and Tondach brands; vitrified clay pipes and fittings, shafts, and accessories for sewage systems; and concrete and clay pavements for various applications that include pedestrian zones, public spaces in train stations or airports, and private terraces or gardens under the Semmelrock brand name, as well as paving bricks and terrace tiles under the Penter brand. It also provides plastic pipes, pipe systems, and pipe fittings for sewage disposal and rainwater drainage; sanitation and heating technology; and supplying energy, gas, and drinking water under the Pipelife brand. Wienerberger AG was founded in 1819 and is headquartered in Vienna, Austria.",
        "currency": "EUR",
        "sector": "Basic Materials",
        "industry": "Building Materials",
        "exchange": "GER",
        "market": "de_market",
        "country": "Austria",
        "city": "Vienna"
    },
    "WIB.F": {
        "short_name": "WIENERBERGER",
        "long_name": "Wienerberger AG",
        "summary": "Wienerberger AG produces and sells bricks, roof tiles, concrete pavers, and pipe systems in Europe. It operates through Wienerberger Building Solutions, Wienerberger Piping Solutions, and North America segments. The company offers clay blocks for exterior walls, load and non-load-bearing interior walls, and partition walls, as well as for infill and separating walls under the Porotherm and POROTON brand names; facing bricks for fa\u00c3\u00a7ades under the Terca brand, and ceramic fa\u00c3\u00a7ade tiles under the Argeton brand for hospitals, schools, factories, and offices; clay roof tiles under the Koramic, Sandtoft, and Tondach brands; vitrified clay pipes and fittings, shafts, and accessories for sewage systems; and concrete and clay pavements for various applications that include pedestrian zones, public spaces in train stations or airports, and private terraces or gardens under the Semmelrock brand name, as well as paving bricks and terrace tiles under the Penter brand. It also provides plastic pipes, pipe systems, and pipe fittings for sewage disposal and rainwater drainage; sanitation and heating technology; and supplying energy, gas, and drinking water under the Pipelife brand. Wienerberger AG was founded in 1819 and is headquartered in Vienna, Austria.",
        "currency": "EUR",
        "sector": "Basic Materials",
        "industry": "Building Materials",
        "exchange": "FRA",
        "market": "dr_market",
        "country": "Austria",
        "city": "Vienna"
    },
    "WIE.VI": {
        "short_name": "WIENERBERGER AG",
        "long_name": "Wienerberger AG",
        "summary": "Wienerberger AG produces and sells bricks, roof tiles, concrete pavers, and pipe systems in Europe. It operates through Wienerberger Building Solutions, Wienerberger Piping Solutions, and North America segments. The company offers clay blocks for exterior walls, load and non-load-bearing interior walls, and partition walls, as well as for infill and separating walls under the Porotherm and POROTON brand names; facing bricks for fa\u00c3\u00a7ades under the Terca brand, and ceramic fa\u00c3\u00a7ade tiles under the Argeton brand for hospitals, schools, factories, and offices; clay roof tiles under the Koramic, Sandtoft, and Tondach brands; vitrified clay pipes and fittings, shafts, and accessories for sewage systems; and concrete and clay pavements for various applications that include pedestrian zones, public spaces in train stations or airports, and private terraces or gardens under the Semmelrock brand name, as well as paving bricks and terrace tiles under the Penter brand. It also provides plastic pipes, pipe systems, and pipe fittings for sewage disposal and rainwater drainage; sanitation and heating technology; and supplying energy, gas, and drinking water under the Pipelife brand. Wienerberger AG was founded in 1819 and is headquartered in Vienna, Austria.",
        "currency": "EUR",
        "sector": "Basic Materials",
        "industry": "Building Materials",
        "exchange": "VIE",
        "market": "at_market",
        "country": "Austria",
        "city": "Vienna"
    }
}