{"ACNV.PA": {"short_name": null, "long_name": "Accor SA", "summary": "Accor SA operates a chain of hotels. It operates through three segments: HotelServices, Hotel Assets & Others, and New Businesses. The company owns, operates, manages, and franchises hotels. It also provides digital solutions to independent hotel operators and restaurant owners through D-edge, ResDiary, and Adoria platforms; and hotel booking services for travels agencies and corporates through Gekko solutions. In addition, the company offers concierge services; and digital sales through VeryChic, which offers private sales with luxury and high-end partners, as well as rents private luxury homes, such as onefinestay. As of December 31, 2019, it operated 5,089 hotels with 746,504 rooms in 111 countries worldwide. The company was founded in 1967 and is headquartered in Issy-les-Moulineaux, France.", "currency": "EUR", "sector": "Services", "industry": "Lodging", "exchange": "PAR", "market": "fr_market", "country": "France", "city": "Issy-les-Moulineaux"}, "LAMPS.AT": {"short_name": "Lampsa Hotel Co. (C)", "long_name": "Lampsa Hellenic Hotels S.A.", "summary": "Lampsa Hellenic Hotels S.A. operates hotels primarily in Greece, Cyprus, and Serbia. The company operates the Hotel Grande Bretagne that includes 320 rooms and suites located in Athens; the King George hotel with 59 rooms and 43 suites in Athens; and the Sheraton Rhodes Resort, which comprises 401 guestrooms situated on the island of Rhodes. It also operates the Hyatt Regency Hotel that includes 301 luxury rooms, suites, and facilities for recreation and dining located in Belgrade; and the Hotel Excelsior, which has 76 rooms, 2 junior suites, a banquet area, and a restaurant located in Belgrade. Lampsa Hellenic Hotels S.A. is headquartered in Athens, Greece.", "currency": "EUR", "sector": "Services", "industry": "Lodging", "exchange": "ATH", "market": "gr_market", "country": "Greece", "city": "Athens"}, "PRESD.AT": {"short_name": "GEKE S.A. (CR)", "long_name": "Geke S.A.", "summary": "Geke S.A. engages in the hotel business. It operates the President Hotel, which consists of rooms, parking facilities, lobby bar, meeting/banquet and event facilities, library, games room, and various other services, as well as penthouse pool. The company is based in Athens, Greece.", "currency": "EUR", "sector": "Services", "industry": "Lodging", "exchange": "ATH", "market": "gr_market", "country": "Greece", "city": "Athens"}}