{
    "EUK.MI": {
        "short_name": "EUKEDOS",
        "long_name": "EuKedos S.p.A.",
        "summary": "EuKedos S.p.A. provides managed and long-term care services in Italy. The company offers residential social care services to elderly, self-sufficient, or incapacitated adults. It manages healthcare and assistance residences with 1,345 beds in the North and Central Italy, primarily located in Lombardy, Piedmont, Abruzzo, Valle D'Aosta, and Emilia Romagna. EuKedos S.p.A. is based in Florence, Italy.",
        "currency": "EUR",
        "sector": "Healthcare",
        "industry": "Medical Care Facilities",
        "exchange": "MIL",
        "market": "it_market",
        "country": "Italy",
        "city": "Florence"
    },
    "GHC.F": {
        "short_name": "GAROFALO HEALTH CARE",
        "long_name": "Garofalo Health Care S.p.A.",
        "summary": "Garofalo Health Care S.p.A. operates healthcare centers in Italy. It offers services in the areas of high-complexity surgery, medium- and low-complexity surgery, emergency surgery, medicine, clinical and interventional cardiology, and extended and intensive care units, as well as motor, neurological, cardiac, and nutritional rehabilitation. The company also operates centers for patients in coma and persistent vegetative states; and psychiatric and diagnostic centers. It operates 19 healthcare facilities located in Piedmont, Veneto, Tuscany, Emilia-Romagna, Lazio, and Liguria. The company is based in Rome, Italy.",
        "currency": "EUR",
        "sector": "Healthcare",
        "industry": "Medical Care Facilities",
        "exchange": "FRA",
        "market": "dr_market",
        "country": "Italy",
        "city": "Rome"
    },
    "GHC.MI": {
        "short_name": "GAROFALO HEALTH CARE",
        "long_name": "Garofalo Health Care S.p.A.",
        "summary": "Garofalo Health Care S.p.A. operates healthcare centers in Italy. It offers services in the areas of high-complexity surgery, medium- and low-complexity surgery, emergency surgery, medicine, clinical and interventional cardiology, and extended and intensive care units, as well as motor, neurological, cardiac, and nutritional rehabilitation. The company also operates centers for patients in coma and persistent vegetative states; and psychiatric and diagnostic centers. It operates 19 healthcare facilities located in Piedmont, Veneto, Tuscany, Emilia-Romagna, Lazio, and Liguria. The company is based in Rome, Italy.",
        "currency": "EUR",
        "sector": "Healthcare",
        "industry": "Medical Care Facilities",
        "exchange": "MIL",
        "market": "it_market",
        "country": "Italy",
        "city": "Rome"
    }
}