{"AUV.HM": {"short_name": "AUTOWERKST.GRP INH. EO-10", "long_name": "autowerkstatt group N.V.", "summary": "autowerkstatt group N.V. operates as a franchise concept for independent car repair shops in Germany. The company was founded in 2001 and is based in Waalre, the Netherlands.", "currency": "EUR", "sector": "Consumer Cyclical", "industry": "Auto Parts", "exchange": "HAM", "market": "dr_market", "country": "Netherlands", "city": "Waalre"}, "K3E.F": {"short_name": "KENDRION N.V.  EO 2", "long_name": "Kendrion N.V.", "summary": "Kendrion N.V. develops, manufactures, and markets electromagnetic systems and components for industrial and automotive applications in Germany, rest of Europe, the Americas, Asia, and internationally. The company operates in two segments, Automotive and Industrial. The Industrial segment offers switching, linear, locking, holding, door, oscillating, elevator brake, rotary, and custom solenoids; and industrial control systems to optimize automatic processes with pneumatics, fluid, solenoid, and control technologies. This segment also provides electromechanical brakes and clutches that are used in access control systems, aircraft interiors, elevator systems, energy generation and distribution, industrial appliances, industrial safety systems, medical equipment, robotics and automation, and textile machinery. The Automotive segment offers electromagnetic actuators and mechatronic systems and components for use in fuel systems, engine management, active damping, sound design, and assistance systems of passenger cars; and electronic systems and components for use in the areas of commercial vehicles, such as bus and truck, as well as construction and agricultural machinery, municipal vehicles, and fire-protection technology and gensets. The company was formerly known as Schuttersveld N.V. and changed its name to Kendrion N.V. in 2001. Kendrion N.V. was founded in 1859 and is headquartered in Amsterdam, the Netherlands.", "currency": "EUR", "sector": "Consumer Cyclical", "industry": "Auto Parts", "exchange": "FRA", "market": "dr_market", "country": "Netherlands", "city": "Amsterdam"}, "KENDR.AS": {"short_name": "KENDRION", "long_name": "Kendrion N.V.", "summary": "Kendrion N.V. develops, manufactures, and markets electromagnetic systems and components for industrial and automotive applications in Germany, rest of Europe, the Americas, Asia, and internationally. The company operates in two segments, Automotive and Industrial. The Industrial segment offers switching, linear, locking, holding, door, oscillating, elevator brake, rotary, and custom solenoids; and industrial control systems to optimize automatic processes with pneumatics, fluid, solenoid, and control technologies. This segment also provides electromechanical brakes and clutches that are used in access control systems, aircraft interiors, elevator systems, energy generation and distribution, industrial appliances, industrial safety systems, medical equipment, robotics and automation, and textile machinery. The Automotive segment offers electromagnetic actuators and mechatronic systems and components for use in fuel systems, engine management, active damping, sound design, and assistance systems of passenger cars; and electronic systems and components for use in the areas of commercial vehicles, such as bus and truck, as well as construction and agricultural machinery, municipal vehicles, and fire-protection technology and gensets. The company was formerly known as Schuttersveld N.V. and changed its name to Kendrion N.V. in 2001. Kendrion N.V. was founded in 1859 and is headquartered in Amsterdam, the Netherlands.", "currency": "EUR", "sector": "Consumer Cyclical", "industry": "Auto Parts", "exchange": "AMS", "market": "nl_market", "country": "Netherlands", "city": "Amsterdam"}}