{
    "BIJ.DE": {
        "short_name": "BIJOU BRIGITTE O.N.",
        "long_name": "Bijou Brigitte modische Accessoires Aktiengesellschaft",
        "summary": "Bijou Brigitte modische Accessoires Aktiengesellschaft manufactures, imports, and sells fashion jewelry, gold and silver jewelry, fashion accessories, and complementary articles. The company's stores primarily offer jewelry, including arm and body jewelry, brooches, chains, earrings, hair jewelry, and rings; silver jewelry; designer product series, such as Senso di Donna; and gemstone and amber collections. Its stores also provide a range of minerals and fossils; children's jewelry; and fashion accessories comprising belts, caps, gentlemen's accessories, handbags, scarfs, sunglasses, watches, and other products. In addition, the company operates an online shop. As of December 31, 2019, it operated 1,042 stores in Austria, Belgium, Bulgaria, the Czech Republic, Egypt, Finland, France, Germany, Greece, Great Britain, Hungary, Italy, Jordan, Luxembourg, the Netherlands, Poland, Portugal, Romania, Saudi Arabia, Slovakia, Spain, and Switzerland. The company was founded in 1963 and is headquartered in Hamburg, Germany.",
        "currency": "EUR",
        "sector": "Consumer Cyclical",
        "industry": "Luxury Goods",
        "exchange": "GER",
        "market": "de_market",
        "country": "Germany",
        "city": "Hamburg"
    },
    "BIJ.F": {
        "short_name": "BIJOU BRIGITTE O.N.",
        "long_name": "Bijou Brigitte modische Accessoires Aktiengesellschaft",
        "summary": "Bijou Brigitte modische Accessoires Aktiengesellschaft manufactures, imports, and sells fashion jewelry, gold and silver jewelry, fashion accessories, and complementary articles. The company's stores primarily offer jewelry, including arm and body jewelry, brooches, chains, earrings, hair jewelry, and rings; silver jewelry; designer product series, such as Senso di Donna; and gemstone and amber collections. Its stores also provide a range of minerals and fossils; children's jewelry; and fashion accessories comprising belts, caps, gentlemen's accessories, handbags, scarfs, sunglasses, watches, and other products. In addition, the company operates an online shop. As of December 31, 2019, it operated 1,042 stores in Austria, Belgium, Bulgaria, the Czech Republic, Egypt, Finland, France, Germany, Greece, Great Britain, Hungary, Italy, Jordan, Luxembourg, the Netherlands, Poland, Portugal, Romania, Saudi Arabia, Slovakia, Spain, and Switzerland. The company was founded in 1963 and is headquartered in Hamburg, Germany.",
        "currency": "EUR",
        "sector": "Consumer Cyclical",
        "industry": "Luxury Goods",
        "exchange": "FRA",
        "market": "dr_market",
        "country": "Germany",
        "city": "Hamburg"
    },
    "ELB.DE": {
        "short_name": "ELUMEO SE",
        "long_name": "elumeo SE",
        "summary": "elumeo SE, through its subsidiaries, operates as a producer and electronic retailer of gemstone jewelry. It designs, procures, and sells jewelry, jewelry articles, precious gemstones, and related products under the Juwelo, AMAYANI, Rocks & Co., and New York Gemstones brands. elumeo SE sells its products through electronic distribution channels, such as TV, Internet, smart TV, and smartphone app, as well as home shopping television (TV) stations and web shops in Germany, Italy, France, the Netherlands, Spain, Belgium, the United States, and the United Kingdom. The company was formerly known as Atrium 66. Europ\u00c3\u00a4ische VV SE and changed its name to elumeo SE in July 2014. elumeo SE was founded in 2008 and is headquartered in Berlin, Germany.",
        "currency": "EUR",
        "sector": "Consumer Cyclical",
        "industry": "Luxury Goods",
        "exchange": "GER",
        "market": "de_market",
        "country": "Germany",
        "city": "Berlin"
    },
    "ELB.F": {
        "short_name": "ELUMEO SE",
        "long_name": "elumeo SE",
        "summary": "elumeo SE, through its subsidiaries, operates as a producer and electronic retailer of gemstone jewelry. It designs, procures, and sells jewelry, jewelry articles, precious gemstones, and related products under the Juwelo, AMAYANI, Rocks & Co., and New York Gemstones brands. elumeo SE sells its products through electronic distribution channels, such as TV, Internet, smart TV, and smartphone app, as well as home shopping television (TV) stations and web shops in Germany, Italy, France, the Netherlands, Spain, Belgium, the United States, and the United Kingdom. The company was formerly known as Atrium 66. Europ\u00c3\u00a4ische VV SE and changed its name to elumeo SE in July 2014. elumeo SE was founded in 2008 and is headquartered in Berlin, Germany.",
        "currency": "EUR",
        "sector": "Consumer Cyclical",
        "industry": "Luxury Goods",
        "exchange": "FRA",
        "market": "dr_market",
        "country": "Germany",
        "city": "Berlin"
    },
    "MYTE": {
        "short_name": "MYT Netherlands Parent B.V.",
        "long_name": "MYT Netherlands Parent B.V.",
        "summary": "MYT Netherlands Parent B.V., through its subsidiary, Mytheresa Group GmbH, operates a luxury e-commerce platform for the fashion consumers worldwide. The company sells clothes, bags, shoes, accessories, and fine jewelry through online operations and retail stores. It serves high income luxury consumers. The company was founded in 1987 and is headquartered in Munich, Germany.",
        "currency": "USD",
        "sector": "Consumer Cyclical",
        "industry": "Luxury Goods",
        "exchange": "NYQ",
        "market": "us_market",
        "country": "Germany",
        "city": "Munich"
    }
}