{"ACNV.PA": {"short_name": null, "long_name": "Accor SA", "summary": "Accor SA operates a chain of hotels. It operates through three segments: HotelServices, Hotel Assets & Others, and New Businesses. The company owns, operates, manages, and franchises hotels. It also provides digital solutions to independent hotel operators and restaurant owners through D-edge, ResDiary, and Adoria platforms; and hotel booking services for travels agencies and corporates through Gekko solutions. In addition, the company offers concierge services; and digital sales through VeryChic, which offers private sales with luxury and high-end partners, as well as rents private luxury homes, such as onefinestay. As of December 31, 2019, it operated 5,089 hotels with 746,504 rooms in 111 countries worldwide. The company was founded in 1967 and is headquartered in Issy-les-Moulineaux, France.", "currency": "EUR", "sector": "Services", "industry": "Lodging", "exchange": "PAR", "market": "fr_market", "country": "France", "city": "Issy-les-Moulineaux"}}