{
    "JDEP.AS": {
        "short_name": "JDE PEET'S",
        "long_name": "JDE Peet's N.V.",
        "summary": "JDE Peet's N.V., together with its subsidiaries, provides various coffee and tea products and solutions to serve consumer needs in the Netherlands, Germany, France, the United States, and internationally. The company operates through CPG Europe, CPG LARMEA, CPG APAC, Out-of-Home, and Peet's segments. It provides multi-serve coffee, single-serve and double-shot coffee capsules, pads and pods, instant coffee and instant mixes, ready-to-drink coffee beverages, professional coffee machines and services, and various tea products. The company sells its products under the Global Jewels of Peet's, Jacobs, L'OR, Senseo, Tassimo, TiOra, Douwe Egberts, Stumptown, Kenco, Moccona, Gevalia, Intelligentsia, OldTown, Super, Of\u00c3\u00a7ay, Maison du Caf\u00c3\u00a9, Harris, and Mighty Leaf Tea brands through CPG and out-of-home sales channels. The company also sells its products through Peet's, OldTown, Coffee Company, and 12Oz coffee stores in the United States, China, Malaysia, the Netherlands, and Italy, as well as through Intelligentsia and Stumptown coffee stores in the United States; and online direct to consumers through third-party online marketplaces, third-party online retail stores, and its own online retail stores. JDE Peet's N.V. was incorporated in 2018 and is headquartered in Amsterdam, the Netherlands.",
        "currency": "EUR",
        "sector": "Consumer Defensive",
        "industry": "Packaged Foods",
        "exchange": "AMS",
        "market": "nl_market",
        "country": "Netherlands",
        "city": "Amsterdam"
    },
    "JDEP.VI": {
        "short_name": "JDE PEETS",
        "long_name": "JDE Peet's N.V.",
        "summary": "JDE Peet's N.V., together with its subsidiaries, provides various coffee and tea products and solutions to serve consumer needs in the Netherlands, Germany, France, the United States, and internationally. The company operates through CPG Europe, CPG LARMEA, CPG APAC, Out-of-Home, and Peet's segments. It provides multi-serve coffee, single-serve and double-shot coffee capsules, pads and pods, instant coffee and instant mixes, ready-to-drink coffee beverages, professional coffee machines and services, and various tea products. The company sells its products under the Global Jewels of Peet's, Jacobs, L'OR, Senseo, Tassimo, TiOra, Douwe Egberts, Stumptown, Kenco, Moccona, Gevalia, Intelligentsia, OldTown, Super, Of\u00c3\u00a7ay, Maison du Caf\u00c3\u00a9, Harris, and Mighty Leaf Tea brands through CPG and out-of-home sales channels. The company also sells its products through Peet's, OldTown, Coffee Company, and 12Oz coffee stores in the United States, China, Malaysia, the Netherlands, and Italy, as well as through Intelligentsia and Stumptown coffee stores in the United States; and online direct to consumers through third-party online marketplaces, third-party online retail stores, and its own online retail stores. JDE Peet's N.V. was incorporated in 2018 and is headquartered in Amsterdam, the Netherlands.",
        "currency": "EUR",
        "sector": "Consumer Defensive",
        "industry": "Packaged Foods",
        "exchange": "VIE",
        "market": "at_market",
        "country": "Netherlands",
        "city": "Amsterdam"
    },
    "NTRU": {
        "short_name": "NATUR INTERNATIONAL CORP",
        "long_name": "Natur International Corp.",
        "summary": "Natur International Corp. formulates, produces, and markets cold pressed juices and associated natural organic snacks under the Naturalicious brand name in the Netherlands and the United Kingdom. It offers fruit and vegetable juices, coconut waters, smoothies, and nutmilks. The company was founded in 2015 and is headquartered in Amsterdam, the Netherlands. Natur International Corp. is a subsidiary of SFI Gestion de Participaciones Minoritarias SL.",
        "currency": "USD",
        "sector": "Consumer Defensive",
        "industry": "Packaged Foods",
        "exchange": "PNK",
        "market": "us_market",
        "country": "Netherlands",
        "city": "Amsterdam"
    }
}