{
    "SCHD.BR": {
        "short_name": "SCHEERD.V KERCHOVE",
        "long_name": "Scheerders van Kerchove's Verenigde fabrieken nv",
        "summary": "Scheerders van Kerchove's Verenigde fabrieken nv manufactures and distributes building materials for residential and non-residential construction in Belgium and internationally. It offers a range of roofing and cladding products, such as fa\u00c3\u00a7ade panels, facing bricks, slates, corrugated sheets, and architectural concrete. The company was founded in 1905 and is based in Sint-Niklaas, Belgium.",
        "currency": "EUR",
        "sector": "Basic Materials",
        "industry": "Building Materials",
        "exchange": "BRU",
        "market": "be_market",
        "country": "Belgium",
        "city": "Sint-Niklaas"
    },
    "TCJ.F": {
        "short_name": "TITAN CEMENT INTL. S.A.",
        "long_name": "Titan Cement International S.A.",
        "summary": "Titan Cement International S.A. produces, distributes, and trades in a range of construction materials in Greece and Western Europe, North America, Southeastern Europe, the Eastern Mediterranean, and internationally. The company provides cement; ready-mix concrete; aggregates and coarse materials, including sand, gravel, crushed stone, and recycled concrete; and other building materials, such as dry mortars, building blocks, fly ash, and other concrete products for the construction of infrastructure, residential housing, commercial buildings, and social projects. It is also involved in the import and distribution of cement; processing of fly ash; ownership/development of real estate properties; renting and leasing of machines, equipment, and material goods; sale of fly ash processing equipment; and shipping, trading, and port activities. In addition, the company provides quarries and aggregates; financial, real estate brokerage, insurance, and transportation services; engineering design services for solid and liquid waste facilities; services in waste utilization and alternative fuels production to a range of manufacturing and recycling industries; and alternative fuel and waste management solutions. Further, it designs, manufactures, and markets proprietary separation equipment for dry powders. Titan Cement International S.A. was founded in 1902 and is based in Brussels, Belgium.",
        "currency": "EUR",
        "sector": "Basic Materials",
        "industry": "Building Materials",
        "exchange": "FRA",
        "market": "dr_market",
        "country": "Belgium",
        "city": "Brussels"
    },
    "TITC.BR": {
        "short_name": "TITAN CEMENT",
        "long_name": "Titan Cement International S.A.",
        "summary": "Titan Cement International S.A. produces, distributes, and trades in a range of construction materials in Greece and Western Europe, North America, Southeastern Europe, the Eastern Mediterranean, and internationally. The company provides cement; ready-mix concrete; aggregates and coarse materials, including sand, gravel, crushed stone, and recycled concrete; and other building materials, such as dry mortars, building blocks, fly ash, and other concrete products for the construction of infrastructure, residential housing, commercial buildings, and social projects. It is also involved in the import and distribution of cement; processing of fly ash; ownership/development of real estate properties; renting and leasing of machines, equipment, and material goods; sale of fly ash processing equipment; and shipping, trading, and port activities. In addition, the company provides quarries and aggregates; financial, real estate brokerage, insurance, and transportation services; engineering design services for solid and liquid waste facilities; services in waste utilization and alternative fuels production to a range of manufacturing and recycling industries; and alternative fuel and waste management solutions. Further, it designs, manufactures, and markets proprietary separation equipment for dry powders. Titan Cement International S.A. was founded in 1902 and is based in Brussels, Belgium.",
        "currency": "EUR",
        "sector": "Basic Materials",
        "industry": "Building Materials",
        "exchange": "BRU",
        "market": "be_market",
        "country": "Belgium",
        "city": "Brussels"
    }
}