{"SMEGF": {"short_name": "SIEMENS ENERGY AG NA ON", "long_name": "Siemens Energy AG", "summary": "Siemens Energy AG operates as an energy technology company worldwide. It operates in two segments, Gas and Power; and Siemens Gamesa Renewable Energy. The company provides gas and steam turbines, generators, gas engines, instrumentation and controls, and electrical systems, as well as performance enhancement, maintenance, customer training, and professional consulting services for central and distributed power generation; and power and distribution transformers, air and gas-insulated switchgears, circuit breakers, surge arresters, disconnectors, bushings, instrument transformers, coils, transmission systems, and digitalized products for power transmission. It also offers products, integrated systems, and solutions comprising rotating equipment, integrated drivetrain systems, electrification, automation, and digital solutions for on and offshore, marine, and fiber industries, as well as for oil and gas, and distributed generation applications, such as food and beverages, minerals and metals, industrial parks, and municipalities; and water treatment solutions. In addition, the company provides electrolyzer-based power-to-hydrogen systems and services; electrolyzer-based power-to-hydrogen and power-to-liquids solutions and services; electrolyzer-integrating energy system design; and power-to-X related digital services and optimization solutions. Further, it offers onshore wind turbine design, manufacturing, and installation solutions for onshore markets; offshore wind turbine equipment design, manufacturing, and installation solutions; and operation, management, and maintenance services for wind turbines. The company serves utilities, independent power producers, project developers, financial investors, oil and gas players, transmission and distribution system operators, and industrial and infrastructure customers. Siemens Energy AG was founded in 1866 and is based in Munich, Germany.", "currency": "USD", "sector": "Utilities", "industry": "Utilities\u2014Independent Power Producers", "exchange": "PNK", "market": "us_market", "country": "Germany", "city": "Munich"}, "SMNEY": {"short_name": "SIEMENS ENERGY AG NA ON SPON AD", "long_name": "Siemens Energy AG", "summary": "Siemens Energy AG operates as an energy technology company worldwide. It operates in two segments, Gas and Power; and Siemens Gamesa Renewable Energy. The company provides gas and steam turbines, generators, gas engines, instrumentation and controls, and electrical systems, as well as performance enhancement, maintenance, customer training, and professional consulting services for central and distributed power generation; and power and distribution transformers, air and gas-insulated switchgears, circuit breakers, surge arresters, disconnectors, bushings, instrument transformers, coils, transmission systems, and digitalized products for power transmission. It also offers products, integrated systems, and solutions comprising rotating equipment, integrated drivetrain systems, electrification, automation, and digital solutions for on and offshore, marine, and fiber industries, as well as for oil and gas, and distributed generation applications, such as food and beverages, minerals and metals, industrial parks, and municipalities; and water treatment solutions. In addition, the company provides electrolyzer-based power-to-hydrogen systems and services; electrolyzer-based power-to-hydrogen and power-to-liquids solutions and services; electrolyzer-integrating energy system design; and power-to-X related digital services and optimization solutions. Further, it offers onshore wind turbine design, manufacturing, and installation solutions for onshore markets; offshore wind turbine equipment design, manufacturing, and installation solutions; and operation, management, and maintenance services for wind turbines. The company serves utilities, independent power producers, project developers, financial investors, oil and gas players, transmission and distribution system operators, and industrial and infrastructure customers. Siemens Energy AG was founded in 1866 and is based in Munich, Germany.", "currency": "USD", "sector": "Utilities", "industry": "Utilities\u2014Independent Power Producers", "exchange": "PNK", "market": "us_market", "country": "Germany", "city": "Munich"}, "UN01.DE": {"short_name": "UNIPER SE  NA O.N.", "long_name": "Uniper SE", "summary": "Uniper SE operates as an energy company. It operates in European Generation, Global Commodities, and International Power Generation segments. The company owns and operates various power and heat generation facilities, including fossil fuel power plants, such as coal, gas, oil, and combined gas and steam; and hydroelectric, nuclear, biomass, photovoltaic, and wind power plants. It also markets energy services comprising fuel procurement, engineering, operation, maintenance, and trading services under the Energy Services brand; and provides individual power and natural gas supply to industrial customers and energy partners that include municipal and regional utilities in Germany and neighboring countries. In addition, the company procures fuels, trades in emission allowances, and markets electricity; imports gas from various sources; invest in infrastructure; trades in and sells energy; and manages power plants. Further, it trades in commodities, which comprise power, natural gas, liquefied natural gas, coal and freight, and climate solutions, as well as energy advisory services to energy suppliers, utilities, and industrial customers; provides district heating and online gas dispatch services; and operates gas storage and power-to-gas facilities in Germany, Austria, and the United Kingdom. The company operates in Germany, the United Kingdom, Sweden, France, the Benelux countries, Russia, North America, and internationally. Uniper SE was founded in 2016 and is headquartered in D\u00c3\u00bcsseldorf, Germany. As of March 26, 2020, Uniper SE operates as a subsidiary of Karemi Charge and Drive SE.", "currency": "EUR", "sector": "Utilities", "industry": "Utilities\u2014Independent Power Producers", "exchange": "GER", "market": "de_market", "country": "Germany", "city": "D\u00c3\u00bcsseldorf"}, "UN01.F": {"short_name": "UNIPER SE  NA O.N.", "long_name": "Uniper SE", "summary": "Uniper SE operates as an energy company. It operates in European Generation, Global Commodities, and International Power Generation segments. The company owns and operates various power and heat generation facilities, including fossil fuel power plants, such as coal, gas, oil, and combined gas and steam; and hydroelectric, nuclear, biomass, photovoltaic, and wind power plants. It also markets energy services comprising fuel procurement, engineering, operation, maintenance, and trading services under the Energy Services brand; and provides individual power and natural gas supply to industrial customers and energy partners that include municipal and regional utilities in Germany and neighboring countries. In addition, the company procures fuels, trades in emission allowances, and markets electricity; imports gas from various sources; invest in infrastructure; trades in and sells energy; and manages power plants. Further, it trades in commodities, which comprise power, natural gas, liquefied natural gas, coal and freight, and climate solutions, as well as energy advisory services to energy suppliers, utilities, and industrial customers; provides district heating and online gas dispatch services; and operates gas storage and power-to-gas facilities in Germany, Austria, and the United Kingdom. The company operates in Germany, the United Kingdom, Sweden, France, the Benelux countries, Russia, North America, and internationally. Uniper SE was founded in 2016 and is headquartered in D\u00c3\u00bcsseldorf, Germany. As of March 26, 2020, Uniper SE operates as a subsidiary of Karemi Charge and Drive SE.", "currency": "EUR", "sector": "Utilities", "industry": "Utilities\u2014Independent Power Producers", "exchange": "FRA", "market": "dr_market", "country": "Germany", "city": "D\u00c3\u00bcsseldorf"}, "UN01.VI": {"short_name": "UNIPER SE", "long_name": "Uniper SE", "summary": "Uniper SE operates as an energy company. It operates in European Generation, Global Commodities, and International Power Generation segments. The company owns and operates various power and heat generation facilities, including fossil fuel power plants, such as coal, gas, oil, and combined gas and steam; and hydroelectric, nuclear, biomass, photovoltaic, and wind power plants. It also markets energy services comprising fuel procurement, engineering, operation, maintenance, and trading services under the Energy Services brand; and provides individual power and natural gas supply to industrial customers and energy partners that include municipal and regional utilities in Germany and neighboring countries. In addition, the company procures fuels, trades in emission allowances, and markets electricity; imports gas from various sources; invest in infrastructure; trades in and sells energy; and manages power plants. Further, it trades in commodities, which comprise power, natural gas, liquefied natural gas, coal and freight, and climate solutions, as well as energy advisory services to energy suppliers, utilities, and industrial customers; provides district heating and online gas dispatch services; and operates gas storage and power-to-gas facilities in Germany, Austria, and the United Kingdom. The company operates in Germany, the United Kingdom, Sweden, France, the Benelux countries, Russia, North America, and internationally. Uniper SE was founded in 2016 and is headquartered in D\u00c3\u00bcsseldorf, Germany. As of March 26, 2020, Uniper SE operates as a subsidiary of Karemi Charge and Drive SE.", "currency": "EUR", "sector": "Utilities", "industry": "Utilities\u2014Independent Power Producers", "exchange": "VIE", "market": "at_market", "country": "Germany", "city": "D\u00c3\u00bcsseldorf"}, "VBK.DE": {"short_name": "VERBIO VER.BIOENERGIE  ON", "long_name": "VERBIO Vereinigte BioEnergie AG", "summary": "VERBIO Vereinigte BioEnergie AG produces and supplies biofuels in Germany and rest of Europe. The company's products include biodiesel, bioethanol, biomethane, bioglycerin, and liquid fertilizers. It offers its products to oil corporations, oil traders, independent filling stations, haulage companies, public utilities, and vehicle fleets. The company was founded in 2006 and is headquartered in Leipzig, Germany.", "currency": "EUR", "sector": "Utilities", "industry": "Utilities\u2014Independent Power Producers", "exchange": "GER", "market": "de_market", "country": "Germany", "city": "Leipzig"}, "VBK.F": {"short_name": "VERBIO VER.BIOENERGIE  ON", "long_name": "VERBIO Vereinigte BioEnergie AG", "summary": "VERBIO Vereinigte BioEnergie AG produces and supplies biofuels in Germany and rest of Europe. The company's products include biodiesel, bioethanol, biomethane, bioglycerin, and liquid fertilizers. It offers its products to oil corporations, oil traders, independent filling stations, haulage companies, public utilities, and vehicle fleets. The company was founded in 2006 and is headquartered in Leipzig, Germany.", "currency": "EUR", "sector": "Utilities", "industry": "Utilities\u2014Independent Power Producers", "exchange": "FRA", "market": "dr_market", "country": "Germany", "city": "Leipzig"}}