{
    "DB7.F": {
        "short_name": "DIGITAL BROS S.P.A.",
        "long_name": "Digital Bros S.p.A.",
        "summary": "Digital Bros S.p.A. develops, publishes, distributes, and markets video games in Europe, the Americas, and internationally. It operates through Premium Games, Free to Play, Italian Distribution, and Other activities segment. The Premium Games segment acquires and distributes video games content rights on digital marketplaces, such as Steam, Sony PlayStation Network, Microsoft Xbox Live, Epic Game Store, etc., as well as through an international sales network; and publishes video games under 505 Games brand name. The Free to Play segment develops and publishes video games and applications that are available free of charge on digital marketplaces under the 505 Games Mobile brand name. The Italian Distribution segment purchases and distributes video games under the Halifax brand; and Yu-Gi-Oh! trading card games through newsstand distribution channel in Italy. The Other Activities segment organizes video game training and professional update courses. Digital Bros S.p.A. was founded in 1989 and is based in Milan, Italy.",
        "currency": "EUR",
        "sector": "Communication Services",
        "industry": "Electronic Gaming & Multimedia",
        "exchange": "FRA",
        "market": "dr_market",
        "country": "Italy",
        "city": "Milan"
    },
    "DIB.MI": {
        "short_name": "DIGITAL BROS",
        "long_name": "Digital Bros S.p.A.",
        "summary": "Digital Bros S.p.A. develops, publishes, distributes, and markets video games in Europe, the Americas, and internationally. It operates through Premium Games, Free to Play, Italian Distribution, and Other activities segment. The Premium Games segment acquires and distributes video games content rights on digital marketplaces, such as Steam, Sony PlayStation Network, Microsoft Xbox Live, Epic Game Store, etc., as well as through an international sales network; and publishes video games under 505 Games brand name. The Free to Play segment develops and publishes video games and applications that are available free of charge on digital marketplaces under the 505 Games Mobile brand name. The Italian Distribution segment purchases and distributes video games under the Halifax brand; and Yu-Gi-Oh! trading card games through newsstand distribution channel in Italy. The Other Activities segment organizes video game training and professional update courses. Digital Bros S.p.A. was founded in 1989 and is based in Milan, Italy.",
        "currency": "EUR",
        "sector": "Communication Services",
        "industry": "Electronic Gaming & Multimedia",
        "exchange": "MIL",
        "market": "it_market",
        "country": "Italy",
        "city": "Milan"
    }
}