{
    "LON.MI": {
        "short_name": "LONGINO&CARDENAL",
        "long_name": "Longino & Cardenal S.p.A.",
        "summary": "Longino & Cardenal S.p.A. supplies catering services to hotels and restaurants in Italy and internationally. It offers seafood products; plancton Marino; meats and eggs; hams and salamis; cheeses and other dairy products; flowers, sprouts, and aromatic herbs; truffles and mushrooms; breads, pastas, rice, and pulses; salts, spices, and condiments; pastry products; and ethnic products and accessories, as well as champagnes and vodkas. The company was founded in 1988 and is based in Pogliano Milanese, Italy.",
        "currency": "EUR",
        "sector": "Consumer Defensive",
        "industry": "Food Distribution",
        "exchange": "MIL",
        "market": "it_market",
        "country": "Italy",
        "city": "Pogliano Milanese"
    },
    "M6Z.F": {
        "short_name": "MARR S.P.A.  EO-,50",
        "long_name": "MARR S.p.A.",
        "summary": "MARR S.p.A. commercializes and distributes fresh, dried, and frozen food products for foodservice operators in Italy, the European Union, and internationally. It offers meat products, such as poultry, beef, horse meat mutton and lamb, game, pork, and veal products; seafood products, including fresh and saltwater fish, lobsters and scampi, squids, calamari and molluscs, shrimps, fillets, sliced and pre-prepared items, tails and prawns, and cuttlefishes and frozen octopuses. The company also provides grocery products comprising biscuits and sweets, chocolates and candies, preserved products, vegetable preserves, ice cream and pastries, honey, jams and spread creams, oil and vinegar, prepared and floury products, rice, pasta, pizza, salt, spices, sugar, coffee, tea, tisanes, sauces and seasoning, fruit s and vegetables, and gluten-free and organic products, as well as gastronomy services. In addition, it provides lard and shortening, milk, dairy products and cheese, cured meats, eggs and egg products, as well as specialty foodstuffs made from pork, beef, poultry and game; and beverages, liqueurs, and wines. Further, the company offers nonfood products, such as tablecloths and napkins, cleaning products and accessories, laundry products, and hygiene, dishwashing, handwashing, and disposable products; and table dishes, cutlery, glasses, induction pots and pans, knife sets, buffet assortment, and other kitchen products. Additionally, it offers various private label products. The company serves restaurants, fast food outlets, bars, hotels, resorts, canteens, chains operators, etc. It operates through a logistical-distribution network comprising 30 distribution centers, with 5 cash and carry stores, 4 agents with warehouses, and approximately 750 vehicles. The company was founded in 1972 and is headquartered in Rimini, Italy. MARR S.p.A. is a subsidiary of Cremonini S.p.A.",
        "currency": "EUR",
        "sector": "Consumer Defensive",
        "industry": "Food Distribution",
        "exchange": "FRA",
        "market": "dr_market",
        "country": "Italy",
        "city": "Rimini"
    },
    "MARR.MI": {
        "short_name": "MARR",
        "long_name": "MARR S.p.A.",
        "summary": "MARR S.p.A. commercializes and distributes fresh, dried, and frozen food products for foodservice operators in Italy, the European Union, and internationally. It offers meat products, such as poultry, beef, horse meat mutton and lamb, game, pork, and veal products; seafood products, including fresh and saltwater fish, lobsters and scampi, squids, calamari and molluscs, shrimps, fillets, sliced and pre-prepared items, tails and prawns, and cuttlefishes and frozen octopuses. The company also provides grocery products comprising biscuits and sweets, chocolates and candies, preserved products, vegetable preserves, ice cream and pastries, honey, jams and spread creams, oil and vinegar, prepared and floury products, rice, pasta, pizza, salt, spices, sugar, coffee, tea, tisanes, sauces and seasoning, fruit s and vegetables, and gluten-free and organic products, as well as gastronomy services. In addition, it provides lard and shortening, milk, dairy products and cheese, cured meats, eggs and egg products, as well as specialty foodstuffs made from pork, beef, poultry and game; and beverages, liqueurs, and wines. Further, the company offers nonfood products, such as tablecloths and napkins, cleaning products and accessories, laundry products, and hygiene, dishwashing, handwashing, and disposable products; and table dishes, cutlery, glasses, induction pots and pans, knife sets, buffet assortment, and other kitchen products. Additionally, it offers various private label products. The company serves restaurants, fast food outlets, bars, hotels, resorts, canteens, chains operators, etc. It operates through a logistical-distribution network comprising 30 distribution centers, with 5 cash and carry stores, 4 agents with warehouses, and approximately 750 vehicles. The company was founded in 1972 and is headquartered in Rimini, Italy. MARR S.p.A. is a subsidiary of Cremonini S.p.A.",
        "currency": "EUR",
        "sector": "Consumer Defensive",
        "industry": "Food Distribution",
        "exchange": "MIL",
        "market": "it_market",
        "country": "Italy",
        "city": "Rimini"
    },
    "ORS.MI": {
        "short_name": "ORSERO",
        "long_name": "Orsero S.p.A.",
        "summary": "Orsero S.p.A. imports and distributes fruits and vegetables in Europe, Latin America, and North America. It also produces bananas and pineapples, citrus fruits, apples, melons, and pears, as well as exotic fruits and vegetables under the F.lli Orsero brand name. Orsero S.p.A. is headquartered in Milan, Italy.",
        "currency": "EUR",
        "sector": "Consumer Defensive",
        "industry": "Food Distribution",
        "exchange": "MIL",
        "market": "it_market",
        "country": "Italy",
        "city": "Milan"
    },
    "WRG.F": {
        "short_name": "ORSERO S.P.A.",
        "long_name": "Orsero S.p.A.",
        "summary": "Orsero S.p.A. imports and distributes fruits and vegetables in Europe, Latin America, and North America. It also produces bananas and pineapples, citrus fruits, apples, melons, and pears, as well as exotic fruits and vegetables under the F.lli Orsero brand name. Orsero S.p.A. is headquartered in Milan, Italy.",
        "currency": "EUR",
        "sector": "Consumer Defensive",
        "industry": "Food Distribution",
        "exchange": "FRA",
        "market": "dr_market",
        "country": "Italy",
        "city": "Milan"
    }
}