{
  "ALUA.BA": {
    "city": "Buenos Aires",
    "country": "Argentina",
    "currency": "ARS",
    "exchange": "BUE",
    "industry": "Aluminum",
    "long_name": "Aluar Aluminio Argentino S.A.I.C.",
    "market": "ar_market",
    "market_cap": "Small Cap",
    "sector": "Basic Materials",
    "short_name": "ALUAR ALUMINIO ARG",
    "state": null,
    "summary": "Aluar Aluminio Argentino S.A.I.C. produces and sells aluminum products worldwide. The company offers extrusion bars, lamination plates, wire rods, prismatic alloys, ingots of alloys and pure aluminum, and zincalum products. It also produces and sells carpentry systems, industrial profiles, and laminated flat products. The company's products have applications in the architecture, transport, packaging, electrical conductors, and electronic industries. In addition, it operates a wind energy project with a capacity of 50 MW. The company was founded in 1974 and is headquartered in Buenos Aires, Argentina.",
    "website": "http://www.aluar.com.ar",
    "zipcode": null
  }
}
