{
    "1QT.F": {
        "short_name": "AMREST HOLDINGS SE EO-,1",
        "long_name": "AmRest Holdings SE",
        "summary": "AmRest Holdings SE, through its subsidiaries, operates and manages quick service and casual dining restaurants in Central and Eastern Europe, Western Europe, Russia, and China. It operates Kentucky Fried Chicken, Pizza Hut, Burger King, and Starbucks restaurants on the basis of franchise agreements. The company also operates its own restaurant under the La Tagliatella brand name, as well as Blue Frog and KABB brand names. In addition, it provides on-site catering services; take away services; drive-in services at special sales points; and deliveries for orders placed online or by telephone. As of December 31, 2020, it operated 2,337 restaurants. The company was founded in 1993 and is based in Madrid, Spain. AmRest Holdings SE is a subsidiary of Fcapital Dutch B.V.",
        "currency": "EUR",
        "sector": "Consumer Cyclical",
        "industry": "Restaurants",
        "exchange": "FRA",
        "market": "dr_market",
        "country": "Spain",
        "city": "Madrid"
    },
    "EAT.MC": {
        "short_name": "AMREST HOLDINGS, S.E.",
        "long_name": "AmRest Holdings SE",
        "summary": "AmRest Holdings SE, through its subsidiaries, operates and manages quick service and casual dining restaurants in Central and Eastern Europe, Western Europe, Russia, and China. It operates Kentucky Fried Chicken, Pizza Hut, Burger King, and Starbucks restaurants on the basis of franchise agreements. The company also operates its own restaurant under the La Tagliatella brand name, as well as Blue Frog and KABB brand names. In addition, it provides on-site catering services; take away services; drive-in services at special sales points; and deliveries for orders placed online or by telephone. As of December 31, 2020, it operated 2,337 restaurants. The company was founded in 1993 and is based in Madrid, Spain. AmRest Holdings SE is a subsidiary of Fcapital Dutch B.V.",
        "currency": "EUR",
        "sector": "Consumer Cyclical",
        "industry": "Restaurants",
        "exchange": "MCE",
        "market": "es_market",
        "country": "Spain",
        "city": "Madrid"
    }
}