{
    "CBOT.PA": {
        "short_name": "CBO TERRITORIA",
        "long_name": "CBo Territoria Soci\u00e9t\u00e9 Anonyme",
        "summary": "CBo Territoria Soci\u00c3\u00a9t\u00c3\u00a9 Anonyme develops, promotes, manages, and sells real estate properties in France. Its residential properties include serviced plots, villas, townhouses, and apartments; and commercial real estate properties comprise offices, businesses, warehouses, parcels, divisible lots, and business districts. The company also owns approximately 3,000 hectares of land in the island of R\u00c3\u00a9union. CBo Territoria Soci\u00c3\u00a9t\u00c3\u00a9 Anonyme is based in Sainte-Marie, France.",
        "currency": "EUR",
        "sector": "Real Estate",
        "industry": "Real Estate\u2014Diversified",
        "exchange": "PAR",
        "market": "fr_market",
        "country": "France",
        "city": "Sainte-Marie"
    },
    "GALIM.PA": {
        "short_name": "GALIMMO",
        "long_name": "Galimmo SCA",
        "summary": "Galimmo SCA operates as a real estate company in Europe. As of June 30, 2019, it manages a portfolio of 52 shopping malls. The company was formerly known as C&Co SCA and changed its name to Galimmo SCA in September 2016. Galimmo SCA was founded in 1902 and is based in Paris, France. Galimmo SCA is a subsidiary of Galimmo Real Estate.",
        "currency": "EUR",
        "sector": "Real Estate",
        "industry": "Real Estate\u2014Diversified",
        "exchange": "PAR",
        "market": "fr_market",
        "country": "France",
        "city": "Paris"
    },
    "NQ9.F": {
        "short_name": "NEXITY  EO 5",
        "long_name": "Nexity SA",
        "summary": "Nexity SA operates as a real estate company in Europe and internationally. The company operates through Individual Clients Division, Commercial Clients Division, and Other Activities segments. It develops new homes and subdivisions; and new or refurbished office buildings, high-rises, business parks, logistics facilities, retail property, and hotels. The company also provides property management services comprising rental management, sales and lettings, and managing agent services; manages serviced residences for students and for seniors; distributes real estate products; offers real estate brokerage, financial advisory, and insurance advisory services; real estate services, including rental management and property management, consultancy, and rental of short-duration work spaces. In addition, it engages in the villes and projets, and pre-development urban regeneration project activities; administration, coordination, and development of real estate franchise networks for individual clients; investment activities, as well as startup in the incubation phase. Additionally, it serves as a partner for local authorities for the design and execution of urban projects or large-scale urban regeneration schemes. Nexity SA was founded in 1995 and is based in Paris, France.",
        "currency": "EUR",
        "sector": "Real Estate",
        "industry": "Real Estate\u2014Diversified",
        "exchange": "FRA",
        "market": "dr_market",
        "country": "France",
        "city": "Paris"
    },
    "NXI.PA": {
        "short_name": "NEXITY",
        "long_name": "Nexity SA",
        "summary": "Nexity SA operates as a real estate company in Europe and internationally. The company operates through Individual Clients Division, Commercial Clients Division, and Other Activities segments. It develops new homes and subdivisions; and new or refurbished office buildings, high-rises, business parks, logistics facilities, retail property, and hotels. The company also provides property management services comprising rental management, sales and lettings, and managing agent services; manages serviced residences for students and for seniors; distributes real estate products; offers real estate brokerage, financial advisory, and insurance advisory services; real estate services, including rental management and property management, consultancy, and rental of short-duration work spaces. In addition, it engages in the villes and projets, and pre-development urban regeneration project activities; administration, coordination, and development of real estate franchise networks for individual clients; investment activities, as well as startup in the incubation phase. Additionally, it serves as a partner for local authorities for the design and execution of urban projects or large-scale urban regeneration schemes. Nexity SA was founded in 1995 and is based in Paris, France.",
        "currency": "EUR",
        "sector": "Real Estate",
        "industry": "Real Estate\u2014Diversified",
        "exchange": "PAR",
        "market": "fr_market",
        "country": "France",
        "city": "Paris"
    }
}