{
    "CRI.PA": {
        "short_name": "CHARGEURS",
        "long_name": "Chargeurs SA",
        "summary": "Chargeurs SA operates as a manufacturing and services company in France and internationally. The company operates through four segments: Protective Films, Fashion Technologies, Technical Substrates, and Luxury Materials. The Protective Films segment develops, manufactures, and markets technical solutions to protect steel, aluminum, plastic, and other surfaces in the production process; and laminators for temporary surface protection films. The Fashion Technologies segment manufactures and markets garment interlinings. The Technical Substrates segment develops, manufactures, and markets functionalized coated technical substrates. The Luxury Materials segment manufactures and markets wool tops. It serves in Europe, the Americas, Asia, Oceania, and Africa. The company was formerly known as Chargetex 1 and changed its name to Chargeurs SA in 1997. Chargeurs SA was founded in 1872 and is headquartered in Paris, France.",
        "currency": "EUR",
        "sector": "Consumer Cyclical",
        "industry": "Textile Manufacturing",
        "exchange": "PAR",
        "market": "fr_market",
        "country": "France",
        "city": "Paris"
    },
    "GET.F": {
        "short_name": "CHARGEURS INH.  EO 0,16",
        "long_name": "Chargeurs SA",
        "summary": "Chargeurs SA operates as a manufacturing and services company in France and internationally. The company operates through four segments: Protective Films, Fashion Technologies, Technical Substrates, and Luxury Materials. The Protective Films segment develops, manufactures, and markets technical solutions to protect steel, aluminum, plastic, and other surfaces in the production process; and laminators for temporary surface protection films. The Fashion Technologies segment manufactures and markets garment interlinings. The Technical Substrates segment develops, manufactures, and markets functionalized coated technical substrates. The Luxury Materials segment manufactures and markets wool tops. It serves in Europe, the Americas, Asia, Oceania, and Africa. The company was formerly known as Chargetex 1 and changed its name to Chargeurs SA in 1997. Chargeurs SA was founded in 1872 and is headquartered in Paris, France.",
        "currency": "EUR",
        "sector": "Consumer Cyclical",
        "industry": "Textile Manufacturing",
        "exchange": "FRA",
        "market": "dr_market",
        "country": "France",
        "city": "Paris"
    }
}