{
    "5C8.MU": {
        "short_name": "XTPL S.A. INH.  ZY -,10",
        "long_name": "XTPL S.A.",
        "summary": "XTPL S.A. develops additive manufacturing technology for ultra-precise printing of nanomaterials. The company offers ultra-precise deposition technology, nano inks, and printed structures. Its technology is used in display, semiconductor, PCB, anticounterfeiting, research and prototyping, and biosensor applications. XTPL S.A. was founded in 2015 and is based in Wroclaw, Poland.",
        "currency": "EUR",
        "sector": "Technology",
        "industry": "Electronic Components",
        "exchange": "MUN",
        "market": "dr_market",
        "country": "Poland",
        "city": "Wroclaw"
    },
    "ASOZY": {
        "short_name": "ASSECO POLAND SA",
        "long_name": "Asseco Poland S.A.",
        "summary": "Asseco Poland S.A., an information technology (IT) company, develops and sells software products primarily in Poland, other European countries, Israel, the United States, Japan, and Canada. It operates through three segments: Asseco Poland, Formula Systems, and Asseco International. It offers software and IT solutions for banking, payment, insurance, healthcare, energy and gas, telecommunications and media, and security sectors; defense and uniformed services; and public institutions. The company also provides enterprise resource planning software for micro, small, medium, and large enterprises; IT infrastructure services, including information and communication technologies, cloud computing, smart cities management platform and intelligent transport systems, and creation of tele transmission networks, as well as construction, modernization, maintenance, and development of data processing centers; and business intelligence solutions. The company was formerly known as Softbank S.A. and changed its name to Asseco Poland S.A. in January 2007. Asseco Poland S.A. was founded in 1989 and is headquartered in Rzesz\u00c3\u00b3w, Poland.",
        "currency": "USD",
        "sector": "Technology",
        "industry": "Software - Application",
        "exchange": "PNK",
        "market": "us_market",
        "country": "Poland",
        "city": "Rzesz\u00c3\u00b3w"
    },
    "SFB1.F": {
        "short_name": "ASSECO POLAND S.A.  ZY 1",
        "long_name": "Asseco Poland S.A.",
        "summary": "Asseco Poland S.A., an information technology (IT) company, develops and sells software products primarily in Poland, other European countries, Israel, the United States, Japan, and Canada. It operates through three segments: Asseco Poland, Formula Systems, and Asseco International. It offers software and IT solutions for banking, payment, insurance, healthcare, energy and gas, telecommunications and media, and security sectors; defense and uniformed services; and public institutions. The company also provides enterprise resource planning software for micro, small, medium, and large enterprises; IT infrastructure services, including information and communication technologies, cloud computing, smart cities management platform and intelligent transport systems, and creation of tele transmission networks, as well as construction, modernization, maintenance, and development of data processing centers; and business intelligence solutions. The company was formerly known as Softbank S.A. and changed its name to Asseco Poland S.A. in January 2007. Asseco Poland S.A. was founded in 1989 and is headquartered in Rzesz\u00c3\u00b3w, Poland.",
        "currency": "EUR",
        "sector": "Technology",
        "industry": "Software - Application",
        "exchange": "FRA",
        "market": "dr_market",
        "country": "Poland",
        "city": "Rzesz\u00c3\u00b3w"
    }
}