{
    "CPI.AT": {
        "short_name": "CPI S.A. (CR)",
        "long_name": "CPI Computer Peripherals International",
        "summary": "CPI Computer Peripherals International provides IT products and services in Greece. The company offers printers for business applications; barcode/RF-ID printers and scanners, and hand-held portables; scanners and digitization products; surveillance and security products; projectors and specialized products for the education sector; POS terminals and peripherals for tourism, and food and retail businesses; and interactive systems. It also provides CPI product technical support, digitization and document management, and print management services, as well as install, move, add, and change services for computer equipment; technical support services for third-party manufacturers; and custom, consultation, and infrastructure services. The company was founded in 1990 and is based in Athens, Greece.",
        "currency": "EUR",
        "sector": "Technology",
        "industry": "Information Technology Services",
        "exchange": "ATH",
        "market": "gr_market",
        "country": "Greece",
        "city": "Athens"
    },
    "NRST.MI": {
        "short_name": "NEUROSOFT",
        "long_name": "Neurosoft Software Production S.A.",
        "summary": "Neurosoft Software Production S.A., a software production and ICT company, design, develops, customizes, and maintains integrated software systems in the areas of Fintech and analytics, systems engineering, and cyber security operations in Greece and internationally. The company offers Consensus For Invoice Reconciliation Management (ConFIRM), a platform that targets to alleviate all issues that accounting office's face in the process of invoice reconciliation; Proxima+, an E2E factoring and supply chain finance platform, which manages firms' receivables finance business; Angel, a cyber-security solution for maritime that addresses the cyber threat; and Illicium, a cyber-deception platform. It also provides Neutrify, a security operations center, monitors and analyzes activity on networks, servers, endpoints, databases, applications, websites, and other systems and looks for anomalous activity, as well as offers advanced forensic analysis, and malware reverse engineering to analyze incidents; RedyOps, which assists in evaluating the security of organization and helps to defend from attacks combining targets such as people, technology, and physical security; and Enterprise Link, a business connectivity service. Neurosoft Software Production S.A. was founded in 1994 and is headquartered in Athens, Greece.",
        "currency": "EUR",
        "sector": "Technology",
        "industry": "Information Technology Services",
        "exchange": "MIL",
        "market": "it_market",
        "country": "Greece",
        "city": "Athens"
    },
    "QUEST.AT": {
        "short_name": "QUEST HOLDING S.A.",
        "long_name": "Quest Holdings S.A.",
        "summary": "Quest Holdings S.A., together with its subsidiaries, engages distribution of information technology and telecommunications products. The company operates in five segments: Information Technology; Information Technology Services; Courier Services; Production of Electric Power from Renewable Sources; and Financial Transactions. It distributes ICT products and cloud services, and Apple products, and related software and peripherals; operates an online store, you.gr, which provides technology products, consumer electronics, small/large domestic appliances, daily care products, and household and baby care products for consumers and professionals; and operates Apple products retail store. The company also provides integrated ICT solutions; electronic transactions management solutions; and courier and postal services. In addition, it is involved in the production of electric power from renewable sources. The company offers its products and services in Greece, Romania, Cyprus, Belgium, Italy, and Luxembourg. Quest Holdings S.A. was founded in 1981 and is based in Athens, Greece.",
        "currency": "EUR",
        "sector": "Technology",
        "industry": "Information Technology Services",
        "exchange": "ATH",
        "market": "gr_market",
        "country": "Greece",
        "city": "Athens"
    }
}