{"CP9.F": {"short_name": "CYFROWY POLSAT SA ZY -,04", "long_name": "Cyfrowy Polsat S.A.", "summary": "Cyfrowy Polsat S.A. provides digital satellite platform, digital terrestrial television (TV), and telecommunication services in Poland. The company operates through two segments, Services to Individual and Business Customers; and Broadcasting and Television Production. The Services to Individual and Business Customers segment offers digital pay TV, video online, mobile telephony, and broadband Internet access services; bundled services and end-user devices; and smartDOM and smartFIRMA programs. It also provides services to other telecommunication operators, such as network interconnection, roaming, shared access to network assets, and lease of network infrastructure; and services to mobile virtual network operators, as well as produces set-top boxes; and sells telecommunication equipment. It offers approximately 170 TV channels, including terrestrial, general entertainment, sports and e-sports, music, lifestyle, news/information, children's, education, and movie channels; and over the top services, such as Cyfrowy Polsat Go, VOD/PPV, online video and music, catch-up TV, and multiroom HD services. The Broadcasting and Television Production segment produces, acquires, and broadcasts information and entertainment programs, as well as TV series and feature films broadcasted on television and radio channels; and sells TV channel advertising airtime and sponsoring, and channel broadcasting rights. It is also involved in trading of gaseous fuels; technical services; Web portal; and other financial supporting services. The company was formerly known as Polsat Cyfrowy S.A. and changed its name to Cyfrowy Polsat S.A. in 2004. Cyfrowy Polsat S.A. was founded in 1996 and is based in Warsaw, Poland.", "currency": "EUR", "sector": "Communication Services", "industry": "Entertainment", "exchange": "FRA", "market": "dr_market", "country": "Poland", "city": "Warsaw"}}