{
    "IQCD.QA": {
        "short_name": "Industries Qatar QPSC",
        "long_name": "Industries Qatar Q.P.S.C.",
        "summary": "Industries Qatar Q.P.S.C., through its subsidiaries, engages in the petrochemical, fertilizer, and steel businesses primarily in Qatar. Its Petrochemicals segment produces and sells ethylene, polyethylene, methyl-tertiary-butyl-ether, methanol, and other petrochemical products. The company's Fertilizers segment produces and sells urea, ammonia, and other by-products. Its Steel segment produces and sells steel pellets, bars, billets, and other products. Industries Qatar Q.P.S.C. also exports its products. The company was founded in 1969 and is headquartered in Doha, Qatar. Industries Qatar Q.P.S.C. is a subsidiary of Qatar Petroleum.",
        "currency": "QAR",
        "sector": "Basic Materials",
        "industry": "Chemicals",
        "exchange": "DOH",
        "market": "qa_market",
        "country": "Qatar",
        "city": "Doha"
    },
    "MPHC.QA": {
        "short_name": "Mesaieed Petrochemical Holding ",
        "long_name": "Mesaieed Petrochemical Holding Company Q.P.S.C.",
        "summary": "Mesaieed Petrochemical Holding Company Q.P.S.C., through its subsidiaries, manufactures and sells petrochemical products in Qatar, the Middle East, Asia, Africa, Indian sub-continent, and Europe. The company operates through two segments, Petrochemicals and Chlor-Alkali. It is involved in the production and sale of ethylene, polyolefins, 1-hexene, C4+, polyethylene, normal alpha olefins, pyrolysis gasoline, C3 and C4, caustic soda, ethylene dichloride, vinyl chloride monomer, and hydrochloric acid. The company was founded in 2013 and is headquarterd in Doha, Qatar. Mesaieed Petrochemical Holding Company Q.P.S.C. is a subsidiary of Qatar Petroleum.",
        "currency": "QAR",
        "sector": "Basic Materials",
        "industry": "Chemicals",
        "exchange": "DOH",
        "market": "qa_market",
        "country": "Qatar",
        "city": "Doha"
    }
}