{
    "ERES.QA": {
        "short_name": "Ezdan Holding Group QPSC",
        "long_name": "Ezdan Holding Group Q.P.S.C.",
        "summary": "Ezdan Holding Group Q.P.S.C., together with its subsidiaries, manages and rents real estate properties in Qatar. It operates through four segments: Residential and Commercial Properties, Investments, Hotel and Suites, and Malls. The Residential and Commercial Properties segment develops, owns, and rents real estate properties. The Investments segment invests in shares and sukuk investments. The Hotel and Suites segment manages hotels, suites, and restaurants. The Mall segment manages shopping malls. The company was formerly known as Ezdan Real Estate Company Q.S.C. and changed its name to Ezdan Holding Group Q.P.S.C. Ezdan Holding Group Q.P.S.C. was founded in 1960 and is based in Doha, Qatar.",
        "currency": "QAR",
        "sector": "Real Estate",
        "industry": "Real Estate Services",
        "exchange": "DOH",
        "market": "qa_market",
        "country": "Qatar",
        "city": "Doha"
    },
    "MRDS.QA": {
        "short_name": "Mazaya Real Estate Development ",
        "long_name": "Mazaya Real Estate Development Q.P.S.C.",
        "summary": "Mazaya Real Estate Development Q.P.S.C. engages in the real estate investment and development businesses. It develops real estate properties, such as master developments to individual projects in the residential, commercial, and industrial sectors. The company also provides project management and consultancy, property valuation, strategic partnership, real estate brokerage, master developments, assets and facility management division, marketing management and consultancy, real estate portfolio and fund management, and real estate market research services, as well as real estate management and maintenance services. In addition, it trades in mechanical electrical and construction equipment. The company was founded in 2008 and is based in Doha, Qatar.",
        "currency": "QAR",
        "sector": "Real Estate",
        "industry": "Real Estate Services",
        "exchange": "DOH",
        "market": "qa_market",
        "country": "Qatar",
        "city": "Doha"
    }
}