{
    "DTV.F": {
        "short_name": "F-SECURE OYJ",
        "long_name": "F-Secure Oyj",
        "summary": "F-Secure Oyj provides cyber security products and services in Nordic countries, rest of Europe, North America, and internationally. Its corporate security solutions include F-Secure Radar, a vulnerability scanning and management platform; phishd, an anti-phishing behavior management platform; F-Secure Protection Service for Business, a cloud-hosted endpoint security; F-Secure Business Suite, an on-site deployed endpoint security; F-Secure Cloud Protection for Salesforce, a content level security for Salesforce's customers; F-Secure Rapid Detection and Response, a customer or partner-managed endpoint detection and response solution for detecting and responding to targeted attacks; F-Secure Rapid Detection and Response Service, a managed detection and response service; and Countercept, a threat hunting and continuous response capabilities against targeted attacks delivered as a managed service. The company also provides cyber security services comprising F-Secure cyber incident and resilience services, F-Secure security assessments, F-Secure red team testing, and F-Secure cyber risk management. In addition, it offers consumer security solutions, including F-Secure SAFE, an antivirus and Internet security solution; F-Secure KEY, a password manager; F-Secure FREEDOME, a VPN that hides online activity to ensure anonymous and secure Internet browsing; F-Secure SENSE, a security solution for connected home devices; F-Secure Internet Security for secure Internet surfing with browsing protection; and F-Secure Anti-Virus, a malware removal technology software. The company serves consumers and business customers through a network of approximately 200 telecommunications operators, as well as through thousands of IT service and retail partners. F-Secure Oyj was founded in 1988 and is headquartered in Helsinki, Finland.",
        "currency": "EUR",
        "sector": "Technology",
        "industry": "Software - Infrastructure",
        "exchange": "FRA",
        "market": "dr_market",
        "country": "Finland",
        "city": "Helsinki"
    },
    "EFECTE.HE": {
        "short_name": "Efecte Plc",
        "long_name": "Efecte Oy",
        "summary": "Efecte Oy, a software company, provides cloud-based software as a service and identity management solutions in Finland, Sweden, Denmark, and Germany. It offers contract, finance, and HR management solutions, as well as business and IT service management solutions. The company also provides training, support, and consultancy services. It serves large, mid-sized, and public organizations, as well as software business professionals. The company was founded in 1998 and is headquartered in Espoo, Finland.",
        "currency": "EUR",
        "sector": "Technology",
        "industry": "Software - Infrastructure",
        "exchange": "HEL",
        "market": "fi_market",
        "country": "Finland",
        "city": "Espoo"
    },
    "FSC1V.HE": {
        "short_name": "F-Secure Corporation",
        "long_name": "F-Secure Oyj",
        "summary": "F-Secure Oyj provides cyber security products and services in Nordic countries, rest of Europe, North America, and internationally. Its corporate security solutions include F-Secure Radar, a vulnerability scanning and management platform; phishd, an anti-phishing behavior management platform; F-Secure Protection Service for Business, a cloud-hosted endpoint security; F-Secure Business Suite, an on-site deployed endpoint security; F-Secure Cloud Protection for Salesforce, a content level security for Salesforce's customers; F-Secure Rapid Detection and Response, a customer or partner-managed endpoint detection and response solution for detecting and responding to targeted attacks; F-Secure Rapid Detection and Response Service, a managed detection and response service; and Countercept, a threat hunting and continuous response capabilities against targeted attacks delivered as a managed service. The company also provides cyber security services comprising F-Secure cyber incident and resilience services, F-Secure security assessments, F-Secure red team testing, and F-Secure cyber risk management. In addition, it offers consumer security solutions, including F-Secure SAFE, an antivirus and Internet security solution; F-Secure KEY, a password manager; F-Secure FREEDOME, a VPN that hides online activity to ensure anonymous and secure Internet browsing; F-Secure SENSE, a security solution for connected home devices; F-Secure Internet Security for secure Internet surfing with browsing protection; and F-Secure Anti-Virus, a malware removal technology software. The company serves consumers and business customers through a network of approximately 200 telecommunications operators, as well as through thousands of IT service and retail partners. F-Secure Oyj was founded in 1988 and is headquartered in Helsinki, Finland.",
        "currency": "EUR",
        "sector": "Technology",
        "industry": "Software - Infrastructure",
        "exchange": "HEL",
        "market": "fi_market",
        "country": "Finland",
        "city": "Helsinki"
    },
    "FSOYF": {
        "short_name": "F-SECURE OYJ",
        "long_name": "F-Secure Oyj",
        "summary": "F-Secure Oyj provides cyber security products and services in Nordic countries, rest of Europe, North America, and internationally. Its corporate security solutions include F-Secure Radar, a vulnerability scanning and management platform; phishd, an anti-phishing behavior management platform; F-Secure Protection Service for Business, a cloud-hosted endpoint security; F-Secure Business Suite, an on-site deployed endpoint security; F-Secure Cloud Protection for Salesforce, a content level security for Salesforce's customers; F-Secure Rapid Detection and Response, a customer or partner-managed endpoint detection and response solution for detecting and responding to targeted attacks; F-Secure Rapid Detection and Response Service, a managed detection and response service; and Countercept, a threat hunting and continuous response capabilities against targeted attacks delivered as a managed service. The company also provides cyber security services comprising F-Secure cyber incident and resilience services, F-Secure security assessments, F-Secure red team testing, and F-Secure cyber risk management. In addition, it offers consumer security solutions, including F-Secure SAFE, an antivirus and Internet security solution; F-Secure KEY, a password manager; F-Secure FREEDOME, a VPN that hides online activity to ensure anonymous and secure Internet browsing; F-Secure SENSE, a security solution for connected home devices; F-Secure Internet Security for secure Internet surfing with browsing protection; and F-Secure Anti-Virus, a malware removal technology software. The company serves consumers and business customers through a network of approximately 200 telecommunications operators, as well as through thousands of IT service and retail partners. F-Secure Oyj was founded in 1988 and is headquartered in Helsinki, Finland.",
        "currency": "USD",
        "sector": "Technology",
        "industry": "Software - Infrastructure",
        "exchange": "PNK",
        "market": "us_market",
        "country": "Finland",
        "city": "Helsinki"
    },
    "HEEROS.HE": {
        "short_name": "Heeros Oyj",
        "long_name": "Heeros Oyj",
        "summary": "Heeros Oyj provides cloud-based financial management solutions. The company offers automated solutions for purchase invoice workflow, invoice OCR processing, e-invoicing, e-archiving, SEPA payments, payable and receivable ledgers, general ledger accounting, and mobile applications. It also provides implementation, training, and main user services. The company serves individual businesses and organizations, accounting firms, governments, and educational institutes. Heeros Oyj is headquartered in Helsinki, Finland.",
        "currency": "EUR",
        "sector": "Technology",
        "industry": "Software - Infrastructure",
        "exchange": "HEL",
        "market": "fi_market",
        "country": "Finland",
        "city": "Helsinki"
    }
}