{"KPJHF": {"short_name": "KPJ HEALTHCARE", "long_name": "KPJ Healthcare Berhad", "summary": "KPJ Healthcare Berhad, an investment holding company, engages in the operation of specialist hospitals in Malaysia and internationally. The company provides pathology and laboratory services; management and engineering maintenance services for specialist hospitals; and medical and consultancy services for eye care, as well as maintenance services for medical equipment. It also operates a private university college of nursing and allied health; a pharmacy retail outlet; a dialysis centre; and retirement and aged care facilities, as well as operates and manages ambulatory care centre. In addition, the company engages in marketing and distributing medical, pharmaceutical, and consumer healthcare products; provision of information technology related services; and rental of software and human resource information system. Further, it provides general merchandise, human resource, building management, sterile, laundry, central kitchen, and training services. The company operates 28 hospitals in Malaysia; 2 hospitals in Indonesia; 1 hospital in Thailand; and 1 hospital in Bangladesh, as well as 4 retirement and aged care facilities in Malaysia and Australia. KPJ Healthcare Berhad was founded in 1981 and is based in Kuala Lumpur, Malaysia.", "currency": "USD", "sector": "Healthcare", "industry": "Medical Care Facilities", "exchange": "PNK", "market": "us_market", "country": "Malaysia", "city": "Kuala Lumpur"}, "Q0F.SI": {"short_name": "IHH", "long_name": "IHH Healthcare Berhad", "summary": "IHH Healthcare Berhad, an investment holding company, provides healthcare services. It provides primary care services, such as treatment of basic illnesses, routine check-ups, and vaccinations. The company also offers secondary services, including specialist consultation, local surgeries, emergency care, laboratory, diagnostics, and acute treatment services; tertiary care services comprising specialist consultative care, advanced treatment or complex surgery, and inpatient care services; and quaternary care services consisting of complex surgeries, such as, organ transplants, neurosurgery, cardiac surgery, and reconstructive plastic surgery. In addition, it provides a range of ancillary services, including diagnostics, analytical laboratory testing, therapeutic radiology, physiotherapy, and integrated rehabilitation and advanced molecular diagnostics services. Further, the company offers medical education and real estate investment trust services. It operated approximately 15,000 licensed beds across 77 hospitals in 10 countries worldwide. The company was formerly known as Integrated Healthcare Holdings Berhad and changed its name to IHH Healthcare Berhad in April 2012. IHH Healthcare Berhad was incorporated in 2010 and is based in Kuala Lumpur, Malaysia.", "currency": "SGD", "sector": "Healthcare", "industry": "Medical Care Facilities", "exchange": "SES", "market": "sg_market", "country": "Malaysia", "city": "Kuala Lumpur"}}