{
    "DVA.MX": {
        "short_name": "DAVITA INC",
        "long_name": "DaVita Inc.",
        "summary": "DaVita Inc. provides kidney dialysis services for patients suffering from chronic kidney failure or end stage renal disease (ESRD). The company operates kidney dialysis centers and provides related lab services in outpatient dialysis centers. It also provides outpatient, hospital inpatient, and home-based hemodialysis services; owns clinical laboratories that provide routine laboratory tests for dialysis and other physician-prescribed laboratory tests for ESRD patients; and management and administrative services to outpatient dialysis centers. In addition, the company provides disease management services; vascular access services; clinical research programs; physician services; and comprehensive care services. As of December 31, 2019, it provided dialysis and administrative services in the United States through a network of 2,753 outpatient dialysis centers serving approximately 206,900 patients; and operated 259 outpatient dialysis centers located in 10 countries outside of the United States serving approximately 28,700 patients. Further, the company provides acute inpatient dialysis services in approximately 900 hospitals and related laboratory services in the United States. The company was formerly known as DaVita HealthCare Partners Inc. and changed its name to DaVita Inc. in September 2016. DaVita Inc. was founded in 1994 and is headquartered in Denver, Colorado.",
        "currency": "MXN",
        "sector": "Healthcare",
        "industry": "Hospitals",
        "exchange": "MEX",
        "market": "mx_market",
        "country": "United States",
        "city": "Denver"
    },
    "IASO.AT": {
        "short_name": "IASO S.A. (CR)",
        "long_name": "IASO S.A.",
        "summary": "IASO S.A. operates hospitals, and a recovery and rehabilitation center in Europe. The company offers obstetrics and gynecology services, including gynecological oncology, endoscopic surgery, and pediatric and juvenile gynecology services, as well as delivery and operating rooms. It also provides diagnostics and therapeutics services comprising neonatal audiology; endocrinology, diabetes, and osteoporosis; and medical imaging, fetal medicine-gynecological ultrasounds, recurrent spontaneous abortions, neonatal cardiology, central laboratories, radiation oncology, breast center, cytology, urodynamics, medical oncology, surgical pathology, neonatal pediatrics, thyroid surgery department, and nuclear medicines, as well as plastic, reconstructive, and cosmetic surgery/laser services. In addition, the company offers outpatient department services, such as angiology, autoimmune rheumatic diseases and pregnancy, cardiology, check-up, colposcopy unit, dermatology, E.N.T, headache, hematology, nutritional support and dietetics, pediatric and adolescent gynecology, and male genito-urethral plastic surgery unit services, as well as endocrinology, diabetes, and osteoporosis services. Further, it operates intensive care, neonatal intensive care, and assisted reproduction units. IASO S.A. was founded in 1996 and is based in Athens, Greece. IASO S.A. is a subsidiary of Ocm Luxembourg Healthcare Greece S.\u00c3\u0080 R.L.",
        "currency": "EUR",
        "sector": "Healthcare",
        "industry": "Hospitals",
        "exchange": "ATH",
        "market": "gr_market",
        "country": "Greece",
        "city": "Athens"
    }
}