{
    "SANNV.PA": {
        "short_name": "SANOFI NV21",
        "long_name": "Sanofi",
        "summary": "Sanofi, a healthcare company, engages in the research, development, manufacture, and marketing of therapeutic solutions in the United States, Europe, and internationally. It operates through three segments: Pharmaceuticals, Vaccines, and Consumer Healthcare. The company provides specialty care products, including human monoclonal antibodies; products for multiple sclerosis, neurology, other inflammatory diseases, immunology, rare diseases, oncology, and rare blood disorders; medicines for diabetes; and cardiovascular and established prescription products. It also supplies poliomyelitis, pertussis, and hib pediatric vaccines; and influenza, adult booster, meningitis, and travel and endemic vaccines. In addition, the company offers allergy, cough and cold, pain, digestive, and nutritional products; and other products, such as daily body lotions, anti-itch products, moisturizing and soothing lotions, and body and foot creams, as well as powders for eczema. It also has various pharmaceutical products and vaccines in development stage. Sanofi has collaboration agreement with GlaxoSmithKline to develop a recombinant Covid-19 vaccine. The company was formerly known as Sanofi-Aventis and changed its name to Sanofi in May 2011. Sanofi was incorporated in 1994 and is headquartered in Paris, France.",
        "currency": "EUR",
        "sector": "Healthcare",
        "industry": "Drug Manufacturers - Major",
        "exchange": "PAR",
        "market": "fr_market",
        "country": "France",
        "city": "Paris"
    },
    "SNYN.MX": {
        "short_name": "SANOFI",
        "long_name": "Sanofi",
        "summary": "Sanofi, a healthcare company, engages in the research, development, manufacture, and marketing of therapeutic solutions in the United States, Europe, and internationally. It operates through three segments: Pharmaceuticals, Vaccines, and Consumer Healthcare. The company provides specialty care products, including human monoclonal antibodies; products for multiple sclerosis, neurology, other inflammatory diseases, immunology, rare diseases, oncology, and rare blood disorders; medicines for diabetes; and cardiovascular and established prescription products. It also supplies poliomyelitis, pertussis, and hib pediatric vaccines; and influenza, adult booster, meningitis, and travel and endemic vaccines. In addition, the company offers allergy, cough and cold, pain, digestive, and nutritional products; and other products, such as daily body lotions, anti-itch products, moisturizing and soothing lotions, and body and foot creams, as well as powders for eczema. It also has various pharmaceutical products and vaccines in development stage. Sanofi has collaboration agreement with GlaxoSmithKline to develop a recombinant Covid-19 vaccine. The company was formerly known as Sanofi-Aventis and changed its name to Sanofi in May 2011. Sanofi was incorporated in 1994 and is headquartered in Paris, France.",
        "currency": "MXN",
        "sector": "Healthcare",
        "industry": "Drug Manufacturers - Major",
        "exchange": "MEX",
        "market": "mx_market",
        "country": "France",
        "city": "Paris"
    }
}