{"0LZ.F": {"short_name": "YELLOW CAKE PLC  LS-,01", "long_name": "Yellow Cake plc", "summary": "Yellow Cake plc, a specialist company, operates in the uranium sector. It is involved in the purchase and holding of triuranium octoxide. The company was founded in 2018 and is headquartered in St Helier, Jersey.", "currency": "EUR", "sector": "Energy", "industry": "Uranium", "exchange": "FRA", "market": "dr_market", "country": "Jersey", "city": "St Helier"}, "0ZQ.F": {"short_name": "KAZATOMPROM  GDR REGS 1/1", "long_name": "joint stock company \"National atomic company \"Kazatomprom\"", "summary": "joint stock company 'National atomic company 'Kazatomprom' produces and sells uranium and uranium products. It also manufactures and sells beryllium and tantalum products; provides communication and security services; mines rare-earth metals; and produces semiconductor materials. In addition, the company offers research, project, development, and engineering consulting services; explores for, extracts, and processes molybdenum-copper ores; produces and sells metallurgical and polycrystalline silicon; recycles silicon production waste; and produces solar quality silicon, and silicon and photovoltaic slices, and photovoltaic modules. Further, it provides drilling services; monitors radiation level and environment conditions; and offers procurement and transportation services. The company operates in the Republic of Kazakhstan and internationally. joint stock company 'National atomic company 'Kazatomprom' was founded in 1997 and is based in Nur-Sultan, Kazakhstan.", "currency": "EUR", "sector": "Energy", "industry": "Uranium", "exchange": "FRA", "market": "dr_market", "country": "Kazakhstan", "city": "Nur-Sultan"}, "2F3A.F": {"short_name": "FISSION 3.0 CORP.", "long_name": "Fission 3.0 Corp.", "summary": "Fission 3.0 Corp. engages in the acquisition, exploration, and development of uranium resource properties. It has approximately 226,351 hectares of exploration properties with uranium potential in Saskatchewan and Alberta in Canada, and Peru. The company was incorporated in 2013 and is headquartered in Kelowna, Canada.", "currency": "EUR", "sector": "Energy", "industry": "Uranium", "exchange": "FRA", "market": "dr_market", "country": "Canada", "city": "Kelowna"}, "2FU.F": {"short_name": "FISSION URANIUM CORP.", "long_name": "Fission Uranium Corp.", "summary": "Fission Uranium Corp. engages in the acquisition, exploration, and development of uranium resource properties in Canada. Its primary asset is the 100% owned Patterson Lake South property that consists of 17 contiguous mineral claims covering an area of 31,039 hectares located in the Athabasca Basin region of Saskatchewan. The company was incorporated in 2013 and is headquartered in Kelowna, Canada.", "currency": "EUR", "sector": "Energy", "industry": "Uranium", "exchange": "FRA", "market": "dr_market", "country": "Canada", "city": "Kelowna"}, "6LLN.F": {"short_name": "ALX RESOURCES CORP.", "long_name": "ALX Resources Corp.", "summary": "ALX Resources Corp. engages in the acquisition, exploration, and development of uranium properties in Canada. The company holds interests in approximately 200,000 hectares in Saskatchewan, Canada. It also explores for nickel, copper, and cobalt minerals totaling approximately 7,414 hectares at its Falcon Nickel Project located in the northern Athabasca region of Saskatchewan, as well as explores for gold. In addition, it holds interest in the Sceptre gold project that consists of 12 claims covering an area of 6,226 hectares located in east-central Saskatchewan; and Hummingbird Gold Project, which include 12 claims covering an area of 14,097.87 hectares located in the town of Stony Rapids, Saskatchewan. The company was formerly known as ALX Uranium Corp. and changed its name to ALX Resources Corp. in January 2020. ALX Resources Corp. was incorporated in 2007 and is headquartered in Vancouver, Canada.", "currency": "EUR", "sector": "Energy", "industry": "Uranium", "exchange": "FRA", "market": "dr_market", "country": "Canada", "city": "Vancouver"}, "7GU.F": {"short_name": "GOVIEX URANIUM INC A", "long_name": "GoviEx Uranium Inc.", "summary": "GoviEx Uranium Inc., a mineral resources company, engages in the acquisition, exploration, and development of uranium projects in Africa. The company principally holds an 80% interest in the Madaouela project located in north-central Niger. It also owns 100% interests in the Mutanga project situated to the south of Lusaka, Zambia; and the Falea project located in Mali. The company was formerly known as Govi High Power Exploration Inc. and changed its name to GoviEx Uranium Inc. in September 2008. GoviEx Uranium Inc. was incorporated in 2006 and is headquartered in Vancouver, Canada.", "currency": "EUR", "sector": "Energy", "industry": "Uranium", "exchange": "FRA", "market": "dr_market", "country": "Canada", "city": "Vancouver"}, "A0U2.F": {"short_name": "AZINCOURT ENERGY", "long_name": "Azincourt Energy Corp.", "summary": "Azincourt Energy Corp., an exploration and development company, focuses on the alternative fuels/alternative energy sector in Canada and Peru. It explores for uranium and lithium deposits, as well as other clean energy elements. The company has an option to acquire a 70% interest in the East Preston project located in Saskatchewan; and 100% interest in the ELC project located in Peru. The company was formerly known as Azincourt Uranium Inc. and changed its name to Azincourt Energy Corp. in October 2017. Azincourt Energy Corp. was incorporated in 2011 and is headquartered in Vancouver, Canada.", "currency": "EUR", "sector": "Energy", "industry": "Uranium", "exchange": "FRA", "market": "dr_market", "country": "Canada", "city": "Vancouver"}, "AAZ.V": {"short_name": "AZINCOURT ENERGY CORP", "long_name": "Azincourt Energy Corp.", "summary": "Azincourt Energy Corp., an exploration and development company, focuses on the alternative fuels/alternative energy sector in Canada and Peru. It explores for uranium and lithium deposits, as well as other clean energy elements. The company has an option to acquire a 70% interest in the East Preston project located in Saskatchewan; and 100% interest in the ELC project located in Peru. The company was formerly known as Azincourt Uranium Inc. and changed its name to Azincourt Energy Corp. in October 2017. Azincourt Energy Corp. was incorporated in 2011 and is headquartered in Vancouver, Canada.", "currency": "CAD", "sector": "Energy", "industry": "Uranium", "exchange": "VAN", "market": "ca_market", "country": "Canada", "city": "Vancouver"}, "ADD.AX": {"short_name": "ADAVALE FPO", "long_name": "Adavale Resources Limited", "summary": "Adavale Resources Limited engages in the mining, exploration and development activities in Australia and Indonesia. The company holds a 100% interest in the Lake Surprise uranium project covering an area of 2705 square kilometers located in the northern part of the Lake Frome Embayment, South Australia; and Kabanga North and North East project covering an area of 411 square kilometers situated in northwestern Tanzania. The company as incorporated in 1969 and is based in Sydney, Australia.", "currency": "AUD", "sector": "Energy", "industry": "Uranium", "exchange": "ASX", "market": "au_market", "country": "Australia", "city": "Sydney"}, "AL.V": {"short_name": "ALX RESOURCES CORP", "long_name": "ALX Resources Corp.", "summary": "ALX Resources Corp. engages in the acquisition, exploration, and development of uranium properties in Canada. The company holds interests in approximately 200,000 hectares in Saskatchewan, Canada. It also explores for nickel, copper, and cobalt minerals totaling approximately 7,414 hectares at its Falcon Nickel Project located in the northern Athabasca region of Saskatchewan, as well as explores for gold. In addition, it holds interest in the Sceptre gold project that consists of 12 claims covering an area of 6,226 hectares located in east-central Saskatchewan; and Hummingbird Gold Project, which include 12 claims covering an area of 14,097.87 hectares located in the town of Stony Rapids, Saskatchewan. The company was formerly known as ALX Uranium Corp. and changed its name to ALX Resources Corp. in January 2020. ALX Resources Corp. was incorporated in 2007 and is headquartered in Vancouver, Canada.", "currency": "CAD", "sector": "Energy", "industry": "Uranium", "exchange": "VAN", "market": "ca_market", "country": "Canada", "city": "Vancouver"}, "ALXEF": {"short_name": "ALX RESOURCES CORP", "long_name": "ALX Resources Corp.", "summary": "ALX Resources Corp. engages in the acquisition, exploration, and development of uranium properties in Canada. The company holds interests in approximately 200,000 hectares in Saskatchewan, Canada. It also explores for nickel, copper, and cobalt minerals totaling approximately 7,414 hectares at its Falcon Nickel Project located in the northern Athabasca region of Saskatchewan, as well as explores for gold. In addition, it holds interest in the Sceptre gold project that consists of 12 claims covering an area of 6,226 hectares located in east-central Saskatchewan; and Hummingbird Gold Project, which include 12 claims covering an area of 14,097.87 hectares located in the town of Stony Rapids, Saskatchewan. The company was formerly known as ALX Uranium Corp. and changed its name to ALX Resources Corp. in January 2020. ALX Resources Corp. was incorporated in 2007 and is headquartered in Vancouver, Canada.", "currency": "USD", "sector": "Energy", "industry": "Uranium", "exchange": "PNK", "market": "us_market", "country": "Canada", "city": "Vancouver"}, "ANLDF": {"short_name": "ANFIELD ENERGY INC", "long_name": "Anfield Energy Inc.", "summary": "Anfield Energy Inc. engages in the mineral development and production activities in the United States. It primarily explores for uranium, vanadium, and copper deposits. The company holds interests in the uranium exploration properties in Utah, Wyoming, and Arizona, as well as uranium/vanadium properties in Colorado. It also owns a 100% interest in the Upper Maybelle River uranium project located in the Athabasca Basin. The company was formerly known as Anfield Resources Inc. and changed its name to Anfield Energy Inc. in December 2017. Anfield Energy Inc. was incorporated in 1989 and is headquartered in Burnaby, Canada.", "currency": "USD", "sector": "Energy", "industry": "Uranium", "exchange": "PNK", "market": "us_market", "country": "Canada", "city": "Burnaby"}, "APAAF": {"short_name": "APPIA ENERGY CORP", "long_name": "Appia Energy Corp.", "summary": "Appia Energy Corp. acquires, explores for, develops, and evaluates mineral properties in Canada. It primarily explores uranium and rare earth deposits. The company owns 100% interests in the Elliot Lake property comprising 61 mining claims covering an area of approximately 12,545 hectares located in northern Ontario; the Alces Lake property covering an area of 17,577 hectares; the Eastside property that covers an area of 4,933 hectares; the Loranger property comprises 26,409 hectares; and the North Wollaston property covering an area of 16,682 hectares located in Saskatchewan. The company was incorporated in 2007 and is based in Toronto, Canada.", "currency": "USD", "sector": "Energy", "industry": "Uranium", "exchange": "PNK", "market": "us_market", "country": "Canada", "city": "Toronto"}, "API.CN": {"short_name": "AppiaEnergy Co", "long_name": "Appia Energy Corp.", "summary": "Appia Energy Corp. acquires, explores for, develops, and evaluates mineral properties in Canada. It primarily explores uranium and rare earth deposits. The company owns 100% interests in the Elliot Lake property comprising 61 mining claims covering an area of approximately 12,545 hectares located in northern Ontario; the Alces Lake property covering an area of 17,577 hectares; the Eastside property that covers an area of 4,933 hectares; the Loranger property comprises 26,409 hectares; and the North Wollaston property covering an area of 16,682 hectares located in Saskatchewan. The company was incorporated in 2007 and is based in Toronto, Canada.", "currency": "CAD", "sector": "Energy", "industry": "Uranium", "exchange": "CNQ", "market": "ca_market", "country": "Canada", "city": "Toronto"}, "AZURF": {"short_name": "AZINCOURT ENERGY CORP", "long_name": "Azincourt Energy Corp.", "summary": "Azincourt Energy Corp., an exploration and development company, focuses on the alternative fuels/alternative energy sector in Canada and Peru. It explores for uranium and lithium deposits, as well as other clean energy elements. The company has an option to acquire a 70% interest in the East Preston project located in Saskatchewan; and 100% interest in the ELC project located in Peru. The company was formerly known as Azincourt Uranium Inc. and changed its name to Azincourt Energy Corp. in October 2017. Azincourt Energy Corp. was incorporated in 2011 and is headquartered in Vancouver, Canada.", "currency": "USD", "sector": "Energy", "industry": "Uranium", "exchange": "PNK", "market": "us_market", "country": "Canada", "city": "Vancouver"}, "AZZ.TO": {"short_name": "AZARGA URANIUM CORP", "long_name": "Azarga Uranium Corp.", "summary": "Azarga Uranium Corp. operates as an integrated uranium exploration and development company in the United States and the Kyrgyz Republic. The company owns interests in the Dewey Burdock project covering an area of approximately 12,613 surface acres and 16,962 net mineral acres located in South Dakota; and Gas Hills project covering an area of approximately 1,280 surface acres and 12,960 net mineral acres located to the east of Riverton, Wyoming. It also holds interests in the Centennial project that comprises approximately 1,365 acres of surface rights and 6,238 acres of net mineral rights located in the western part of Weld County in north-eastern Colorado; Aladdin exploration project totaling an area of 5,166 acres of surface rights and 4,618 acres of net mineral rights located in Crook County, Wyoming; and Dewey Terrace project comprising 270 mining claims covering an area of approximately 1,874 acres of surface rights and 7,514 acres of mineral rights located in Weston and Niobrara counties of Wyoming. In addition, the company owns interests in the Juniper Ridge project totaling an area of approximately 640 surface acres and 3,240 net mineral acres located in Carbon County, Wyoming; Shirley Basin project covering an area of approximately 680 surface acres and 3,200 net mineral acres located in the southwest portion of Wyoming; and Ticaboo project that includes 26 mining and 8 placer claims in Garfield County, Utah. Further, it holds interests in the JB property comprising 66 unpatented mining claims covering an area of approximately 1,320 net mineral acres located in San Miguel County, Colorado and San Juan County, Utah; and Powder River Basin prospect consisting of 199 mining claims covers an area of approximately 3,980 acres of net mineral rights in Campbell County, Wyoming. The company was incorporated in 1984 and is based in White Rock, Canada.", "currency": "CAD", "sector": "Energy", "industry": "Uranium", "exchange": "TOR", "market": "ca_market", "country": "Canada", "city": "White Rock"}, "AZZUF": {"short_name": "AZARGA URANIUM CORP", "long_name": "Azarga Uranium Corp.", "summary": "Azarga Uranium Corp. operates as an integrated uranium exploration and development company in the United States and the Kyrgyz Republic. The company owns interests in the Dewey Burdock project covering an area of approximately 12,613 surface acres and 16,962 net mineral acres located in South Dakota; and Gas Hills project covering an area of approximately 1,280 surface acres and 12,960 net mineral acres located to the east of Riverton, Wyoming. It also holds interests in the Centennial project that comprises approximately 1,365 acres of surface rights and 6,238 acres of net mineral rights located in the western part of Weld County in north-eastern Colorado; Aladdin exploration project totaling an area of 5,166 acres of surface rights and 4,618 acres of net mineral rights located in Crook County, Wyoming; and Dewey Terrace project comprising 270 mining claims covering an area of approximately 1,874 acres of surface rights and 7,514 acres of mineral rights located in Weston and Niobrara counties of Wyoming. In addition, the company owns interests in the Juniper Ridge project totaling an area of approximately 640 surface acres and 3,240 net mineral acres located in Carbon County, Wyoming; Shirley Basin project covering an area of approximately 680 surface acres and 3,200 net mineral acres located in the southwest portion of Wyoming; and Ticaboo project that includes 26 mining and 8 placer claims in Garfield County, Utah. Further, it holds interests in the JB property comprising 66 unpatented mining claims covering an area of approximately 1,320 net mineral acres located in San Miguel County, Colorado and San Juan County, Utah; and Powder River Basin prospect consisting of 199 mining claims covers an area of approximately 3,980 acres of net mineral rights in Campbell County, Wyoming. The company was incorporated in 1984 and is based in White Rock, Canada.", "currency": "USD", "sector": "Energy", "industry": "Uranium", "exchange": "PNK", "market": "us_market", "country": "Canada", "city": "White Rock"}, "BH6.F": {"short_name": "BANNERMAN RES LTD", "long_name": "Bannerman Resources Limited", "summary": "Bannerman Resources Limited engages in the exploration and development of uranium properties in Namibia, Southern Africa. Its principal property is its 95% -owned Etango Project located in the Erongo uranium mining region of Namibia. The company was incorporated in 2005 and is based in Subiaco, Australia.", "currency": "EUR", "sector": "Energy", "industry": "Uranium", "exchange": "FRA", "market": "dr_market", "country": "Australia", "city": "Subiaco"}, "BKLRF": {"short_name": "BERKELEY ENERGIA LIMITED", "long_name": "Berkeley Energia Limited", "summary": "Berkeley Energia Limited engages in the exploration and development of uranium properties in Spain. It primarily holds interest in the Salamanca project located in western Spain. The company was formerly known as Berkeley Energy Limited and changed its name to Berkeley Energia Limited in November 2015. Berkeley Energia Limited was incorporated in 1991 and is headquartered in Madrid, Spain.", "currency": "USD", "sector": "Energy", "industry": "Uranium", "exchange": "PNK", "market": "us_market", "country": "Spain", "city": "Madrid"}, "BKUCF": {"short_name": "BLUE SKY URANIUM CORP", "long_name": "Blue Sky Uranium Corp.", "summary": "Blue Sky Uranium Corp., a junior uranium exploration company, engages in acquiring, exploring, and evaluating natural resource properties in Argentina. It holds rights to approximately 400,000 hectares of properties in two provinces in Argentina. The company's flagship project is the Amarillo Grande project, which covers an area of approximately 300,000 hectares located in central Rio Negro province, in the Patagonia region of southern Argentina. The company was formerly known as Mulligan Capital Corp. Blue Sky Uranium Corp. was incorporated in 2005 and is headquartered in Vancouver, Canada.", "currency": "USD", "sector": "Energy", "industry": "Uranium", "exchange": "PNK", "market": "us_market", "country": "Canada", "city": "Vancouver"}, "BKY.AX": {"short_name": "BERKELEY FPO", "long_name": "Berkeley Energia Limited", "summary": "Berkeley Energia Limited engages in the exploration and development of uranium properties in Spain. It primarily holds interest in the Salamanca project located in western Spain. The company was formerly known as Berkeley Energy Limited and changed its name to Berkeley Energia Limited in November 2015. Berkeley Energia Limited was incorporated in 1991 and is headquartered in Madrid, Spain.", "currency": "AUD", "sector": "Energy", "industry": "Uranium", "exchange": "ASX", "market": "au_market", "country": "Spain", "city": "Madrid"}, "BKY.L": {"short_name": "BERKELEY ENERGIA LIMITED ORD NP", "long_name": "Berkeley Energia Limited", "summary": "Berkeley Energia Limited engages in the exploration and development of uranium properties in Spain. It primarily holds interest in the Salamanca project located in western Spain. The company was formerly known as Berkeley Energy Limited and changed its name to Berkeley Energia Limited in November 2015. Berkeley Energia Limited was incorporated in 1991 and is headquartered in Madrid, Spain.", "currency": "GBp", "sector": "Energy", "industry": "Uranium", "exchange": "LSE", "market": "gb_market", "country": "Spain", "city": "Madrid"}, "BKY.MC": {"short_name": "BERKELEY ENERGIA LIMITED", "long_name": "Berkeley Energia Limited", "summary": "Berkeley Energia Limited engages in the exploration and development of uranium properties in Spain. It primarily holds interest in the Salamanca project located in western Spain. The company was formerly known as Berkeley Energy Limited and changed its name to Berkeley Energia Limited in November 2015. Berkeley Energia Limited was incorporated in 1991 and is headquartered in Madrid, Spain.", "currency": "EUR", "sector": "Energy", "industry": "Uranium", "exchange": "MCE", "market": "es_market", "country": "Spain", "city": "Madrid"}, "BMN.AX": {"short_name": "BANNERMAN FPO", "long_name": "Bannerman Resources Limited", "summary": "Bannerman Resources Limited engages in the exploration and development of uranium properties in Namibia, Southern Africa. Its principal property is its 95% -owned Etango Project located in the Erongo uranium mining region of Namibia. The company was incorporated in 2005 and is based in Subiaco, Australia.", "currency": "AUD", "sector": "Energy", "industry": "Uranium", "exchange": "ASX", "market": "au_market", "country": "Australia", "city": "Subiaco"}, "BNNLF": {"short_name": "BANNERMAN RESOURCES LIMITED", "long_name": "Bannerman Resources Limited", "summary": "Bannerman Resources Limited engages in the exploration and development of uranium properties in Namibia, Southern Africa. Its principal property is its 95% -owned Etango Project located in the Erongo uranium mining region of Namibia. The company was incorporated in 2005 and is based in Subiaco, Australia.", "currency": "USD", "sector": "Energy", "industry": "Uranium", "exchange": "PNK", "market": "us_market", "country": "Australia", "city": "Subiaco"}, "BSENF": {"short_name": "BASELODE ENERGY CORP", "long_name": "Baselode Energy Corp.", "summary": "Baselode Energy Corp. operates as a uranium exploration company. It focuses on discovering uranium orebody in the Athabasca basin in Saskatchewan, Canada. The company is based in Toronto, Canada.", "currency": "USD", "sector": "Energy", "industry": "Uranium", "exchange": "PNK", "market": "us_market", "country": "Canada", "city": "Toronto"}, "BSK.V": {"short_name": "BLUE SKY URANIUM CORP", "long_name": "Blue Sky Uranium Corp.", "summary": "Blue Sky Uranium Corp., a junior uranium exploration company, engages in acquiring, exploring, and evaluating natural resource properties in Argentina. It holds rights to approximately 400,000 hectares of properties in two provinces in Argentina. The company's flagship project is the Amarillo Grande project, which covers an area of approximately 300,000 hectares located in central Rio Negro province, in the Patagonia region of southern Argentina. The company was formerly known as Mulligan Capital Corp. Blue Sky Uranium Corp. was incorporated in 2005 and is headquartered in Vancouver, Canada.", "currency": "CAD", "sector": "Energy", "industry": "Uranium", "exchange": "VAN", "market": "ca_market", "country": "Canada", "city": "Vancouver"}, "CCJ": {"short_name": "Cameco Corporation", "long_name": "Cameco Corporation", "summary": "Cameco Corporation produces and sells uranium. The company operates in two segments, Uranium and Fuel Services. The Uranium segment is involved in the exploration for, mining, and milling, as well as purchase and sale of uranium concentrate. Its operating uranium property is the Cigar Lake property located in Saskatchewan, Canada. The Fuel Services segment engages in the refining, conversion, and fabrication of uranium concentrate, as well as the purchase and sale of conversion services. This segment also produces fuel bundles and reactor components for CANDU reactors. The company sells its uranium and fuel services to nuclear utilities in the Americas, Europe, and Asia. Cameco Corporation was incorporated in 1987 and is headquartered in Saskatoon, Canada.", "currency": "USD", "sector": "Energy", "industry": "Uranium", "exchange": "NYQ", "market": "us_market", "country": "Canada", "city": "Saskatoon"}, "CCO.TO": {"short_name": "CAMECO CORP", "long_name": "Cameco Corporation", "summary": "Cameco Corporation produces and sells uranium. The company operates in two segments, Uranium and Fuel Services. The Uranium segment is involved in the exploration for, mining, and milling, as well as purchase and sale of uranium concentrate. Its operating uranium property is the Cigar Lake property located in Saskatchewan, Canada. The Fuel Services segment engages in the refining, conversion, and fabrication of uranium concentrate, as well as the purchase and sale of conversion services. This segment also produces fuel bundles and reactor components for CANDU reactors. The company sells its uranium and fuel services to nuclear utilities in the Americas, Europe, and Asia. Cameco Corporation was incorporated in 1987 and is headquartered in Saskatoon, Canada.", "currency": "CAD", "sector": "Energy", "industry": "Uranium", "exchange": "TOR", "market": "ca_market", "country": "Canada", "city": "Saskatoon"}, "CJ6.F": {"short_name": "CAMECO CORP.", "long_name": "Cameco Corporation", "summary": "Cameco Corporation produces and sells uranium. The company operates in two segments, Uranium and Fuel Services. The Uranium segment is involved in the exploration for, mining, and milling, as well as purchase and sale of uranium concentrate. Its operating uranium property is the Cigar Lake property located in Saskatchewan, Canada. The Fuel Services segment engages in the refining, conversion, and fabrication of uranium concentrate, as well as the purchase and sale of conversion services. This segment also produces fuel bundles and reactor components for CANDU reactors. The company sells its uranium and fuel services to nuclear utilities in the Americas, Europe, and Asia. Cameco Corporation was incorporated in 1987 and is headquartered in Saskatoon, Canada.", "currency": "EUR", "sector": "Energy", "industry": "Uranium", "exchange": "FRA", "market": "dr_market", "country": "Canada", "city": "Saskatoon"}, "DML.TO": {"short_name": "DENISON MINES CORP.", "long_name": "Denison Mines Corp.", "summary": "Denison Mines Corp. operates as a uranium exploration and development company in Canada. Its flagship project is the 90% interest owned Wheeler River Uranium project located in the Athabasca Basin region in northern Saskatchewan. The company was formerly known as International Uranium Corporation and changed its name to Denison Mines Corp. in December 2006. Denison Mines Corp. is headquartered in Toronto, Canada.", "currency": "CAD", "sector": "Energy", "industry": "Uranium", "exchange": "TOR", "market": "ca_market", "country": "Canada", "city": "Toronto"}, "DNN": {"short_name": "Denison Mines Corp", "long_name": "Denison Mines Corp.", "summary": "Denison Mines Corp. operates as a uranium exploration and development company in Canada. Its flagship project is the 90% interest owned Wheeler River Uranium project located in the Athabasca Basin region in northern Saskatchewan. The company was formerly known as International Uranium Corporation and changed its name to Denison Mines Corp. in December 2006. Denison Mines Corp. is headquartered in Toronto, Canada.", "currency": "USD", "sector": "Energy", "industry": "Uranium", "exchange": "ASE", "market": "us_market", "country": "Canada", "city": "Toronto"}, "DYL.AX": {"short_name": "D YELLOW FPO", "long_name": "Deep Yellow Limited", "summary": "Deep Yellow Limited operates as a uranium exploration company in Namibia. The company holds a 100% interest in the Reptile Uranium project, which covers an area of 896 square kilometers (km2); 65% interest in the Nova Joint Venture covering an area of 599 km2; and  85% interest in the Yellow Dune Joint Venture covering an area of 190 km2. It is also involved in the iron ore exploration and property investment businesses. The company was incorporated in 1985 and is headquartered in Subiaco, Australia.", "currency": "AUD", "sector": "Energy", "industry": "Uranium", "exchange": "ASX", "market": "au_market", "country": "Australia", "city": "Subiaco"}, "DYLLF": {"short_name": "DEEP YELLOW LIMITED", "long_name": "Deep Yellow Limited", "summary": "Deep Yellow Limited operates as a uranium exploration company in Namibia. The company holds a 100% interest in the Reptile Uranium project, which covers an area of 896 square kilometers (km2); 65% interest in the Nova Joint Venture covering an area of 599 km2; and  85% interest in the Yellow Dune Joint Venture covering an area of 190 km2. It is also involved in the iron ore exploration and property investment businesses. The company was incorporated in 1985 and is headquartered in Subiaco, Australia.", "currency": "USD", "sector": "Energy", "industry": "Uranium", "exchange": "PNK", "market": "us_market", "country": "Australia", "city": "Subiaco"}, "EFR.TO": {"short_name": "ENERGY FUELS INC.", "long_name": "Energy Fuels Inc.", "summary": "Energy Fuels Inc., together with its subsidiaries, engages in the extraction, recovery, exploration, and sale of conventional and in situ uranium recovery in the United States. The company owns and operates the Nichols Ranch project, the Jane Dough property, and the Hank project located in Wyoming; and the Alta Mesa in-situ uranium project located in Texas, as well as White Mesa Mill in Utah. It also holds interests in uranium and uranium/vanadium properties and projects in various stages of exploration, permitting, and evaluation located in Utah, Wyoming, Arizona, New Mexico, and Colorado. The company was formerly known as Volcanic Metals Exploration Inc. and changed its name to Energy Fuels Inc. in May 2006. Energy Fuels Inc. was incorporated in 1987 and is headquartered in Lakewood, Colorado.", "currency": "CAD", "sector": "Energy", "industry": "Uranium", "exchange": "TOR", "market": "ca_market", "country": "United States", "city": "Lakewood"}, "EGRAF": {"short_name": "ENERGY RESOURCES OF AUSTRALIA", "long_name": "Energy Resources of Australia Ltd", "summary": "Energy Resources of Australia Ltd engages in mining, processing, and selling uranium oxide. The company holds interests in three assets, including the Ranger Stockpiles, the Ranger 3 Deeps underground resource, and the Jabiluka Mineral Lease. It sells its products to power utilities in the United States, Europe, China, Japan, South Korea, and the United Arab Emirates. The company was founded in 1980 and is headquartered in Darwin, Australia. Energy Resources of Australia Ltd is a subsidiary of North Limited.", "currency": "USD", "sector": "Energy", "industry": "Uranium", "exchange": "PNK", "market": "us_market", "country": "Australia", "city": "Darwin"}, "ENCUF": {"short_name": "ENCORE ENERGY CORP", "long_name": "enCore Energy Corp.", "summary": "enCore Energy Corp., together with its subsidiaries, engages in the acquisition and exploration of resource properties in the United States. It holds a 100% interest in approximately 115,000 acres of private mineral rights, including the Crownpoint and Hosta Butte uranium deposits located in New Mexico. The company also holds interest in the Marquez project consists of private mineral leases located in McKinley and Sandoval counties of New Mexico; the Nose Rock project comprising 42 owned unpatented lode mining claims located in McKinley County, New Mexico; and the Moonshine Springs project consisting of 23 owned unpatented lode mining claims, including 7 unpatented lode mining claims and 320 acres of fee land under lease located in Mohave County, Arizona. In addition, it holds interest in the White Canyon District and Utah property package, including the Geitus, Blue Jay, Marcy Look, and Cedar Mountain projects located to the northwest of the White Mesa Mill at Blanding County, Utah. The company was formerly known as Wolfpack Gold Corp. and changed its name to enCore Energy Corp. in August 2014. enCore Energy Corp. was incorporated in 2009 and is headquartered in Vancouver, Canada.", "currency": "USD", "sector": "Energy", "industry": "Uranium", "exchange": "PNK", "market": "us_market", "country": "Canada", "city": "Vancouver"}, "EU.V": {"short_name": "ENCORE ENERGY CORP", "long_name": "enCore Energy Corp.", "summary": "enCore Energy Corp., together with its subsidiaries, engages in the acquisition and exploration of resource properties in the United States. It holds a 100% interest in approximately 115,000 acres of private mineral rights, including the Crownpoint and Hosta Butte uranium deposits located in New Mexico. The company also holds interest in the Marquez project consists of private mineral leases located in McKinley and Sandoval counties of New Mexico; the Nose Rock project comprising 42 owned unpatented lode mining claims located in McKinley County, New Mexico; and the Moonshine Springs project consisting of 23 owned unpatented lode mining claims, including 7 unpatented lode mining claims and 320 acres of fee land under lease located in Mohave County, Arizona. In addition, it holds interest in the White Canyon District and Utah property package, including the Geitus, Blue Jay, Marcy Look, and Cedar Mountain projects located to the northwest of the White Mesa Mill at Blanding County, Utah. The company was formerly known as Wolfpack Gold Corp. and changed its name to enCore Energy Corp. in August 2014. enCore Energy Corp. was incorporated in 2009 and is headquartered in Vancouver, Canada.", "currency": "CAD", "sector": "Energy", "industry": "Uranium", "exchange": "VAN", "market": "ca_market", "country": "Canada", "city": "Vancouver"}, "FCU.TO": {"short_name": "FISSION URANIUM CORP", "long_name": "Fission Uranium Corp.", "summary": "Fission Uranium Corp. engages in the acquisition, exploration, and development of uranium resource properties in Canada. Its primary asset is the 100% owned Patterson Lake South property that consists of 17 contiguous mineral claims covering an area of 31,039 hectares located in the Athabasca Basin region of Saskatchewan. The company was incorporated in 2013 and is headquartered in Kelowna, Canada.", "currency": "CAD", "sector": "Energy", "industry": "Uranium", "exchange": "TOR", "market": "ca_market", "country": "Canada", "city": "Kelowna"}, "FCUUF": {"short_name": "FISSION URANIUM CO", "long_name": "Fission Uranium Corp.", "summary": "Fission Uranium Corp. engages in the acquisition, exploration, and development of uranium resource properties in Canada. Its primary asset is the 100% owned Patterson Lake South property that consists of 17 contiguous mineral claims covering an area of 31,039 hectares located in the Athabasca Basin region of Saskatchewan. The company was incorporated in 2013 and is headquartered in Kelowna, Canada.", "currency": "USD", "sector": "Energy", "industry": "Uranium", "exchange": "PNK", "market": "us_market", "country": "Canada", "city": "Kelowna"}, "FIND.V": {"short_name": "BASELODE ENERGY CORP", "long_name": "Baselode Energy Corp.", "summary": "Baselode Energy Corp. operates as a uranium exploration company. It focuses on discovering uranium orebody in the Athabasca basin in Saskatchewan, Canada. The company is based in Toronto, Canada.", "currency": "CAD", "sector": "Energy", "industry": "Uranium", "exchange": "VAN", "market": "ca_market", "country": "Canada", "city": "Toronto"}, "FISOF": {"short_name": "FISSION 3.0 CORP", "long_name": "Fission 3.0 Corp.", "summary": "Fission 3.0 Corp. engages in the acquisition, exploration, and development of uranium resource properties. It has approximately 226,351 hectares of exploration properties with uranium potential in Saskatchewan and Alberta in Canada, and Peru. The company was incorporated in 2013 and is headquartered in Kelowna, Canada.", "currency": "USD", "sector": "Energy", "industry": "Uranium", "exchange": "PNK", "market": "us_market", "country": "Canada", "city": "Kelowna"}, "FUU.V": {"short_name": "FISSION 3.0 CORP", "long_name": "Fission 3.0 Corp.", "summary": "Fission 3.0 Corp. engages in the acquisition, exploration, and development of uranium resource properties. It has approximately 226,351 hectares of exploration properties with uranium potential in Saskatchewan and Alberta in Canada, and Peru. The company was incorporated in 2013 and is headquartered in Kelowna, Canada.", "currency": "CAD", "sector": "Energy", "industry": "Uranium", "exchange": "VAN", "market": "ca_market", "country": "Canada", "city": "Kelowna"}, "GVXXF": {"short_name": "GOVIEX URANIUM INC", "long_name": "GoviEx Uranium Inc.", "summary": "GoviEx Uranium Inc., a mineral resources company, engages in the acquisition, exploration, and development of uranium projects in Africa. The company principally holds an 80% interest in the Madaouela project located in north-central Niger. It also owns 100% interests in the Mutanga project situated to the south of Lusaka, Zambia; and the Falea project located in Mali. The company was formerly known as Govi High Power Exploration Inc. and changed its name to GoviEx Uranium Inc. in September 2008. GoviEx Uranium Inc. was incorporated in 2006 and is headquartered in Vancouver, Canada.", "currency": "USD", "sector": "Energy", "industry": "Uranium", "exchange": "PNK", "market": "us_market", "country": "Canada", "city": "Vancouver"}, "GXU.V": {"short_name": "GOVIEX URANIUM INC", "long_name": "GoviEx Uranium Inc.", "summary": "GoviEx Uranium Inc., a mineral resources company, engages in the acquisition, exploration, and development of uranium projects in Africa. The company principally holds an 80% interest in the Madaouela project located in north-central Niger. It also owns 100% interests in the Mutanga project situated to the south of Lusaka, Zambia; and the Falea project located in Mali. The company was formerly known as Govi High Power Exploration Inc. and changed its name to GoviEx Uranium Inc. in September 2008. GoviEx Uranium Inc. was incorporated in 2006 and is headquartered in Vancouver, Canada.", "currency": "CAD", "sector": "Energy", "industry": "Uranium", "exchange": "VAN", "market": "ca_market", "country": "Canada", "city": "Vancouver"}, "I01.F": {"short_name": "ISOENERGY LTD. O.N.", "long_name": "IsoEnergy Ltd.", "summary": "IsoEnergy Ltd. engages in the acquisition, evaluation, and exploration of uranium mineral properties. It primarily holds a 100% interest each in the Radio, Larocque East, Geiger, and Thorburn Lake projects in the Athabasca Basin of Saskatchewan, Canada. The company was incorporated in 2016 and is headquartered in Vancouver, Canada. IsoEnergy Ltd. is a subsidiary of NexGen Energy Ltd.", "currency": "EUR", "sector": "Energy", "industry": "Uranium", "exchange": "FRA", "market": "dr_market", "country": "Canada", "city": "Vancouver"}, "IRNG": {"short_name": "INTERNATIONAL RANGER CORPORATIO", "long_name": "International Ranger Corp.", "summary": "International Ranger Corp. operates as a uranium exploration company in Canada and the United States. The company holds interest in the Four Corners Project, which include ten Utah State Metalliferous leases covering an area of approximately 6,580.24 acres and 2,027 unpatented lode mining claims of 40,540 acres located in Emery County, Utah; and Koorsharem Uranium Prospect that consists of 6 mining claims located in Piute County, Utah. It also holds interest in Whiskey Gap Uranium Project comprising 2 metallic mineral permits each containing an area of approximately 36 square miles located in Southern Alberta, Canada; and Foghorn Polymetallic Project, which consists of 3,129.5 hectares mineral claims located in Kamloops, Canada. The company was founded in 1997 and is based in Vancouver, Canada.", "currency": "USD", "sector": "Energy", "industry": "Uranium", "exchange": "PNK", "market": "us_market", "country": "Canada", "city": "Vancouver"}, "ISENF": {"short_name": "ISOENERGY LTD", "long_name": "IsoEnergy Ltd.", "summary": "IsoEnergy Ltd. engages in the acquisition, evaluation, and exploration of uranium mineral properties. It primarily holds a 100% interest each in the Radio, Larocque East, Geiger, and Thorburn Lake projects in the Athabasca Basin of Saskatchewan, Canada. The company was incorporated in 2016 and is headquartered in Vancouver, Canada. IsoEnergy Ltd. is a subsidiary of NexGen Energy Ltd.", "currency": "USD", "sector": "Energy", "industry": "Uranium", "exchange": "PNK", "market": "us_market", "country": "Canada", "city": "Vancouver"}, "ISO.V": {"short_name": "ISOENERGY LTD", "long_name": "IsoEnergy Ltd.", "summary": "IsoEnergy Ltd. engages in the acquisition, evaluation, and exploration of uranium mineral properties. It primarily holds a 100% interest each in the Radio, Larocque East, Geiger, and Thorburn Lake projects in the Athabasca Basin of Saskatchewan, Canada. The company was incorporated in 2016 and is headquartered in Vancouver, Canada. IsoEnergy Ltd. is a subsidiary of NexGen Energy Ltd.", "currency": "CAD", "sector": "Energy", "industry": "Uranium", "exchange": "VAN", "market": "ca_market", "country": "Canada", "city": "Vancouver"}, "IUQ.F": {"short_name": "DENISON MINES CORP.", "long_name": "Denison Mines Corp.", "summary": "Denison Mines Corp. operates as a uranium exploration and development company in Canada. Its flagship project is the 90% interest owned Wheeler River Uranium project located in the Athabasca Basin region in northern Saskatchewan. The company was formerly known as International Uranium Corporation and changed its name to Denison Mines Corp. in December 2006. Denison Mines Corp. is headquartered in Toronto, Canada.", "currency": "EUR", "sector": "Energy", "industry": "Uranium", "exchange": "FRA", "market": "dr_market", "country": "Canada", "city": "Toronto"}, "JTCMF": {"short_name": "JETCOM INC", "long_name": "Jetcom Inc.", "summary": "Jetcom Inc. does not have significant operations. Previously, it was engaged in the exploration, development, and production of minerals in Canada. The company was incorporated in 1968 and is based in Toronto, Canada.", "currency": "USD", "sector": "Energy", "industry": "Uranium", "exchange": "PNK", "market": "us_market", "country": "Canada", "city": "Toronto"}, "KEQ0.F": {"short_name": "VALORE METALS CORP.", "long_name": "ValOre Metals Corp.", "summary": "ValOre Metals Corp., an exploration stage company, engages in the acquisition, exploration, evaluation, and development of mineral resource properties in Canada and Brazil. The company explores for uranium, palladium, platinum, and gold deposits. It holds 100% interests in the Angilak Property that covers an area of 29,595.57 hectares and the Baffin Gold Property that covers an area of 352,727.87 hectares located in Nunavut Territory; the Hatchet Lake Property that consists of 6 claims covering an area of 13,711 hectares located in Saskatchewan; and the Pedra Branca Project that includes 38 exploration licenses covering an area of 38,940 hectares located in north-eastern Brazil. The company was formerly known as Kivalliq Energy Corporation and changed its name to ValOre Metals Corp. in June 2018. ValOre Metals Corp. was incorporated in 2008 and is headquartered in Vancouver, Canada.", "currency": "EUR", "sector": "Energy", "industry": "Uranium", "exchange": "FRA", "market": "dr_market", "country": "Canada", "city": "Vancouver"}, "LEU": {"short_name": "Centrus Energy Corp.", "long_name": "Centrus Energy Corp.", "summary": "Centrus Energy Corp. supplies nuclear fuel and services for the nuclear power industry in the United States, Japan, Belgium, and internationally. The company operates in two segments, Low-Enriched Uranium (LEU) and Technical Solutions. The LEU segment sells separative work units (SWU) component of LEU; SWU and uranium components of LEU; and natural uranium for utilities that operate nuclear power plants. Its LEU is a component that is used in the production of nuclear fuel for reactors to produce electricity. The Technical Solutions segment offers technical, manufacturing, engineering, procurement, construction, and operations services to public and private sector customers, including the American Centrifuge engineering and testing activities. The company was formerly known as USEC Inc. and changed its name to Centrus Energy Corp. in September 2014. Centrus Energy Corp. was founded in 1998 and is headquartered in Bethesda, Maryland.", "currency": "USD", "sector": "Energy", "industry": "Uranium", "exchange": "ASE", "market": "us_market", "country": "United States", "city": "Bethesda"}, "MEY.AX": {"short_name": "MARENICA FPO", "long_name": "Marenica Energy Limited", "summary": "Marenica Energy Limited engages in the exploration and evaluation of uranium deposits in Namibia. The company holds 75% interest in the Marenica uranium project covering an area of 321 square kilometers; and 100% interest in the Mile 72 uranium project covering an area of 21 square kilometers located in the Erongo uranium province in Namibia. It also holds 100% interest in the Koppies and Hirabeb projects located in Namib Desert region of Namibia. The company was formerly known as West Australian Metals Ltd and changed its name to Marenica Energy Limited in November 2009. Marenica Energy Limited was incorporated in 1978 and is based in West Perth, Australia.", "currency": "AUD", "sector": "Energy", "industry": "Uranium", "exchange": "ASX", "market": "au_market", "country": "Australia", "city": "West Perth"}, "MGA.TO": {"short_name": "MEGA URANIUM LTD.", "long_name": "Mega Uranium Ltd.", "summary": "Mega Uranium Ltd., a mineral exploration and development company, explores for uranium prospective properties primarily in Australia and Canada. Its principal properties include the Ben Lomond and Georgetown (Maureen) projects located in Queensland. The company was formerly known as Maple Minerals Corp. and changed its name to Mega Uranium Ltd. in October 2005. Mega Uranium Ltd. was incorporated in 1990 and is headquartered in Toronto, Canada.", "currency": "CAD", "sector": "Energy", "industry": "Uranium", "exchange": "TOR", "market": "ca_market", "country": "Canada", "city": "Toronto"}, "MGAFF": {"short_name": "MEGA URANIUM LTD", "long_name": "Mega Uranium Ltd.", "summary": "Mega Uranium Ltd., a mineral exploration and development company, explores for uranium prospective properties primarily in Australia and Canada. Its principal properties include the Ben Lomond and Georgetown (Maureen) projects located in Queensland. The company was formerly known as Maple Minerals Corp. and changed its name to Mega Uranium Ltd. in October 2005. Mega Uranium Ltd. was incorporated in 1990 and is headquartered in Toronto, Canada.", "currency": "USD", "sector": "Energy", "industry": "Uranium", "exchange": "PNK", "market": "us_market", "country": "Canada", "city": "Toronto"}, "NXE": {"short_name": "Nexgen Energy Ltd.", "long_name": "NexGen Energy Ltd.", "summary": "NexGen Energy Ltd., an exploration and development stage company, engages in the acquisition, exploration, and evaluation of uranium properties in Canada. The company holds a 100% interest in its principal property, the Rook I project that consists of 32 contiguous mineral claims covering 35,065 hectares located in the southwest Athabasca Basin, Saskatchewan. The company is headquartered in Vancouver, Canada.", "currency": "USD", "sector": "Energy", "industry": "Uranium", "exchange": "ASE", "market": "us_market", "country": "Canada", "city": "Vancouver"}, "NXE.TO": {"short_name": "NEXGEN ENERGY LTD", "long_name": "NexGen Energy Ltd.", "summary": "NexGen Energy Ltd., an exploration and development stage company, engages in the acquisition, exploration, and evaluation of uranium properties in Canada. The company holds a 100% interest in its principal property, the Rook I project that consists of 32 contiguous mineral claims covering 35,065 hectares located in the southwest Athabasca Basin, Saskatchewan. The company is headquartered in Vancouver, Canada.", "currency": "CAD", "sector": "Energy", "industry": "Uranium", "exchange": "TOR", "market": "ca_market", "country": "Canada", "city": "Vancouver"}, "P1M.F": {"short_name": "PENINSULA ENERGY LTD.", "long_name": "Peninsula Energy Limited", "summary": "Peninsula Energy Limited, together with its subsidiaries, engages in the exploration, development, and mining of uranium deposits in the United States. It holds a 100% interest in the Lance uranium project situated in Wyoming; and interest in Karoo Uranium Projects, South Africa. The company was formerly known as Peninsula Minerals Limited and changed its name to Peninsula Energy Limited in November 2010. Peninsula Energy Limited was incorporated in 1993 and is based in West Perth, Australia.", "currency": "EUR", "sector": "Energy", "industry": "Uranium", "exchange": "FRA", "market": "dr_market", "country": "Australia", "city": "West Perth"}, "P5X.F": {"short_name": "PUREPOINT URANIUM GRP", "long_name": "Purepoint Uranium Group Inc.", "summary": "Purepoint Uranium Group Inc., a uranium exploration company, engages in the acquisition, exploration, and development of properties for producing uranium in Canada. Its flagship project is the Hook Lake uranium project that covers an area of 28,683 hectares located in the Athabasca Basin, Northern Saskatchewan. Purepoint Uranium Group Inc. was founded in 2002 and is headquartered in Toronto, Canada.", "currency": "EUR", "sector": "Energy", "industry": "Uranium", "exchange": "FRA", "market": "dr_market", "country": "Canada", "city": "Toronto"}, "P8AA.F": {"short_name": "AZARGA URANIUM CORP.", "long_name": "Azarga Uranium Corp.", "summary": "Azarga Uranium Corp. operates as an integrated uranium exploration and development company in the United States and the Kyrgyz Republic. The company owns interests in the Dewey Burdock project covering an area of approximately 12,613 surface acres and 16,962 net mineral acres located in South Dakota; and Gas Hills project covering an area of approximately 1,280 surface acres and 12,960 net mineral acres located to the east of Riverton, Wyoming. It also holds interests in the Centennial project that comprises approximately 1,365 acres of surface rights and 6,238 acres of net mineral rights located in the western part of Weld County in north-eastern Colorado; Aladdin exploration project totaling an area of 5,166 acres of surface rights and 4,618 acres of net mineral rights located in Crook County, Wyoming; and Dewey Terrace project comprising 270 mining claims covering an area of approximately 1,874 acres of surface rights and 7,514 acres of mineral rights located in Weston and Niobrara counties of Wyoming. In addition, the company owns interests in the Juniper Ridge project totaling an area of approximately 640 surface acres and 3,240 net mineral acres located in Carbon County, Wyoming; Shirley Basin project covering an area of approximately 680 surface acres and 3,200 net mineral acres located in the southwest portion of Wyoming; and Ticaboo project that includes 26 mining and 8 placer claims in Garfield County, Utah. Further, it holds interests in the JB property comprising 66 unpatented mining claims covering an area of approximately 1,320 net mineral acres located in San Miguel County, Colorado and San Juan County, Utah; and Powder River Basin prospect consisting of 199 mining claims covers an area of approximately 3,980 acres of net mineral rights in Campbell County, Wyoming. The company was incorporated in 1984 and is based in White Rock, Canada.", "currency": "EUR", "sector": "Energy", "industry": "Uranium", "exchange": "FRA", "market": "dr_market", "country": "Canada", "city": "White Rock"}, "PEN.AX": {"short_name": "PENINSULA FPO", "long_name": "Peninsula Energy Limited", "summary": "Peninsula Energy Limited, together with its subsidiaries, engages in the exploration, development, and mining of uranium deposits in the United States. It holds a 100% interest in the Lance uranium project situated in Wyoming; and interest in Karoo Uranium Projects, South Africa. The company was formerly known as Peninsula Minerals Limited and changed its name to Peninsula Energy Limited in November 2010. Peninsula Energy Limited was incorporated in 1993 and is based in West Perth, Australia.", "currency": "AUD", "sector": "Energy", "industry": "Uranium", "exchange": "ASX", "market": "au_market", "country": "Australia", "city": "West Perth"}, "PENMF": {"short_name": "PENINSULA ENERGY LIMITED", "long_name": "Peninsula Energy Limited", "summary": "Peninsula Energy Limited, together with its subsidiaries, engages in the exploration, development, and mining of uranium deposits in the United States. It holds a 100% interest in the Lance uranium project situated in Wyoming; and interest in Karoo Uranium Projects, South Africa. The company was formerly known as Peninsula Minerals Limited and changed its name to Peninsula Energy Limited in November 2010. Peninsula Energy Limited was incorporated in 1993 and is based in West Perth, Australia.", "currency": "USD", "sector": "Energy", "industry": "Uranium", "exchange": "PNK", "market": "us_market", "country": "Australia", "city": "West Perth"}, "PLU.V": {"short_name": "PLATEAU ENERGY METALS INC", "long_name": "Plateau Energy Metals Inc.", "summary": "Plateau Energy Metals Inc., a junior resource company, engages in the acquisition, exploration, and evaluation of mineral properties in Peru. The company explores for lithium and uranium deposits. It holds interests in Falchani Lithium Project and Macusani Uranium Project in the Puno District of southeastern Peru. The company also holds a total of 151 mining concessions covering approximately 93,000 hectares on the Macusani Plateau in Peru. The company was formerly known as Plateau Uranium Inc. and changed its name to Plateau Energy Metals Inc. in March 2018. The company was founded in 2006 and is headquartered in Toronto, Canada.", "currency": "CAD", "sector": "Energy", "industry": "Uranium", "exchange": "VAN", "market": "ca_market", "country": "Canada", "city": "Toronto"}, "PLUUF": {"short_name": "PLATEAU ENERGY METALS INC", "long_name": "Plateau Energy Metals Inc.", "summary": "Plateau Energy Metals Inc., a junior resource company, engages in the acquisition, exploration, and evaluation of mineral properties in Peru. The company explores for lithium and uranium deposits. It holds interests in Falchani Lithium Project and Macusani Uranium Project in the Puno District of southeastern Peru. The company also holds a total of 151 mining concessions covering approximately 93,000 hectares on the Macusani Plateau in Peru. The company was formerly known as Plateau Uranium Inc. and changed its name to Plateau Energy Metals Inc. in March 2018. The company was founded in 2006 and is headquartered in Toronto, Canada.", "currency": "USD", "sector": "Energy", "industry": "Uranium", "exchange": "PNK", "market": "us_market", "country": "Canada", "city": "Toronto"}, "PTU.V": {"short_name": "PUREPOINT URANIUM GROUP INC.", "long_name": "Purepoint Uranium Group Inc.", "summary": "Purepoint Uranium Group Inc., a uranium exploration company, engages in the acquisition, exploration, and development of properties for producing uranium in Canada. Its flagship project is the Hook Lake uranium project that covers an area of 28,683 hectares located in the Athabasca Basin, Northern Saskatchewan. Purepoint Uranium Group Inc. was founded in 2002 and is headquartered in Toronto, Canada.", "currency": "CAD", "sector": "Energy", "industry": "Uranium", "exchange": "VAN", "market": "ca_market", "country": "Canada", "city": "Toronto"}, "PUMGF": {"short_name": "PUREPOINT URANIUM GROUP INC", "long_name": "Purepoint Uranium Group Inc.", "summary": "Purepoint Uranium Group Inc., a uranium exploration company, engages in the acquisition, exploration, and development of properties for producing uranium in Canada. Its flagship project is the Hook Lake uranium project that covers an area of 28,683 hectares located in the Athabasca Basin, Northern Saskatchewan. Purepoint Uranium Group Inc. was founded in 2002 and is headquartered in Toronto, Canada.", "currency": "USD", "sector": "Energy", "industry": "Uranium", "exchange": "PNK", "market": "us_market", "country": "Canada", "city": "Toronto"}, "QG1A.F": {"short_name": "PLATEAU ENERGY MET.", "long_name": "Plateau Energy Metals Inc.", "summary": "Plateau Energy Metals Inc., a junior resource company, engages in the acquisition, exploration, and evaluation of mineral properties in Peru. The company explores for lithium and uranium deposits. It holds interests in Falchani Lithium Project and Macusani Uranium Project in the Puno District of southeastern Peru. The company also holds a total of 151 mining concessions covering approximately 93,000 hectares on the Macusani Plateau in Peru. The company was formerly known as Plateau Uranium Inc. and changed its name to Plateau Energy Metals Inc. in March 2018. The company was founded in 2006 and is headquartered in Toronto, Canada.", "currency": "EUR", "sector": "Energy", "industry": "Uranium", "exchange": "FRA", "market": "dr_market", "country": "Canada", "city": "Toronto"}, "REL.V": {"short_name": "ROUGHRIDER EXPLORATION LIMITED", "long_name": "Roughrider Exploration Limited", "summary": "Roughrider Exploration Limited, an exploration stage uranium company, explores for and evaluates mineral properties primarily in Canada. It holds 100% interest in the Eldorado, Gin, and Bonanza properties located in the Golden Triangle area of northern British Colombia; 100% interest in the Sterling Silver property covering an area of approximately 844 hectares; and 50% interest in the Genesis uranium project covering approximately 36,757 hectares located to the northeast of the Athabasca Basin. Roughrider Exploration Limited also holds an interest in the Scottie West Property covering approximately 6,358.8 hectares located in the Golden Triangle area. The company was formerly known as Westham Resources Corp. and changed its name to Roughrider Exploration Limited in June 2014. Roughrider Exploration Limited was incorporated in 2011 and is headquartered in Vancouver, Canada.", "currency": "CAD", "sector": "Energy", "industry": "Uranium", "exchange": "VAN", "market": "ca_market", "country": "Canada", "city": "Vancouver"}, "SRSIF": {"short_name": "STRATECO RES INC", "long_name": "Strateco Resources Inc.", "summary": "Strateco Resources Inc. explores for and develops uranium properties in Canada. It holds a 60% interest in the Matoush project that consists of the Matoush, the Matoush Extension, the Eclat, and the Pacific-Bay-Matoush properties located in the Otish Mountains of northern Qu\u00c3\u00a9bec. The company was incorporated in 2000 and is based in Boucherville, Canada.", "currency": "USD", "sector": "Energy", "industry": "Uranium", "exchange": "PNK", "market": "us_market", "country": "Canada", "city": "Boucherville"}, "STND.V": {"short_name": "STANDARD URANIUM LTD", "long_name": "Standard Uranium Ltd.", "summary": "Standard Uranium Ltd., an exploration company, acquires, evaluates, and develops uranium properties in Canada. Its flagship property is the Davidson River Project, which comprise 21 mineral claims covering an area of approximately 25,886 hectares located in the southwest part of the Athabasca Basin, Saskatchewan. The company was founded in 2017 and is headquartered in Vancouver, Canada.", "currency": "CAD", "sector": "Energy", "industry": "Uranium", "exchange": "VAN", "market": "ca_market", "country": "Canada", "city": "Vancouver"}, "STTDF": {"short_name": "STANDARD URANIUM LTD", "long_name": "Standard Uranium Ltd.", "summary": "Standard Uranium Ltd., an exploration company, acquires, evaluates, and develops uranium properties in Canada. Its flagship property is the Davidson River Project, which comprise 21 mineral claims covering an area of approximately 25,886 hectares located in the southwest part of the Athabasca Basin, Saskatchewan. The company was founded in 2017 and is headquartered in Vancouver, Canada.", "currency": "USD", "sector": "Energy", "industry": "Uranium", "exchange": "PNK", "market": "us_market", "country": "Canada", "city": "Vancouver"}, "U9A.F": {"short_name": "URAVAN MINERALS INC.", "long_name": "Uravan Minerals Inc.", "summary": "Uravan Minerals Inc., a development stage mineral exploration company, acquires and explores for mineral properties in Canada. It holds interest in the Outer Ring claims that consists of 4 mineral claims covering an area of approximately 38,658 acres in the Athabasca Basin in northern Saskatchewan. The company was incorporated in 1997 and is headquartered in Calgary, Canada.", "currency": "EUR", "sector": "Energy", "industry": "Uranium", "exchange": "FRA", "market": "dr_market", "country": "Canada", "city": "Calgary"}, "U9T.F": {"short_name": "UR-ENERGY INC.", "long_name": "Ur-Energy Inc.", "summary": "Ur-Energy Inc. engages in the acquisition, exploration, development, and operation of uranium mineral properties. The company holds interests in 12 projects located in the United States. Its flagship property is the Lost Creek project comprising a total of approximately 1,900 unpatented mining claims and three Wyoming mineral leases covering an area of approximately 37,500 acres located in the Great Divide Basin, Wyoming. The company was founded in 2004 and is headquartered in Littleton, Colorado.", "currency": "EUR", "sector": "Energy", "industry": "Uranium", "exchange": "FRA", "market": "dr_market", "country": "United States", "city": "Littleton"}, "UEC": {"short_name": "Uranium Energy Corp.", "long_name": "Uranium Energy Corp.", "summary": "Uranium Energy Corp., together with its subsidiaries, engages in exploration, pre-extraction, extraction, and processing uranium and titanium concentrates in the United States, Canada, and Paraguay. It owns interests in the Palangana mine, Goliad, Burke Hollow, Longhorn, and Salvo projects located in Texas; Anderson, Workman Creek, and Los Cuatros projects situated in Arizona; Slick Rock project in Colorado; Reno Creek project in Wyoming; Diabase project located in Canada; and Yuty, Oviedo, and Alto Paran\u00c3\u00a1 titanium projects in Paraguay. The company was formerly known as Carlin Gold Inc. and changed its name to Uranium Energy Corp. in January 2005. Uranium Energy Corp. was incorporated in 2003 and is based in Corpus Christi, Texas.", "currency": "USD", "sector": "Energy", "industry": "Uranium", "exchange": "ASE", "market": "us_market", "country": "United States", "city": "Corpus Christi"}, "UIS.F": {"short_name": "URANIUM PARTICIP.  CD 1", "long_name": "Uranium Participation Corporation", "summary": "Uranium Participation Corporation is a publicly owned investment manager. The company invests its assets substantially in uranium, equity offerings in uranium and holdings of uranium. The firm also lends its uranium to third parties from time to time. Denison Mines, Inc. operates as the manager of the company. Uranium Participation Corporation was founded on March 15, 2005 and is headquartered in Toronto, Canada.", "currency": "EUR", "sector": "Energy", "industry": "Uranium", "exchange": "FRA", "market": "dr_market", "country": "Canada", "city": "Toronto"}, "UNO-H.V": {"short_name": "NORTHERN URANIUM CORP", "long_name": "Northern Uranium Corp.", "summary": "Northern Uranium Corp. engages in the acquisition and exploration of uranium deposits. The company was formerly known as MPVC Inc. and changed its name to Northern Uranium Corp. in June 2014. Northern Uranium Corp. was incorporated in 2005 and is headquartered in Kelowna, Canada.", "currency": "CAD", "sector": "Energy", "industry": "Uranium", "exchange": "VAN", "market": "ca_market", "country": "Canada", "city": "Kelowna"}, "URC.V": {"short_name": "URANIUM ROYALTY CORP", "long_name": "Uranium Royalty Corp.", "summary": "Uranium Royalty Corp. operates as a pure-play uranium royalty company. It acquires, accumulates, and manages a portfolio of geographically diversified uranium interests. The company holds royalty interests in the Diabase property located in Saskatchewan, Canada; the Anderson project, the Slick Rock project, and the Workman Creek project; and the Langer Heinrich uranium project in Namibia. It also holds royalty interests in the Church Rock, Dewey-Burdock, Lance, Roca Honda, Reno Creek, Roughrider, and Michelin Projects. The Company was incorporated in 2017 and is headquartered in Vancouver, Canada.", "currency": "CAD", "sector": "Energy", "industry": "Uranium", "exchange": "VAN", "market": "ca_market", "country": "Canada", "city": "Vancouver"}, "URE.TO": {"short_name": "UR-ENERGY INC.", "long_name": "Ur-Energy Inc.", "summary": "Ur-Energy Inc. engages in the acquisition, exploration, development, and operation of uranium mineral properties. The company holds interests in 12 projects located in the United States. Its flagship property is the Lost Creek project comprising a total of approximately 1,900 unpatented mining claims and three Wyoming mineral leases covering an area of approximately 37,500 acres located in the Great Divide Basin, Wyoming. The company was founded in 2004 and is headquartered in Littleton, Colorado.", "currency": "CAD", "sector": "Energy", "industry": "Uranium", "exchange": "TOR", "market": "ca_market", "country": "United States", "city": "Littleton"}, "URG": {"short_name": "Ur Energy Inc", "long_name": "Ur-Energy Inc.", "summary": "Ur-Energy Inc. engages in the acquisition, exploration, development, and operation of uranium mineral properties. The company holds interests in 12 projects located in the United States. Its flagship property is the Lost Creek project comprising a total of approximately 1,900 unpatented mining claims and three Wyoming mineral leases covering an area of approximately 37,500 acres located in the Great Divide Basin, Wyoming. The company was founded in 2004 and is headquartered in Littleton, Colorado.", "currency": "USD", "sector": "Energy", "industry": "Uranium", "exchange": "ASE", "market": "us_market", "country": "United States", "city": "Littleton"}, "URPTF": {"short_name": "URANIUM PARTICIPATION CORP", "long_name": "Uranium Participation Corporation", "summary": "Uranium Participation Corporation is a publicly owned investment manager. The company invests its assets substantially in uranium, equity offerings in uranium and holdings of uranium. The firm also lends its uranium to third parties from time to time. Denison Mines, Inc. operates as the manager of the company. Uranium Participation Corporation was founded on March 15, 2005 and is headquartered in Toronto, Canada.", "currency": "USD", "sector": "Energy", "industry": "Uranium", "exchange": "PNK", "market": "us_market", "country": "Canada", "city": "Toronto"}, "UUUU": {"short_name": "Energy Fuels Inc", "long_name": "Energy Fuels Inc.", "summary": "Energy Fuels Inc., together with its subsidiaries, engages in the extraction, recovery, exploration, and sale of conventional and in situ uranium recovery in the United States. The company owns and operates the Nichols Ranch project, the Jane Dough property, and the Hank project located in Wyoming; and the Alta Mesa in-situ uranium project located in Texas, as well as White Mesa Mill in Utah. It also holds interests in uranium and uranium/vanadium properties and projects in various stages of exploration, permitting, and evaluation located in Utah, Wyoming, Arizona, New Mexico, and Colorado. The company was formerly known as Volcanic Metals Exploration Inc. and changed its name to Energy Fuels Inc. in May 2006. Energy Fuels Inc. was incorporated in 1987 and is headquartered in Lakewood, Colorado.", "currency": "USD", "sector": "Energy", "industry": "Uranium", "exchange": "ASE", "market": "us_market", "country": "United States", "city": "Lakewood"}, "UVN.V": {"short_name": "Uravan Minerals Inc.", "long_name": "Uravan Minerals Inc.", "summary": "Uravan Minerals Inc., a development stage mineral exploration company, acquires and explores for mineral properties in Canada. It holds interest in the Outer Ring claims that consists of 4 mineral claims covering an area of approximately 38,658 acres in the Athabasca Basin in northern Saskatchewan. The company was incorporated in 1997 and is headquartered in Calgary, Canada.", "currency": "CAD", "sector": "Energy", "industry": "Uranium", "exchange": "VAN", "market": "ca_market", "country": "Canada", "city": "Calgary"}, "VBO.F": {"short_name": "CGN MINING CO.LTD  HD-,01", "long_name": "CGN Mining Company Limited", "summary": "CGN Mining Company Limited engages in the investment and trading of natural uranium resources. The company is also involved in the property investment activities. It has operations in Hong Kong, the People's Republic of China, Kazakhstan, Canada, and the United Kingdom, rest of Europe. The company was incorporated in 2001 and is headquartered in Wanchai, Hong Kong. CGN Mining Company Limited is a subsidiary of China Uranium Development Company Limited.", "currency": "EUR", "sector": "Energy", "industry": "Uranium", "exchange": "FRA", "market": "dr_market", "country": "Hong Kong", "city": "Wan Chai"}, "VEGYF": {"short_name": "VIRGINIA ENERGY RES INC NEW", "long_name": "Virginia Energy Resources Inc.", "summary": "Virginia Energy Resources Inc., a resource company, focuses on the exploration and development of uranium deposits in the United States. The company owns a 100% interest in the Coles Hill deposit covering an area of 2,960 hectares located in southern Virginia. The company was formerly known as Virginia Uranium Ltd. Virginia Energy Resources Inc. was incorporated in 2007 and is headquartered in Vancouver, Canada.", "currency": "USD", "sector": "Energy", "industry": "Uranium", "exchange": "PNK", "market": "us_market", "country": "Canada", "city": "Vancouver"}, "VMY.AX": {"short_name": "VIMY RES FPO", "long_name": "Vimy Resources Limited", "summary": "Vimy Resources Limited, a resource development company, explores and evaluates uranium projects in Australia. The company's flagship property is the 100% owned Mulga Rock project located to the east-northeast of the Kalgoorlie in Western Australia. The company was formerly known as Energy and Minerals Australia Limited and changed its name to Vimy Resources Limited in December 2014. Vimy Resources Limited was founded in 2006 and is based in West Perth, Australia.", "currency": "AUD", "sector": "Energy", "industry": "Uranium", "exchange": "ASX", "market": "au_market", "country": "Australia", "city": "West Perth"}, "VO.V": {"short_name": "VALORE METALS CORP", "long_name": "ValOre Metals Corp.", "summary": "ValOre Metals Corp., an exploration stage company, engages in the acquisition, exploration, evaluation, and development of mineral resource properties in Canada and Brazil. The company explores for uranium, palladium, platinum, and gold deposits. It holds 100% interests in the Angilak Property that covers an area of 29,595.57 hectares and the Baffin Gold Property that covers an area of 352,727.87 hectares located in Nunavut Territory; the Hatchet Lake Property that consists of 6 claims covering an area of 13,711 hectares located in Saskatchewan; and the Pedra Branca Project that includes 38 exploration licenses covering an area of 38,940 hectares located in north-eastern Brazil. The company was formerly known as Kivalliq Energy Corporation and changed its name to ValOre Metals Corp. in June 2018. ValOre Metals Corp. was incorporated in 2008 and is headquartered in Vancouver, Canada.", "currency": "CAD", "sector": "Energy", "industry": "Uranium", "exchange": "VAN", "market": "ca_market", "country": "Canada", "city": "Vancouver"}, "VUI.V": {"short_name": "VIRGINIA ENERGY RESOURCES INC", "long_name": "Virginia Energy Resources Inc.", "summary": "Virginia Energy Resources Inc., a resource company, focuses on the exploration and development of uranium deposits in the United States. The company owns a 100% interest in the Coles Hill deposit covering an area of 2,960 hectares located in southern Virginia. The company was formerly known as Virginia Uranium Ltd. Virginia Energy Resources Inc. was incorporated in 2007 and is headquartered in Vancouver, Canada.", "currency": "CAD", "sector": "Energy", "industry": "Uranium", "exchange": "VAN", "market": "ca_market", "country": "Canada", "city": "Vancouver"}, "WSTRF": {"short_name": "WESTERN URANIUM & VANADIUM CORP", "long_name": "Western Uranium & Vanadium Corp.", "summary": "Western Uranium & Vanadium Corp. engages in the acquisition and development of uranium and vanadium resource properties in the states of Utah and Colorado, the United States. The company holds interests in the San Rafael uranium project located in Emery County, Utah; the Van 4 mine located in western Montrose County, Colorado; and the Sage mine project situated in San Juan County, Utah, and San Miguel County, Colorado. It also has interests in the Hansen, North Hansen, High Park, and Hansen Picnic Tree projects located in Fremont and Teller Counties, Colorado; the Keota project situated in Weld County, Colorado; and Ferris Haggerty project located in Carbon County, Wyoming. The company was formerly known as Western Uranium Corporation and changed its name to Western Uranium & Vanadium Corp. in October 2018. Western Uranium & Vanadium Corp. was founded in 2006 and is based in Toronto, Canada.", "currency": "USD", "sector": "Energy", "industry": "Uranium", "exchange": "PNK", "market": "us_market", "country": "Canada", "city": "Toronto"}, "WTT.F": {"short_name": "MARENICA ENERGY LTD", "long_name": "Marenica Energy Limited", "summary": "Marenica Energy Limited engages in the exploration and evaluation of uranium deposits in Namibia. The company holds 75% interest in the Marenica uranium project covering an area of 321 square kilometers; and 100% interest in the Mile 72 uranium project covering an area of 21 square kilometers located in the Erongo uranium province in Namibia. It also holds 100% interest in the Koppies and Hirabeb projects located in Namib Desert region of Namibia. The company was formerly known as West Australian Metals Ltd and changed its name to Marenica Energy Limited in November 2009. Marenica Energy Limited was incorporated in 1978 and is based in West Perth, Australia.", "currency": "EUR", "sector": "Energy", "industry": "Uranium", "exchange": "FRA", "market": "dr_market", "country": "Australia", "city": "West Perth"}, "WUC.CN": {"short_name": "WestnUranVan", "long_name": "Western Uranium & Vanadium Corp.", "summary": "Western Uranium & Vanadium Corp. engages in the acquisition and development of uranium and vanadium resource properties in the states of Utah and Colorado, the United States. The company holds interests in the San Rafael uranium project located in Emery County, Utah; the Van 4 mine located in western Montrose County, Colorado; and the Sage mine project situated in San Juan County, Utah, and San Miguel County, Colorado. It also has interests in the Hansen, North Hansen, High Park, and Hansen Picnic Tree projects located in Fremont and Teller Counties, Colorado; the Keota project situated in Weld County, Colorado; and Ferris Haggerty project located in Carbon County, Wyoming. The company was formerly known as Western Uranium Corporation and changed its name to Western Uranium & Vanadium Corp. in October 2018. Western Uranium & Vanadium Corp. was founded in 2006 and is based in Toronto, Canada.", "currency": "CAD", "sector": "Energy", "industry": "Uranium", "exchange": "CNQ", "market": "ca_market", "country": "Canada", "city": "Toronto"}, "XEPRF": {"short_name": "XEMPLAR ENERGY CORPORATION", "long_name": "Xemplar Energy Corp.", "summary": "Xemplar Energy Corp. engages in the acquisition, exploration, and development of marble concession, uranium, and bentonite deposits. The company holds a 60% interest in a marble concession, which covers an area of 168.469 acres located in Markandi District, Abbotabad, as well as two marble concession prospecting licenses covering an area of 288 acres located in Bakot Nala and Bagwa Kas areas, Pakistan. It also holds a 100% interest in the Cape Cross and Warmbad properties that are located in Namibia. The company was formerly known as Consolidated Petroquin Resources Limited and changed its name to Xemplar Energy Corp. in July 2005. Xemplar Energy Corp. was incorporated in 1979 and is headquartered in Vancouver, Canada.", "currency": "USD", "sector": "Energy", "industry": "Uranium", "exchange": "PNK", "market": "us_market", "country": "Canada", "city": "Vancouver"}, "YCA.L": {"short_name": "YELLOW CAKE PLC ORD GBP0.01", "long_name": "Yellow Cake plc", "summary": "Yellow Cake plc, a specialist company, operates in the uranium sector. It is involved in the purchase and holding of triuranium octoxide. The company was founded in 2018 and is headquartered in St Helier, Jersey.", "currency": "GBp", "sector": "Energy", "industry": "Uranium", "exchange": "LSE", "market": "gb_market", "country": "Jersey", "city": "St Helier"}, "YLLXF": {"short_name": "YELLOW CAKE PLC", "long_name": "Yellow Cake plc", "summary": "Yellow Cake plc, a specialist company, operates in the uranium sector. It is involved in the purchase and holding of triuranium octoxide. The company was founded in 2018 and is headquartered in St Helier, Jersey.", "currency": "USD", "sector": "Energy", "industry": "Uranium", "exchange": "PNK", "market": "us_market", "country": "Jersey", "city": "St Helier"}}