{
    "GIM0.F": {
        "short_name": null,
        "long_name": "Grupo de Inversiones Suramericana S.A.",
        "summary": "Grupo de Inversiones Suramericana S.A. operates in the financial services, industry, and corporate venture sectors in Colombia and internationally. The company offers casualty, life, health, and occupational risks insurance, as well as reinsurance; pension, saving, investment, and asset management services; and commercial, consumer, insurance, investment, off-shore, private, and government banking, as well as treasury products. It also produces cement, concrete, and aggregates; provides processed foods, such as cold cuts, crackers, chocolates, coffees, ice cream, pasta, and consumer foods; and offers power generation and distribution, real estate, road and airport concessions, infrastructure, and business support services. In addition, the company provides a technological solution to manage human talent information for companies and consultants; robo-advisory software to structure and manage financial portfolios; a digital marketplace to serve the North American mortgage market; a platform for engagement, marketing, sale, and administration of financial products; a health technology platform; an insurance platform; tools to manage prevention and wellbeing programs; and technology solutions for the insurance industry. Further, it offers a technological platform to understand the behavior of drivers and determine the risk of accidents; provides risk capital fund for early-stage and growing technology companies; and invests in companies that offer other services in complementary sectors. Additionally, the company provides data processing and leasing computer equipment, business consultancy and advisory, and marketing services; management consultancy services; medical, paramedical, dental, and diagnostic aid services; risk management, telecommunication, and outsourcing services, as well as collects Mexican works of art; and vehicle inspection, repair, purchase, and selling services. The company was incorporated in 1997 and is headquartered in Medellin, Colombia.",
        "currency": "None",
        "sector": "Financial Services",
        "industry": "Asset Management",
        "exchange": "FRA",
        "market": "dr_market",
        "country": "Colombia",
        "city": "Medell\u00c3\u00adn"
    }
}