{"5SR.SI": {"short_name": "Zhongmin Baihui", "long_name": "Zhongmin Baihui Retail Group Ltd.", "summary": "Zhongmin Baihui Retail Group Ltd., an investment holding company, owns, operates, and manages a chain of department stores and supermarkets in the People's Republic of China. As of January 1, 2020, it operated 15 self-owned stores, including five supermarkets, as well as three managed stores with a total gross floor area of 211,400 sqm. The company provides its merchandise, lifestyle products, and customer-oriented services to middle income consumers. Zhongmin Baihui Retail Group Ltd. was founded in 1997 and is based in Singapore.", "currency": "SGD", "sector": "Consumer Cyclical", "industry": "Department Stores", "exchange": "SES", "market": "sg_market", "country": "Singapore", "city": "Singapore"}, "BCZ.SI": {"short_name": "Travelite", "long_name": "Travelite Holdings Ltd.", "summary": "Travelite Holdings Ltd. engages in the licensing, manufacture, distribution, and retail of luggage and travel accessories of various brands. The company operates through Departmental Stores, Specialty Stores, Third Party Retailers, Wholesale Distribution, and Gift and Corporate Sales segments. It deals in luggage bags, travelling accessories, travel bags, garments, handbags, fashion apparels, knit wears, wallets, and various types of leather goods and related products. The company markets and sells its products through departmental stores, chain of specialty stores, third party retail outlets, and gift redemption and corporate gift programs in Singapore and Malaysia; and third-party distributors in Brunei, Cambodia, Indonesia, Myanmar, Thailand, Maldives, and Kuwait. Travelite Holdings Ltd. was founded in 1986 and is headquartered in Singapore.", "currency": "SGD", "sector": "Consumer Cyclical", "industry": "Department Stores", "exchange": "SES", "market": "sg_market", "country": "Singapore", "city": "Singapore"}, "I15.SI": {"short_name": "Isetan", "long_name": "Isetan (Singapore) Limited", "summary": "Isetan (Singapore) Limited operates department stores and supermarkets in Singapore. The company operates in two segments, Retail and Property. It operates stores under the Isetan Scotts, Isetan Katong, Isetan Tampines, and Isetan Serangoon Central names. The company also operates online stores; owns and leases properties; and trades in general merchandise. The company was formerly known as Isetan Emporium (Singapore) Private Limited and changed its name to Isetan (Singapore) Limited in 1981. Isetan (Singapore) Limited was founded in 1886 and is headquartered in Singapore. Isetan (Singapore) Limited is a subsidiary of Isetan Mitsukoshi Ltd.", "currency": "SGD", "sector": "Consumer Cyclical", "industry": "Department Stores", "exchange": "SES", "market": "sg_market", "country": "Singapore", "city": "Singapore"}}