{
    "TKA.VI": {
        "short_name": "TELEKOM AUSTRIA AG",
        "long_name": "Telekom Austria AG",
        "summary": "Telekom Austria AG, together with its subsidiaries, provides fixed-line and mobile communications solutions to individuals, commercial and non-commercial organizations, and other national and international carriers. The company offers fixed-line services, including access, Internet, fixed-to-mobile calls, international traffic, voice value-added, interconnection, call center, television, IPTV, and smart home services, as well as data and ICT solutions; and digital mobile communications services, including value-added, text and multimedia messaging, m-commerce, information, and entertainment services. It also provides end-user terminal equipment; digital products; cloud and Internet of Things services; and mobile payment services. As of December 31, 2019, the company provided mobile communication services to approximately 21.3 million customers; and had approximately 6.1 million fixed-line revenue generating units. It has operations in Austria, Bulgaria, Croatia, Belarus, Slovenia, Serbia, and North Macedonia. The company is headquartered in Vienna, Austria. Telekom Austria AG is a subsidiary of Am\u00c3\u00a9rica M\u00c3\u00b3vil, S.A.B. de C.V.",
        "currency": "EUR",
        "sector": "Communication Services",
        "industry": "Telecom Services",
        "exchange": "VIE",
        "market": "at_market",
        "country": "Austria",
        "city": "Vienna"
    },
    "TKAGY": {
        "short_name": "TELEKOM AUSTRIA AKTIENGESELLSCH",
        "long_name": "Telekom Austria AG",
        "summary": "Telekom Austria AG, together with its subsidiaries, provides fixed-line and mobile communications solutions to individuals, commercial and non-commercial organizations, and other national and international carriers. The company offers fixed-line services, including access, Internet, fixed-to-mobile calls, international traffic, voice value-added, interconnection, call center, television, IPTV, and smart home services, as well as data and ICT solutions; and digital mobile communications services, including value-added, text and multimedia messaging, m-commerce, information, and entertainment services. It also provides end-user terminal equipment; digital products; cloud and Internet of Things services; and mobile payment services. As of December 31, 2019, the company provided mobile communication services to approximately 21.3 million customers; and had approximately 6.1 million fixed-line revenue generating units. It has operations in Austria, Bulgaria, Croatia, Belarus, Slovenia, Serbia, and North Macedonia. The company is headquartered in Vienna, Austria. Telekom Austria AG is a subsidiary of Am\u00c3\u00a9rica M\u00c3\u00b3vil, S.A.B. de C.V.",
        "currency": "USD",
        "sector": "Communication Services",
        "industry": "Telecom Services",
        "exchange": "PNK",
        "market": "us_market",
        "country": "Austria",
        "city": "Vienna"
    }
}