{"4IG.BD": {"short_name": "4IG", "long_name": "4iG Nyrt.", "summary": "4iG Nyrt. operates in the information technology (IT) sector in Hungary. The company operates through IT services, Trade, and Other Activities. It engages in the resale of hardware and software products. The company also offers digitalization solutions for various industries, including utility, energy, financial, and public administration, as well as 3D solutions; and managed services, such as outsource operations, IT remote monitoring, PC as a service fleet management, GDPR compliance, BCP-DR, PERIMETER DEFENCE UTM firewall as a service, data center hardware extended warranty, OFFICE 365 backup, and managed security services. In addition, it provides custom solutions, including software development, integration, project management, and quality assurance; planning, migration, and operation; document and process management, and real time cooperation; data asset management; and IT security-consulting services, as well as IT infrastructure services. Further, the company operates enterprise resource planning systems. It also exports its products. 4iG Nyrt. was founded in 1990 and is based in Budapest, Hungary.", "currency": "HUF", "sector": "Technology", "industry": "Information Technology Services", "exchange": "BUD", "market": "hu_market", "country": "Hungary", "city": "Budapest"}}