{"I43.F": {"short_name": "JACQUET METALS O.N.", "long_name": "Jacquet Metals SA", "summary": "Jacquet Metals SA engages in the distribution of specialty steels. It operates through three divisions: JACQUET, STAPPERT, and IMS Group. The company distributes stainless-steel and nickel alloys quarto plates, which are used in water, environment, energy, mechanical and forged metal construction, chemical and agri-food, gas processing and storage, pharmaceutical, and cosmetic sectors. It also distributes long stainless-steel products in the form of bars, profiles, welded tubes, and fittings that are used in the agri-food, chemical, petrochemical, pipefitting, energy, transport, and decoration sectors. In addition, the company distributes carbon, alloy, and stainless-steel engineering steels, and tool steels used in mechanical engineering, public works machinery, agricultural machinery, lifting machinery, car and HGV suppliers, and energy sectors. It operates through a network of 103 distribution facilities located in 25 countries in Europe, Turkey, China, and North America. Jacquet Metals SA was founded in 1962 and is based in Saint-Priest, France.", "currency": "EUR", "sector": "Basic Materials", "industry": "Steel", "exchange": "FRA", "market": "dr_market", "country": "France", "city": "Saint-Priest"}, "JCQ.PA": {"short_name": "JACQUET METALS", "long_name": "Jacquet Metals SA", "summary": "Jacquet Metals SA engages in the distribution of specialty steels. It operates through three divisions: JACQUET, STAPPERT, and IMS Group. The company distributes stainless-steel and nickel alloys quarto plates, which are used in water, environment, energy, mechanical and forged metal construction, chemical and agri-food, gas processing and storage, pharmaceutical, and cosmetic sectors. It also distributes long stainless-steel products in the form of bars, profiles, welded tubes, and fittings that are used in the agri-food, chemical, petrochemical, pipefitting, energy, transport, and decoration sectors. In addition, the company distributes carbon, alloy, and stainless-steel engineering steels, and tool steels used in mechanical engineering, public works machinery, agricultural machinery, lifting machinery, car and HGV suppliers, and energy sectors. It operates through a network of 103 distribution facilities located in 25 countries in Europe, Turkey, China, and North America. Jacquet Metals SA was founded in 1962 and is based in Saint-Priest, France.", "currency": "EUR", "sector": "Basic Materials", "industry": "Steel", "exchange": "PAR", "market": "fr_market", "country": "France", "city": "Saint-Priest"}, "VACD.F": {"short_name": "VALLOUREC EO 0,02", "long_name": "Vallourec S.A.", "summary": "Vallourec S.A., through its subsidiaries, provides tubular solutions for energy and industry sectors in Europe, North America, South America, Asia, the Middle East, and internationally. It operates through Seamless Tubes and Specialty Products segments. It offers seamless tubes for refineries, petrochemical facilities, and floating liquefied natural gas plants, as well as production, storage, and offloading units; casings; tubings; VAM connections; rigid subsea line pipes, onshore rigid line pipes, specialized tubes, and process tubes for transportation of oil and gas; and carbon steel and steel alloy tubes, hollow bars, and connections for the processing of industrial fluids and hydrocarbons. Its oil and gas market services include assistance in lowering tubes, inspecting connections, and supervising assembly; inventory management, advisory, and training services; on-site tube coating and welding services; integrated solutions for the subsea line pipe market comprising welding, coating, insulation, logistics, and service agreements; tube inspection, maintenance, and repair services; on-site services; preparation for drilling operations; well coordination and supply services based on the drilling plan; and repair services for its products and thread tubes. Its power generation market products and services comprise seamless tubes for boilers and steam generators. Its industrial market products and services include tubes and hollow bars, as well as circular, square, rectangular, and octagonal sections; tubular solutions for infrastructure construction; tubes and rings to manufacture cranes, construction machinery, agricultural machinery, and hydraulic cylinders; and tubes and axles for automotive manufacturers. It is also involved in the iron ore production business; and various projects concerning renewable energies. Vallourec S.A. was founded in 1899 and is headquartered in Boulogne-Billancourt, France.", "currency": "EUR", "sector": "Basic Materials", "industry": "Steel", "exchange": "FRA", "market": "dr_market", "country": "France", "city": "Boulogne-Billancourt"}, "VLOUF": {"short_name": "VALLOUREC SA", "long_name": "Vallourec S.A.", "summary": "Vallourec S.A., through its subsidiaries, provides tubular solutions for energy and industry sectors in Europe, North America, South America, Asia, the Middle East, and internationally. It operates through Seamless Tubes and Specialty Products segments. It offers seamless tubes for refineries, petrochemical facilities, and floating liquefied natural gas plants, as well as production, storage, and offloading units; casings; tubings; VAM connections; rigid subsea line pipes, onshore rigid line pipes, specialized tubes, and process tubes for transportation of oil and gas; and carbon steel and steel alloy tubes, hollow bars, and connections for the processing of industrial fluids and hydrocarbons. Its oil and gas market services include assistance in lowering tubes, inspecting connections, and supervising assembly; inventory management, advisory, and training services; on-site tube coating and welding services; integrated solutions for the subsea line pipe market comprising welding, coating, insulation, logistics, and service agreements; tube inspection, maintenance, and repair services; on-site services; preparation for drilling operations; well coordination and supply services based on the drilling plan; and repair services for its products and thread tubes. Its power generation market products and services comprise seamless tubes for boilers and steam generators. Its industrial market products and services include tubes and hollow bars, as well as circular, square, rectangular, and octagonal sections; tubular solutions for infrastructure construction; tubes and rings to manufacture cranes, construction machinery, agricultural machinery, and hydraulic cylinders; and tubes and axles for automotive manufacturers. It is also involved in the iron ore production business; and various projects concerning renewable energies. Vallourec S.A. was founded in 1899 and is headquartered in Boulogne-Billancourt, France.", "currency": "USD", "sector": "Basic Materials", "industry": "Steel", "exchange": "PNK", "market": "us_market", "country": "France", "city": "Boulogne-Billancourt"}, "VLOWY": {"short_name": "VALLOUREC SA", "long_name": "Vallourec S.A.", "summary": "Vallourec S.A., through its subsidiaries, provides tubular solutions for energy and industry sectors in Europe, North America, South America, Asia, the Middle East, and internationally. It operates through Seamless Tubes and Specialty Products segments. It offers seamless tubes for refineries, petrochemical facilities, and floating liquefied natural gas plants, as well as production, storage, and offloading units; casings; tubings; VAM connections; rigid subsea line pipes, onshore rigid line pipes, specialized tubes, and process tubes for transportation of oil and gas; and carbon steel and steel alloy tubes, hollow bars, and connections for the processing of industrial fluids and hydrocarbons. Its oil and gas market services include assistance in lowering tubes, inspecting connections, and supervising assembly; inventory management, advisory, and training services; on-site tube coating and welding services; integrated solutions for the subsea line pipe market comprising welding, coating, insulation, logistics, and service agreements; tube inspection, maintenance, and repair services; on-site services; preparation for drilling operations; well coordination and supply services based on the drilling plan; and repair services for its products and thread tubes. Its power generation market products and services comprise seamless tubes for boilers and steam generators. Its industrial market products and services include tubes and hollow bars, as well as circular, square, rectangular, and octagonal sections; tubular solutions for infrastructure construction; tubes and rings to manufacture cranes, construction machinery, agricultural machinery, and hydraulic cylinders; and tubes and axles for automotive manufacturers. It is also involved in the iron ore production business; and various projects concerning renewable energies. Vallourec S.A. was founded in 1899 and is headquartered in Boulogne-Billancourt, France.", "currency": "USD", "sector": "Basic Materials", "industry": "Steel", "exchange": "PNK", "market": "us_market", "country": "France", "city": "Boulogne-Billancourt"}}