{
    "AND.TO": {
        "short_name": "ANDLAUER HEALTHCARE GROUP INC",
        "long_name": "Andlauer Healthcare Group Inc.",
        "summary": "Andlauer Healthcare Group Inc., a supply chain management company, provides a platform of customized third-party logistics (3PL) and specialized transportation solutions for the healthcare sector in Canada. It operates in two segments, Specialized Transportation and Healthcare Logistics. The company provides specialized temperature controlled services; and ground transportation services, including less-than-truckload and courier services; and air freight forwarding, and dedicated and last mile delivery services. It also offers logistics and distribution services, including warehousing and inventory management, order fulfillment, reverse logistics, and transportation management; and packaging services, such as reusable thermal packaging solutions and trade customization services. The company provides services to healthcare manufacturers, wholesalers, distributors, 3PL providers, and others through a platform of technology-enabled supply chain solutions for a range of products, including pharmaceuticals, vaccines, biologics, narcotics, precursors, active pharmaceutical ingredients, over-the-counter, cosmetics, health and beauty aids, and medical devices, as well as natural, animal, and consumer health. Andlauer Healthcare Group Inc. was founded in 1991 and is headquartered in Vaughan, Canada.",
        "currency": "CAD",
        "sector": "Healthcare",
        "industry": "Medical Distribution",
        "exchange": "TOR",
        "market": "ca_market",
        "country": "Canada",
        "city": "Vaughan"
    }
}