{
    "TFIIN.MX": {
        "short_name": "TFI INTERNATIONAL INC",
        "long_name": "TFI International Inc.",
        "summary": "TFI International Inc. provides transportation and logistics services in the United States, Canada, and Mexico. The company operates through Package and Courier, Less-Than-Truckload (LTL), Truckload (TL), and Logistics segments. The Package and Courier segment engages in the pickup, transport, and delivery of items. The LTL segment is involved in the pickup, consolidation, transportation, and delivery of smaller loads. The TL segment offers expedited transportation, flatbed, tank container, and dedicated services, as well as TL brokerage services. This segment carries full loads directly from the customer to the destination using a closed van or specialized equipment. The Logistics segment provides asset-light logistics services, including brokerage, freight forwarding, and transportation management, as well as small package parcel delivery. The company is also involved in the transportation and storage of food grade liquids, industrial chemicals, specialty oils, and waxes; transportation of dry and liquid bulk and offers other value-add services; provision of transportation services for explosives, mining and steel products, electronics, and household goods; and provision of contract hauling services for aggregate materials, wood by-products, agriculture/commodities, beets, dry bulk materials, railroad traction sand, and food grade product materials. In addition, it transports viscous materials and provides a patented solution for the storage, handling, and transportation of these materials for the food and industrial products industries; offers medical logistics, final mile, and brokerage services; and provides brokerage, direct trucking, and warehousing services. As of December 31, 2019, TFI International Inc. had 7,772 tractors, 25,505 trailers, and 9,826 independent contractors. The company was formerly known as TransForce Inc. and changed its name to TFI International Inc. in December 2016. TFI International Inc. is headquartered in Montreal, Canada.",
        "currency": "MXN",
        "sector": "Services",
        "industry": "Trucking",
        "exchange": "MEX",
        "market": "mx_market",
        "country": "Canada",
        "city": "Montreal"
    }
}