{
    "284.F": {
        "short_name": "SERSTECH AB",
        "long_name": "Serstech AB",
        "summary": "Serstech AB provides chemical identification instruments worldwide. It offers the Serstech 100 Indicator, a handheld, small, and light Raman spectrometer for measuring chemicals, such as explosives, narcotics, toxic industrial chemicals, pharmaceuticals, and chemical warfare agents; and ChemDash, a chemical intelligence software for measuring, storing, analyzing, and sharing information. It provides its solutions for explosive, CBRN and hazmat, narcotics, pharma, material inspection and QA, process control, product development, and educational applications. Serstech AB was founded in 2006 and is headquartered in Lund, Sweden.",
        "currency": "EUR",
        "sector": "Basic Materials",
        "industry": "Chemicals",
        "exchange": "FRA",
        "market": "dr_market",
        "country": "Sweden",
        "city": "Lund"
    },
    "SERT.ST": {
        "short_name": "Serstech AB",
        "long_name": "Serstech AB",
        "summary": "Serstech AB provides chemical identification instruments worldwide. It offers the Serstech 100 Indicator, a handheld, small, and light Raman spectrometer for measuring chemicals, such as explosives, narcotics, toxic industrial chemicals, pharmaceuticals, and chemical warfare agents; and ChemDash, a chemical intelligence software for measuring, storing, analyzing, and sharing information. It provides its solutions for explosive, CBRN and hazmat, narcotics, pharma, material inspection and QA, process control, product development, and educational applications. Serstech AB was founded in 2006 and is headquartered in Lund, Sweden.",
        "currency": "SEK",
        "sector": "Basic Materials",
        "industry": "Chemicals",
        "exchange": "STO",
        "market": "se_market",
        "country": "Sweden",
        "city": "Lund"
    }
}