{"AMARIN-R.BK": {"short_name": "AMARIN PRINTING AND PUBLISHING", "long_name": "Amarin Printing and Publishing Public Company Limited", "summary": "Amarin Printing and Publishing Public Company Limited, together with its subsidiaries, engages in the publishing, advertising, and publications distribution businesses in Thailand. It offers a range of printing services, such as artwork creative design, photography, image retouching, and digital printing services, as well as packaging printing service. The company also conceptualizes, compiles, designs, publishes, and delivers offline content, including books, magazines/newsletters, cards/leaflets/brochures/posters, annual reports, anniversary books, pocket books, and gifts; online content, which include e-books, VDO clips, websites, and applications, as well as augmented reality and social network content; and visual content comprising infographics, illustrations, picture, and photography content. In addition, it engages in the organization of events, fairs, and seminars, as well as offsite training programs for private companies and SMEs; purchase, procurement, lease, and leasehold of various assets; and production, distribution, retail, and wholesale of various publication formats that include Thai and translated foreign language books, Praew and Sudsapda magazines for women, electronic creative media comprising video and multimedia teaching materials, and other printed materials. The company also produces television programmes; and engages in broadcasting and advertising through digital television. As of December 31, 2019, it operated 142 bookstores under the Nai-In name. The company was formerly known as Amarin Printing Group Company Limited and changed its name to Amarin Printing and Publishing Public Company Limited in 1993. Amarin Printing and Publishing Public Company Limited was founded in 1976 and is headquartered in Bangkok, Thailand.", "currency": "THB", "sector": "Communication Services", "industry": "Publishing", "exchange": "SET", "market": "th_market", "country": "Thailand", "city": "Bangkok"}, "AMARIN.BK": {"short_name": "AMARIN PRINTING AND PUBLISHING", "long_name": "Amarin Printing and Publishing Public Company Limited", "summary": "Amarin Printing and Publishing Public Company Limited, together with its subsidiaries, engages in the publishing, advertising, and publications distribution businesses in Thailand. It offers a range of printing services, such as artwork creative design, photography, image retouching, and digital printing services, as well as packaging printing service. The company also conceptualizes, compiles, designs, publishes, and delivers offline content, including books, magazines/newsletters, cards/leaflets/brochures/posters, annual reports, anniversary books, pocket books, and gifts; online content, which include e-books, VDO clips, websites, and applications, as well as augmented reality and social network content; and visual content comprising infographics, illustrations, picture, and photography content. In addition, it engages in the organization of events, fairs, and seminars, as well as offsite training programs for private companies and SMEs; purchase, procurement, lease, and leasehold of various assets; and production, distribution, retail, and wholesale of various publication formats that include Thai and translated foreign language books, Praew and Sudsapda magazines for women, electronic creative media comprising video and multimedia teaching materials, and other printed materials. The company also produces television programmes; and engages in broadcasting and advertising through digital television. As of December 31, 2019, it operated 142 bookstores under the Nai-In name. The company was formerly known as Amarin Printing Group Company Limited and changed its name to Amarin Printing and Publishing Public Company Limited in 1993. Amarin Printing and Publishing Public Company Limited was founded in 1976 and is headquartered in Bangkok, Thailand.", "currency": "THB", "sector": "Communication Services", "industry": "Publishing", "exchange": "SET", "market": "th_market", "country": "Thailand", "city": "Bangkok"}, "MATI-R.BK": {"short_name": "MATICHON PUBLIC COMPANY LIMITED", "long_name": "Matichon Public Company Limited", "summary": "Matichon Public Company Limited, together with its subsidiaries, publishes newspapers, pocket books, and journals in Thailand. It also provides advertisement services; various types of advertising media, including advertising materials; and training services and various seminar, as well as organizes exhibitions and various activities. The company was founded in 1978 and is based in Bangkok, Thailand.", "currency": "THB", "sector": "Communication Services", "industry": "Publishing", "exchange": "SET", "market": "th_market", "country": "Thailand", "city": "Bangkok"}, "MATI.BK": {"short_name": "MATICHON PUBLIC COMPANY LIMITED", "long_name": "Matichon Public Company Limited", "summary": "Matichon Public Company Limited, together with its subsidiaries, publishes newspapers, pocket books, and journals in Thailand. It also provides advertisement services; various types of advertising media, including advertising materials; and training services and various seminar, as well as organizes exhibitions and various activities. The company was founded in 1978 and is based in Bangkok, Thailand.", "currency": "THB", "sector": "Communication Services", "industry": "Publishing", "exchange": "SET", "market": "th_market", "country": "Thailand", "city": "Bangkok"}, "NINE-R.BK": {"short_name": "NATION INTERNATIONAL EDUTAINMEN", "long_name": "Nation International Edutainment Public Company Limited", "summary": "Nation International Edutainment Public Company Limited imports, publishes, and distributes publications primarily in Thailand. The company operates in two segments: Publishing and Services, and New Media. It also produces and sells pocket books, comic books, and children printing; TV programs; provides advertisements through TV media; and offers digital media and character management services. The company is headquartered in Bangkok, Thailand.", "currency": "THB", "sector": "Communication Services", "industry": "Publishing", "exchange": "SET", "market": "th_market", "country": "Thailand", "city": "Bangkok"}, "NINE.BK": {"short_name": "NATION INTERNATIONAL EDUTAINMEN", "long_name": "Nation International Edutainment Public Company Limited", "summary": "Nation International Edutainment Public Company Limited imports, publishes, and distributes publications primarily in Thailand. The company operates in two segments: Publishing and Services, and New Media. It also produces and sells pocket books, comic books, and children printing; TV programs; provides advertisements through TV media; and offers digital media and character management services. The company is headquartered in Bangkok, Thailand.", "currency": "THB", "sector": "Communication Services", "industry": "Publishing", "exchange": "SET", "market": "th_market", "country": "Thailand", "city": "Bangkok"}, "POST-R.BK": {"short_name": "BANGKOK POST PUBLIC COMPANY LIM", "long_name": "Bangkok Post Public Company Limited", "summary": "Bangkok Post Public Company Limited, together with its subsidiaries, publishes and distributes newspapers, magazines, and books in Thailand. It operates through three segments: Publishing and Advertising, Production of Television Programs, and Other. The company publishes, distributes, and advertises newspapers, including the Bangkok Post, an English-language daily newspaper; Post Today, a Thai-language online news site; and News Clear, an online video channel for current affairs and trends, as well as Thai-language magazines, including Elle Thailand, Forbes Thailand, and Cleo Thailand in print and online formats. It also publishes books under the Post Books name; produces multimedia and video content for television and digital media; and organizes events and conferences. In addition, the company provides information services through various social media platforms; and general printing services to various government and business organizations. In addition, it publishes and distributes English-language lifestyle magazines, such as Guru and B Magazine, as well as offers content creation, event management, and digital marketing solutions for public agencies and private organizations. The company was formerly known as The Post Publishing Public Company Limited and changed its name to Bangkok Post Public Company Limited in May 2017. Bangkok Post Public Company Limited was founded in 1946 and is headquartered in Bangkok, Thailand.", "currency": "THB", "sector": "Communication Services", "industry": "Publishing", "exchange": "SET", "market": "th_market", "country": "Thailand", "city": "Bangkok"}}