{"XFAB.PA": {"short_name": "X-FAB", "long_name": "X-FAB Silicon Foundries SE", "summary": "X-FAB Silicon Foundries SE operates as an analog/mixed-signal semiconductor technology foundry. The company manufactures silicon wafers for automotive, industrial, consumer, medical, consumer and mobile communications, and other applications; and analog-digital integrated circuits, sensors, and micro-electro-mechanical systems. It also provides manufacturing and design support services for customers that design analog/mixed-signal ICs and other semiconductor devices, as well as engineering and prototyping services, technical services, and design kits. In addition, the company offers foundry services for integrated device manufacturers, original equipment manufacturers, and fabless semiconductor companies. It operates in Belgium, Germany, the United Kingdom, Austria, France, Switzerland, Denmark, Sweden, Finland, Singapore, China, Japan, Thailand, Malaysia, Korea, Taiwan, Hong Kong, New Zealand, the United States, and internationally. The company was founded in 1992 and is based in Tessenderlo, Belgium. X-FAB Silicon Foundries SE is a subsidiary of XTRION NV.", "currency": "EUR", "sector": "Technology", "industry": "Semiconductors", "exchange": "PAR", "market": "fr_market", "country": "Belgium", "city": "Tessenderlo"}, "XFB.F": {"short_name": "X-FAB SILICON FOUNDRIES", "long_name": "X-FAB Silicon Foundries SE", "summary": "X-FAB Silicon Foundries SE operates as an analog/mixed-signal semiconductor technology foundry. The company manufactures silicon wafers for automotive, industrial, consumer, medical, consumer and mobile communications, and other applications; and analog-digital integrated circuits, sensors, and micro-electro-mechanical systems. It also provides manufacturing and design support services for customers that design analog/mixed-signal ICs and other semiconductor devices, as well as engineering and prototyping services, technical services, and design kits. In addition, the company offers foundry services for integrated device manufacturers, original equipment manufacturers, and fabless semiconductor companies. It operates in Belgium, Germany, the United Kingdom, Austria, France, Switzerland, Denmark, Sweden, Finland, Singapore, China, Japan, Thailand, Malaysia, Korea, Taiwan, Hong Kong, New Zealand, the United States, and internationally. The company was founded in 1992 and is based in Tessenderlo, Belgium. X-FAB Silicon Foundries SE is a subsidiary of XTRION NV.", "currency": "EUR", "sector": "Technology", "industry": "Semiconductors", "exchange": "FRA", "market": "dr_market", "country": "Belgium", "city": "Tessenderlo"}}