{"FCMC.PA": {"short_name": "FERM.CAS.MUN.CANNE", "long_name": "Soci\u00e9t\u00e9 Fermi\u00e8re du Casino Municipal de Cannes", "summary": "Soci\u00c3\u00a9t\u00c3\u00a9 Fermi\u00c3\u00a8re du Casino Municipal de Cannes operates casinos and hotels in France. The company operates 3 hotels with 565 rooms, suites, and cottages under the H\u00c3\u00b4tel Barri\u00c3\u00a8re Le Majestic, the H\u00c3\u00b4tel Barri\u00c3\u00a8re Le Gray d'Albion, and the H\u00c3\u00b4tel Barri\u00c3\u00a8re Le Carl Gustaf St-Barth brands; and 2 casinos, including 350 slot machines and 38 games tables under the Casino Barri\u00c3\u00a8re Croisette and Casino Barri\u00c3\u00a8re Les Princes brands. It also operates 8 restaurants, 9 bars, and 1 spa. The company was founded in 1919 and is based in Cannes, France.", "currency": "EUR", "sector": "Consumer Cyclical", "industry": "Resorts & Casinos", "exchange": "PAR", "market": "fr_market", "country": "France", "city": "Cannes"}, "PARP.PA": {"short_name": "GROUPE PARTOUCHE", "long_name": "Groupe Partouche SA", "summary": "Groupe Partouche SA, through its subsidiaries, operates casinos, hotels, restaurants, dancehalls, and bars in France, other European countries, and internationally. The company operates through three divisions: Casino, Hotel, and Other Activities. Its casinos offer table games, such as Boule; American, English, or French roulette; Casino War; Punto Banco; Blackjack; Stud Poker; Texas Hold'em Poker; Omaha Poker 4 high; Bingo; electronic roulette; electronic Blackjack; and electronic Texas Hold'em Poker, as well as slot machines. The company also owns and operates diners, gourmet and themed restaurants, and health spas and golf courses; develops television (TV) programs and mobile TV gaming offerings; interactive game shows associated with an online gaming offering; markets gaming solutions and lotteries; and produces televised programs and events. In addition, it operates Quarisma, a platform for the real time management of quality services between customers and casino operators; and manages casino information systems, as well as data communication hardware and networks. Further, the company engages in real estate and sports betting activities. As of October 31, 2019, it operated 42 casinos with 5,108 slot machines installed in France and 617 machines installed internationally, as well as 997 electronic English roulette wheels installed in France and 22 wheels installed internationally; 10 hotels with approximately 420 rooms; and 80 restaurants, as well as 5 health spas and 2 golf courses. The company was founded in 1973 and is headquartered in Paris, France. Groupe Partouche SA is a subsidiary of Financiere Partouche SA.", "currency": "EUR", "sector": "Consumer Cyclical", "industry": "Resorts & Casinos", "exchange": "PAR", "market": "fr_market", "country": "France", "city": "Paris"}, "PZ21.F": {"short_name": "GRP. PARTOUCHE INH.EO 20", "long_name": "Groupe Partouche SA", "summary": "Groupe Partouche SA, through its subsidiaries, operates casinos, hotels, restaurants, dancehalls, and bars in France, other European countries, and internationally. The company operates through three divisions: Casino, Hotel, and Other Activities. Its casinos offer table games, such as Boule; American, English, or French roulette; Casino War; Punto Banco; Blackjack; Stud Poker; Texas Hold'em Poker; Omaha Poker 4 high; Bingo; electronic roulette; electronic Blackjack; and electronic Texas Hold'em Poker, as well as slot machines. The company also owns and operates diners, gourmet and themed restaurants, and health spas and golf courses; develops television (TV) programs and mobile TV gaming offerings; interactive game shows associated with an online gaming offering; markets gaming solutions and lotteries; and produces televised programs and events. In addition, it operates Quarisma, a platform for the real time management of quality services between customers and casino operators; and manages casino information systems, as well as data communication hardware and networks. Further, the company engages in real estate and sports betting activities. As of October 31, 2019, it operated 42 casinos with 5,108 slot machines installed in France and 617 machines installed internationally, as well as 997 electronic English roulette wheels installed in France and 22 wheels installed internationally; 10 hotels with approximately 420 rooms; and 80 restaurants, as well as 5 health spas and 2 golf courses. The company was founded in 1973 and is headquartered in Paris, France. Groupe Partouche SA is a subsidiary of Financiere Partouche SA.", "currency": "EUR", "sector": "Consumer Cyclical", "industry": "Resorts & Casinos", "exchange": "FRA", "market": "dr_market", "country": "France", "city": "Paris"}, "SFCA.PA": {"short_name": "SOC FRANC CASINOS", "long_name": "Soci\u00e9t\u00e9 Fran\u00e7aise de Casinos Soci\u00e9t\u00e9 Anonyme", "summary": "Soci\u00c3\u00a9t\u00c3\u00a9 Fran\u00c3\u00a7aise de Casinos Soci\u00c3\u00a9t\u00c3\u00a9 Anonyme operates casinos in France. The company is also involved in the provision of food and hotel management services. As of October 31, 2017, it operated 6 casinos. The company was founded in 1993 and is based in Paris, France.", "currency": "EUR", "sector": "Consumer Cyclical", "industry": "Resorts & Casinos", "exchange": "PAR", "market": "fr_market", "country": "France", "city": "Paris"}}