{"21E.F": {"short_name": "ELIOR GROUP SCA  EO -,01", "long_name": "Elior Group SA", "summary": "Elior Group SA provides contract catering and support services in France, the United States, the United Kingdom, Spain, Italy, India, and internationally. It offers contract catering services to business and industry, education, and health and welfare sectors under the Elior brand. The company also offers a range of value-added services under the Elior Services brand, such as cleaning and hygiene services for hotels, industrial sites, shops and retail outlets, and food industry; biological cleaning and hospitality services in the healthcare sector; and facility management and support services, including reception, internal mail handling, minor repairs and maintenance, gardening, etc. for corporate clients. As of January 12, 2021, it operated approximately 23,500 restaurants and points of sale. The company was founded in 1991 and is headquartered in Paris, France.", "currency": "EUR", "sector": "Consumer Cyclical", "industry": "Restaurants", "exchange": "FRA", "market": "dr_market", "country": "France", "city": "Paris"}, "ALDBL.PA": {"short_name": "BERNARD LOISEAU", "long_name": "Bernard Loiseau S.A.", "summary": "Bernard Loiseau S.A. operates hotels, restaurants, and spas in France. The company is based in Saulieu, France.", "currency": "EUR", "sector": "Consumer Cyclical", "industry": "Restaurants", "exchange": "PAR", "market": "fr_market", "country": "France", "city": "Saulieu"}, "ELIOR.PA": {"short_name": "ELIOR GROUP", "long_name": "Elior Group SA", "summary": "Elior Group SA provides contract catering and support services in France, the United States, the United Kingdom, Spain, Italy, India, and internationally. It offers contract catering services to business and industry, education, and health and welfare sectors under the Elior brand. The company also offers a range of value-added services under the Elior Services brand, such as cleaning and hygiene services for hotels, industrial sites, shops and retail outlets, and food industry; biological cleaning and hospitality services in the healthcare sector; and facility management and support services, including reception, internal mail handling, minor repairs and maintenance, gardening, etc. for corporate clients. As of January 12, 2021, it operated approximately 23,500 restaurants and points of sale. The company was founded in 1991 and is headquartered in Paris, France.", "currency": "EUR", "sector": "Consumer Cyclical", "industry": "Restaurants", "exchange": "PAR", "market": "fr_market", "country": "France", "city": "Paris"}, "MLTBM.PA": {"short_name": "TOQUEBLANCHEMONDE", "long_name": "Les Toques Blanches du Monde Soci\u00e9t\u00e9 Anonyme", "summary": "Les Toques Blanches du Monde SA produces, brands, and sells gourmet products. The company markets its products in private spaces and hotels worldwide. It serves customers online. The company was founded in 2008 and is based in Lyon, France.", "currency": "EUR", "sector": "Consumer Cyclical", "industry": "Restaurants", "exchange": "PAR", "market": "fr_market", "country": "France", "city": "Lyon"}}