{"BFSA.DE": {"short_name": "BEFESA S.A. ORD. O.N.", "long_name": "Befesa S.A.", "summary": "Befesa S.A., a recycling services company, offers waste management solutions. It operates through two segments, Steel Dust Recycling Services and Aluminium Salt Slags Recycling Services. The Steel Dust Recycling Services segment collects and recycles steel dust and other steel residues generated in the production of crude, stainless, and galvanized steel. The Aluminium Salt Slags Recycling Services segment recycles salt slags and spent pot linings; and recovers and sells salt, aluminum concentrate, and aluminum oxides. This segment also collects and recycles aluminum scrap and other aluminum residues, such as aluminium drosses, shavings, and cuttings; and produces secondary aluminum alloys for automotive and construction industries. The company also offers logistics and waelz oxide treatment services; develops projects and technology; and operates as a marketing company. It has operations in Spain, Germany, France, the United Kingdom, rest of Europe, South Korea, and internationally. The company was founded in 1987 and is based in Luxembourg City, Luxembourg.", "currency": "EUR", "sector": "Industrials", "industry": "Waste Management", "exchange": "GER", "market": "de_market", "country": "Luxembourg", "city": "Luxembourg City"}, "BFSA.F": {"short_name": "BEFESA S.A. ORD. O.N.", "long_name": "Befesa S.A.", "summary": "Befesa S.A., a recycling services company, offers waste management solutions. It operates through two segments, Steel Dust Recycling Services and Aluminium Salt Slags Recycling Services. The Steel Dust Recycling Services segment collects and recycles steel dust and other steel residues generated in the production of crude, stainless, and galvanized steel. The Aluminium Salt Slags Recycling Services segment recycles salt slags and spent pot linings; and recovers and sells salt, aluminum concentrate, and aluminum oxides. This segment also collects and recycles aluminum scrap and other aluminum residues, such as aluminium drosses, shavings, and cuttings; and produces secondary aluminum alloys for automotive and construction industries. The company also offers logistics and waelz oxide treatment services; develops projects and technology; and operates as a marketing company. It has operations in Spain, Germany, France, the United Kingdom, rest of Europe, South Korea, and internationally. The company was founded in 1987 and is based in Luxembourg City, Luxembourg.", "currency": "EUR", "sector": "Industrials", "industry": "Waste Management", "exchange": "FRA", "market": "dr_market", "country": "Luxembourg", "city": "Luxembourg City"}}