{
  "IQCD.QA": {
    "city": "Doha",
    "country": "Qatar",
    "currency": "QAR",
    "exchange": "DOH",
    "industry": "Chemicals",
    "long_name": "Industries Qatar Q.P.S.C.",
    "market": "qa_market",
    "sector": "Basic Materials",
    "short_name": "Industries Qatar QPSC",
    "state": null,
    "summary": "Industries Qatar Q.P.S.C., through its subsidiaries, engages in the petrochemical, fertilizer, and steel businesses primarily in Qatar. Its Petrochemicals segment produces and sells ethylene, polyethylene, methyl-tertiary-butyl-ether, methanol, caustic soda, ethylene dichloride, vinyl chloride monomer, Sulphur, pyrolysis gasoline, mixed LPG, and other petrochemical products. The company's Fertilizers segment produces and sells urea, ammonia, melamine, and urea formaldehyde condensate. Its Steel segment produces and sells direct reduced and hot briquetted iron; and steel coils, bars, billets, and other products. The company also exports its products. The company was founded in 1969 and is headquartered in Doha, Qatar. Industries Qatar Q.P.S.C. is a subsidiary of Qatar Petroleum.",
    "website": "http://www.iq.com.qa",
    "zipcode": null
  },
  "MPHC.QA": {
    "city": "Doha",
    "country": "Qatar",
    "currency": "QAR",
    "exchange": "DOH",
    "industry": "Chemicals",
    "long_name": "Mesaieed Petrochemical Holding Company Q.P.S.C.",
    "market": "qa_market",
    "sector": "Basic Materials",
    "short_name": "Mesaieed Petrochemical Holding ",
    "state": null,
    "summary": "Mesaieed Petrochemical Holding Company Q.P.S.C., through its subsidiaries, manufactures and sells petrochemical products in Qatar, the Middle East, Asia, Africa, Indian sub-continent, and Europe. The company operates through two segments, Petrochemicals and Chlor-Alkali. It is involved in the production and sale of ethylene, polyolefins, 1-hexene, C4+, polyethylene, normal alpha olefins, pyrolysis gasoline, C3 and C4, caustic soda, ethylene dichloride, vinyl chloride monomer, and hydrochloric acid. The company was founded in 2013 and is headquarterd in Doha, Qatar. Mesaieed Petrochemical Holding Company Q.P.S.C. is a subsidiary of Qatar Petroleum.",
    "website": "http://www.mphc.com.qa",
    "zipcode": null
  }
}
